human,system,
회사를 다니다가 그만두니 대인관계가 좁아지네,사회생활을 하실때보다 사람들을 덜 만나셔서 그러신건가요?,
회사를 그만둔지 오래되니 점점 대화가 안돼,누구와 대화가 안된다는 말씀이신가요?,
참 사람 인생이라는건 알수가 없어,갑자기 무슨 말씀이신지요?,
와이프가 나를 무시하는 것 같아 속상하네.,어떤 일이 있으셨어요.,
사람들을 못만나니 우울해.,요즘 만나시지 못하나요?,
부모님이 돌아가셔서 너무허무해.,언제 돌아가셨나요?,
희망이 없다면 살기가 힘들거야.,목표가 없이산다는것은 무기력해질거예요.,
요새 너무 외롭고 쓸쓸해.,최근 들어 외로움을 느끼시는군요. 좀 더 자세히 말씀해주실 수 있으신가요?,
요즘 우리 가족에게는 희망이 없어.,최근 희망이 없다고 느끼시는군요. 자세히 말씀해주실 수 있으신가요?,
이제 나는 삶의 희망이 없어.,삶에 희망이 없다고 느끼시는군요. 자세히 말씀해주실 수 있으신가요?,
은퇴한 지 오 년이 지났는데 지금까지도 하릴없는 백수로 등산이나 다니고 있어 저절로 한숨이 나오네.,은퇴한 지 오 년이 지나셨군요.,
혼자 살다 보니 누구랑 이야기하는 것도 귀찮아.,누구랑 이야기 하는 것을 좋아하지 않으시군요.,
사회에서 더 설 자리가 없는 것 같아,최근에 무슨 일이 있으셨나요? ,
불쌍해서 눈물이 계속 나와.,왜 그러시는지 말씀해주실 수 있으세요?,
나는 아내가 무서워.,언제부터 부인을 무섭다고 느끼셨나요?,
내가 죽으면 장례식에 몇 명이나 참석할까?,장례식에 대해 생각하시는 이유가 있으세요?,
친한 친구가 또 세상을 떠났어.,너무 슬프시겠어요. 많이 친한 친구이셨나요?,
이 세상과의 연결고리가 점점 끊어지나 봐. 나 자신이 쓸쓸하고 외로워져.,사회와 점점 멀어져서 외로운 생각이 드시나 봐요. 어떨 때 가장 슬슬 한 감정이 드시나요?,
예전에는 이사람 저사람 만나서 차 한잔하고 놀러도 가고 했는데.,예전에는 많이 놀러다니셨나보네요.,
얼마 전에 친구들이랑 저녁을 먹었는데 내가 저녁값을 낼까 말까 망설였던 기억이 나네.,왜 망설이셨나요?,
사별하고 혼자 사는 것이 정말 힘드네.,많이 힘드신가요?,
나이가 들면 대인 관계가 원만하게 안 되는 점이 나한테만 해당될까?,대인 관계에 어려움을 느끼시나요?,
자녀들도 다 결혼을 하고 가장이 되어 내 품에서 떨어져 나가니까 왠지 거리감이 생겨.,자녀들에게 거리감이 느껴지시나 보네요.,
싫증을 느끼는 성격. 꾸준함보다 새로운 것에 매력이 더 있는 듯한 성격이 문제다.,얘기를 더 들어보고 싶어요.,
온종일 멍하니 앉아만 있어.,무기력하신 상태인가봐요.,
오늘 친구들 모임인데 나가고 싶지 않아서 안 나갔어.,그러셨군요. 안 나간 이유라도 있으셨나요?,
혼자 못 움직인다고 쓸모 없는 짐짝 취급 받다니 정말 서운해. ,무슨 일이 있으셨나요?,
이젠 이 집에 나 혼자만 남았어.,같이 살던 가족들이 떠나신 건가요?,
요즘 마누라가 자꾸 구박하는데 미칠 지경이야,어떤 일로 구박당한다고 느끼실까요?,
나 취직을 알아봐야 할 것 같아.,어떤 연유에서 취직을 고려하게 되셨을까요? ,
자식들한테 자꾸 지적을 하게 돼.,그런 본인의 모습이 흡족하지 않으신가요?,
가족도 같이 클때나 가족인 거 같아.,가족들과 사이가 안좋으신가요?,
큰언니가 저세상으로 갔어.,큰언니를 잃은 슬픔이 크시겠어요. 지금 어떤 상태이신가요?,
남편이 죽은 다음부터는 나도 살면 안된다는 생각이 계속 들어.,부군이 돌아가셔서 혼자 사는 것은 의미가 없다고 생각하시는군요.,
아들이 사고를 쳐 교도소에 갔어.,아드님 일로 무척 마음이 상하셨겠어요. ,
직장 다닌다고 애들을 소홀히 할 거면 뭐하러 낳았을까. ,일과 육아를 제대로 병행하지 못해서 마음이 많이 불편하신 것 같습니다,
언니가 지난달에 저세상으로 갔어.,떠나보낸 언니분이 무척 그리우신가 봅니다. ,
얼마전에 고소를 당했네.,어쩌다가 고소를 당하게 되셨나요?,
나 요새 죽고 싶어.,죽고 싶은 마음이 드실 정도로 마음이 아프시군요.,
얼마 전에 아버지가 돌아가셨네.,아버님 일로 힘드시겠어요.,
아들이 교도소에 수감 중이야.,수감 중인 아드님때문에 마음이 편치 않으시겠어요.,
이제 아내가 나한테 밥도 잘 안 차려주려고 해. 세 끼에서 두 끼가 됐어.,원래 세 끼를 드셨는데 부인이 잘 안 차려주셔서 두 끼만 드시는 상황이시군요?,
요즘 많은 사람이 경제적인 이유로 죽는다는 기사를 봤을 때만 해도 이게 나와 관련된 이야기인 줄 몰랐어.,어떤 관련성을 말씀하시는 건가요?,
공황장애 때문에 나는 평생 사회에 나가지 못할 거 같아서 걱정돼.,공황장애 때문에 사회에 나가지 못할까 봐 걱정되시는군요.,
딸이 너무 걱정이야. 얼마 전에 남편한테 폭행을 당한다는 소식을 전해 들었어.,딸이 너무 걱정되네요. 속상하시겠어요,
언제까지 힘쓰는 일을 해야 할지 모르겠어. 얼마 전 다친 허리도 아직 낫지 않아서 불안해.,몸 쓰는 일로 건강을 해칠까 염려되시나 봐요.,
부모님이 나를 너무 감싸고 돌아. 내가 혼자 할 수 있는 건 아무것도 없어.,부모님의 과잉보호로 혼자 할 수 있는 것이 없는 것 같아 힘드시군요.,
회사에서 받은 스트레스 때문에 별것도 아닌 일로 우리 딸에게 화를 내버렸어.,자신이 딸에게 화풀이한 것에 대해 실망하셨군요.,
이제 나이를 너무 많이 먹었는지 모두 나보다 먼저 다 떠나가고 나만 남았어.,주위에 사람들이 다 떠나고 혼자 남은 것 때문에 마음이 안 좋으시군요.,
내가 정신적으로 불안할 때 내가 기대고 의지할 사람이 없어서 너무 힘들고 슬퍼.,힘들 때 기대고 의지할 사람이 없어서 더 힘들고 슬프셨군요.,
남들은 취업이다 결혼이다 잘 해나가는 것 같은데. 나는 어째서 되는 게 하나도 없을까?,다른 사람들과 비교되는 감정 때문에 마음이 아주 힘들고 슬프시겠어요.,
내 친구가 내 팔 등에 찍힌 상처를 보고 말았어. 이제는 희망이 없고 비관적이야.,비관적인 마음이 있으시군요. 어떤 이유에서 그런 감정이 들었는지 여쭤봐도 될까요?,
사람들이 나를 인정해 주지 않아서 고독과 무위가 생겼고 앞으로도 희망이 안 보여.,조금 더 구체적으로 말씀해 주시겠어요?,
젊은 시절부터 지금까지 사회생활을 하며 살아왔지만 남은 건 고독뿐인 것 같아서 너무 외로워.,지금까지 쭉 사회생활을 하며 살아오면서 남은 게 고독뿐이라 외로워하시는군요.,
오늘이 남편의 기일인데 너무 슬퍼서 아무것도 집중이 안 돼.,남편분의 기일이라 슬프시겠군요.,
자식들이 모두 출가해서 집에 혼자 있다 보니 너무 우울해.,아무도 없는 집에 혼자 있으셔서 많이 우울하시겠어요.,
나는 좋은 직장에서 높은 연봉을 받고 살 거로 생각했는데 현실은 그렇지 않아서 착잡해.,생각했던 자신의 모습과 달라 마음이 안 좋으시군요.,
자식들 키워봐야 다 소용없다는 말이 맞나 봐. 셋이나 있어도 이렇게 외로운 걸 보면.,외로운 기분이 들어서 힘드시군요.,
우울증 때문에 사람을 만나는 게 너무 힘들어.,우울증 때문에 사람을 만나는 것이 힘드시군요.,
아이들이 요즘 사춘기라 자꾸 엇나가네. 사이가 좋아질 기미가 안 보여.,자녀분들과 관계가 원만하지 못해 고충이 크시겠어요.,
이제 좀 살만한데 암이라니 하늘이 무너지는 기분이야.,암 진단을 받아서 하늘이 무너지는 기분이시군요.,
딸이 학원을 하나 더 다니고 싶다고 했는데 더 일을 늘릴 수가 없어서 안 된다고 했어.,자녀분이 학원을 더 다니고 싶다고 했는데 못 보내줘서 마음이 안 좋으시군요.,
결혼 전에는 그이랑 살고 싶었는데 이젠 잘 모르겠어. 희망이 없어.,결혼 생활 중 회의감을 느끼시고 있군요. 왜 그렇게 느끼셨어요?,
아이를 좋은 환경에서 교육하고 싶은데 여건이 안되어서 속상해.,좋은 환경에서 교육하고 싶은데 여건이 안되어서 속상하시군요.,
남편이 퇴직해 내가 일을 하는데 경제적으로 어려워졌어. 살기 싫다고 딸에게 말할 때가 많아.,남편의 퇴직으로 인한 경제적 어려움으로 자녀에게 비관적인 말씀을 하시는군요.,
한 끼 대강 먹으면 어때. 엄마는 그걸 못 보고 나가는 나를 붙잡고 먹여 보내려고 하셔.,부모님께서 식사를 챙겨주시는 것이 불편하시군요.,
이번 모의고사를 완전히 망쳐버려서 절망적이야. 원서 쓸 때 참고할 텐데 어쩌지?,모의고사를 망쳐서 속이 많이 상했군요.,
귀가 잘 안 들려서 힘들어. 젊은 나이에 보청기를 끼기도 그렇고.,정말 힘드시겠군요. 고민이 깊겠어요.,
부모님께 경제적으로 도움을 드리고 싶은데 지금 내 상황이 너무 힘들어.,상황이 마음처럼 되지 않아 걱정이 되셨군요.,
부모님 간섭 때문에 내 맘대로 할 수 있는 게 없어.,뜻대로 할 수 있는 게 없어서 답답하겠어요.,
아내와 사별한 이후 아들과 어떤 교류도 없이 지내고 있어. 내가 왜 사는 건지 모르겠어.,아내와 사별한 이후 아들과 교류 없이 지낸다는 사실이 슬프셨군요.,
자식만 바라보고 살았는데 자식도 날 떠나고 남은 사람이 하나도 없네.,곁에 남은 사람들이 줄어들어 허탈함을 느끼시는군요. 많이 공허하셨겠어요.,
내가 나이가 들어 은퇴를 하자 아내의 행동이 달라졌어. 마음에 안 들면 폭력부터 써.,은퇴 후 아내와 갈등에 많이 속상하시겠어요.,
오늘 건강검진 결과가 나왔는데 암이래. 남편에게 차마 못 말하겠어.,암에 걸리셨다니 마음이 속상하시고 슬프시겠어요.,
늙을수록 아내가 나를 벌레 대하듯 대해. 사는 게 의미가 없어.,아내가 사용자님을 막 대하셔서 힘드시겠어요.,
아내가 교통사고로 세상을 떠났는데 아이들을 돌볼 마음의 여유가 없어.,아내가 세상을 떠나고 자녀들을 돌볼 마음의 여유가 없으시군요.,
어제가 내 아내 발인이었네. 집사람 없이 어떻게 남은 인생을 살아가나.,아내가 돌아가셔서 정말 슬프시겠어요.,
엄마는 나보다 동생을 더 좋아해.,어머니가 동생을 더 좋아하는 것 같아 기분이 상했군요.,
이십 년째 연락이 없는 딸한테 연락하고 싶은데 딸이 연락을 안 받을 것 같아서 우울해.,딸이 연락을 받지 않을 것 같아 우울하시군요.,
나이가 들어 퇴직을 했더니 대인관계가 축소되었어. 혼자인 내가 너무 비관적이야.,퇴직을 하고 대인관계가 축소되어 비관적이라고 느끼셨겠군요.,
경쟁 사회 속에서 불안장애를 앓고 있는 난 사회적 응원을 받지 못하는 비관적인 삶을 사는 것 같아.,사회적 지지 없는 경쟁 사회 속에서 불안장애를 겪으며 비관적인 감정을 느끼시는군요.,
어제도 아버지한테 맞았어.,맞은 곳이 아프겠네요.,
당뇨에 걸려서 인슐린을 투약해야 하는데 아프고 힘들어.,몸이 아프셔서 힘드셨겠어요.,
친구들도 하나둘씩 다 떠나고 이젠 진짜 나 혼자 남았구먼. 내 인생은 이미 끝났어.,친구들이 모두 떠나셔서 외로우시군요.,
생활비를 위해 청소부로 일하는 내가 부끄러운지 친구들이 떠나갔어. 앞으로는 쭉 외롭겠지.,친구들이 떠나가셔서 마음이 정말 아프시겠어요.,
남편이 먼저 죽으니 혼자 남은 나를 무시하는 사람이 많아졌어. 죽고 싶고 비참해.,남편이 돌아가신 후 사용자님을 무시하는 사람들 때문에 비참한 감정이 드시는군요.,
나 지금 보니 공부를 정말 못하더라고. 앞으로 어떡해야 할까?,학업에 대한 고민이 있으시군요.,
나 이제 겨우 오십 대인데 암이래. 하고 싶은 거 다 하지도 못했는데 이제는 끝이야.,하고 싶은 일들이 많은데 예기치도 않게 병에 걸리게 된다니 마음이 안 좋으시겠어요.,
장교의 특성상 지역 이동이 많은데 주변 사람들과 자주 만나지 못해 허무한 기분이야.,직업군 특성으로 인해 고독과 무위를 느끼시는군요.,
자식들 다 결혼하고 나니까 텅 빈 집에 나 혼자만 남아서 너무 외로워.,혼자 집에 계셔서 외로우시겠어요.,
난 내가 하고 싶은 진로가 정해져 있는데 부모님이 날 너무 과잉보호하셔서 희망이 없어.,하고 싶은 진로가 부모님의 과잉보호 때문에 희망이 없다고 느껴져서 속상하시겠어요.,
나는 전망에 대한 희망이 없어. 내 미래는 비참할 것만 같아.,미래에 대한 고민으로 힘들어하시고 계시는군요.,
오늘 병원에 갔는데 백내장이 진행 중이래. 이젠 희망이 없어.,질병이 진행 중이라 절망스럽군요.,
같이 일하는 언니들 비위 맞추기가 너무 힘들어. 은근히 괴롭혀서 스트레스가 심해.,사람들과의 문제로 고민이시군요. 정말 힘드시겠어요.,
남편도 세상을 떠나고 혼자 남아 아픈 몸으로 이제 아무것도 못 하고 살겠지.,혼자 남았고 몸도 아파서 무기력한 기분이시군요.,
친구와 사격 내기를 했는데 시력이 좋지 않아서 질 수밖에 없었어. 그래서 억울했어.,시력이 좋지 않아 친구에게 질 수밖에 없어서 억울하셨겠어요.,
스트레스성 발기부전이 생기고 자신감이 하락했어. 나는 이제 결혼도 못 하고 죽겠지.,신체적 문제로 인해 자신감이 하락하셔서 괴로우시군요.,
아내가 얼마 전에 세상을 떠났는데 그거 때문에 많이 힘들어.,아내와 사별하셔서 때문에 많이 힘드시군요.,
내 아내가 죽었어. 모아 놓은 돈도 별로 없고 이제 난 끝이야.,아내가 죽어 괴로움을 느끼고 계시는군요.,
아들과 딸이랑 너무 멀어졌어. 얼굴 보기가 힘드니까 외롭고 허탈해.,자녀분들과 멀어져서 고독과 무위를 느끼시는군요.,
남편이 위암이라고 진단을 받았어. 남편의 건강이 좋아질 방법은 없는 것 같아.,남편이 아프셔서 힘드시겠어요.,
병환이 깊던 아내가 세상을 뜨고 말았어. 이젠 홀로 살아야 하는데 희망이 없다네.,배우자를 떠나보내고 나서 많이 외롭고 힘드시군요.,
아직은 멀쩡하다고 누가 도와주지도 않고 애들도 떠나서 오지 않으니 왜 사는지 모르겠군.,아무도 곁에 없어서 쓸쓸하시군요.,
저혈압 때문에 너무 힘들어. 아직 젊은데도 몸이 약해서 희망이 없는 것 같아.,건강 문제로 인해 스트레스를 받으시는군요.,
애들도 시집 장가를 보내고 나니 결국 혼자 남는구나. 외롭다.,혼자라는 생각에 외로우시군요.,
오늘도 아빠한테 맞았는데 도와줄 사람도 없고 난 이제 희망이 없어.,아버지의 학대 때문에 많이 힘드시겠어요.,
감기에 걸렸는데 새엄마는 나한테 관심도 없어. 너무 서러워.,감기에 걸렸는데도 새어머니가 관심이 없어서 서러우시군요.,
아버지가 재혼하신 후로 너무 스트레스받아. 만성 두통이 생긴 것 같아.,가정 문제로 마음이 안 좋으시군요.,
딸과 안 본 지 오래됐어 딸이 너무 보고 싶어.,딸이 보고 싶어서 많이 힘드시겠어요.,
친구들은 다 짝을 찾아서 결혼하는데 나만 결혼 상대가 없어. 나는 희망이 없어.,다른 친구들은 결혼하는데 사용자님께서는 아직 좋은 짝을 찾지 못하셔서 많이 힘드셨군요.,
난 고졸이고 세상 물정을 잘 몰라. 남편이 지금까지 그런 부분을 채워줬는데 이제 없어.,남편분이 의지가 많이 되는 분이었던 것 같은데 힘드시겠어요.,
나는 정신적으로 장애가 있어. 주변에서 도움을 주지도 않아 힘들어.,많이 힘드시겠군요.,
가정폭력으로 아빠가 경찰서에 잡혀가는 걸 친구가 봤어. 너무 부끄럽고 창피해서 사라지고 싶어.,가정폭력으로 경찰서에 가게 된 아버지를 친구가 알게 되어 속상하고 힘드시군요.,
농구부에서 내가 키가 제일 작아. 아무래도 내가 이번 선수로 뽑히긴 힘들 거야.,키 때문에 선수 발탁에 대한 두려움을 가지고 있으시겠어요.,
아내가 죽은 지 어느새 한 달이 되었어. 혼자서 지내기가 너무 쓸쓸해.,배우자와의 사별 때문에 힘드시겠어요.,
친구와 놀다가 아빠한테 맞은 상처를 들키고 말았어. 나 너무 괴로워.,친구에게 상처를 들키게 되어 많이 혼란스러우시겠어요.,
운동선수인데 상처를 입어 장래 선수 생활이 불투명하단 진단을 받았어. 눈앞이 캄캄하다.,그 사실을 알게 된 순간 무척 상심이 크셨겠어요.,
친구들과 가족과 관련된 이야기가 나올 때마다 마음이 불편해. 어머니가 재혼하셨거든.,혼자 간직하고 싶은 가정사 때문에 친구들과 이야기할 때 많이 불편하시겠어요.,
결혼생활이 길어질수록 어째 외로움만 더해지는 것 같아. 아내가 나를 무시하는 느낌이 들어.,사랑하는 분과 편안한 마음으로 함께하지 못해서 마음이 아주 슬프고 힘드시겠어요.,
이번 수학 시험 망했어. 나는 이제 아빠한테 맞아 죽을지도 몰라.,수학 시험을 망쳐서 부모님께 혼날 것이 걱정되시는군요.,
남편이 죽었어. 난 이제 누구와 함께 살아가야 하지?,남편분이 돌아가셔서 슬퍼하시는군요.,
우리 집이 넉넉하지 않아 자식들에게 해줄 수 있는 게 없어.,집안 사정이 좋지 않아 마음이 괴로우시군요.,
사람들이 점점 내 주위에서 떠나고 있어. 내 노년에 아무런 희망이 안 보여.,대인관계로 인해 마음이 괴로우시겠군요.,
부모님은 날 너무 속박해. 통금시간에 조금 늦었다고 너무 뭐라고 해.,부모님이 그런 일로 화를 내서 슬프시군요.,
나는 이제 혼자야. 나는 늙었고 내 주변엔 아무도 없어.,혼자라고 느껴져서 많이 외로우셨겠어요.,
회사에서 프로젝트를 맡아서 수험생인 아들을 돌보지 못해. 두 가지 모두 집중하지 못하는 내가 싫어.,일과 아들 돌보는 것을 병행하지 못하는 스스로가 싫군요.,
여태껏 혼자 하는 일만 하고 혼자 살았더니 한평생 살면서 친구도 가족도 없어서 허탈해.,지금까지 한평생 혼자서 지내서 허탈하시군요.,
이번 시험에는 꼭 합격해야 하는데 불안해. 떨어질 것 같아.,시험에 합격하지 못할까 봐 불안하시겠어요.,
이제 자식들이 다 커서 잘 보러 오지도 않고 전화도 자주 안 해.,자녀분들이 연락이 잘 없어서 아주 속상하시겠어요.,
내가 병원 신세를 지게 되면서부터 새엄마랑 아빠의 관계도 삐걱거리는 것 같아.,몸도 아픈데 부모님 사이까지 걱정되는 모양이군요.,
아내의 폭언이 날이 갈수록 심해져서 참기가 힘들어. 결혼 생활을 이대로 유지해도 될까?,아내의 폭언 때문에 힘드시군요.,
내가 몸이 약해져서 그런가 아내가 자꾸 나에게 욕을 하고 때려. 너무 불행해.,아내가 자꾸 욕을 하고 때려서 불행하시군요.,
부모님이 나의 진로에 대해 너무 많은 걱정을 하셔서 선택할 수 있는 희망이 없어지는 것 같아.,부모님의 지나치신 걱정으로 진로에 대해 많이 힘드셨군요.,
아버지가 술만 마시면 나를 발로 차고 때리셔. 어떻게 살아야 할까?,아버지의 학대로 힘드시군요.,
암으로 입원한 지도 일 년이 넘었어. 이젠 나으리라는 희망도 없고 스트레스만 받아.,스트레스 때문에 힘드시겠어요.,
주위에 내 편이 없어. 나는 안 될 사람인가 봐.,옆에서 지지해주는 사람이 없어서 힘드시군요.,
척추 디스크를 앓고 있어서 아픈데 새엄마가 비용이 많이 든다며 치료를 반대하셔.,새어머니가 치료를 반대하셔서 힘드시군요.,
주변 친구들보다 키가 작아서 여자들에게도 놀림을 받아. 스트레스가 심해.,키가 작다는 생각에 스트레스를 받으시는군요.,
나이도 있는데 정신질환을 앓고 있어. 모두가 나를 떠났어.,고독감을 느끼셔서 힘드시겠어요.,
애들을 다 키워놓으면 뭐 해. 와이프가 이렇게 갑자기 떠나다니 더 살아갈 희망이 없어.,아내를 먼저 떠나보내셔서 마음이 정말 힘드시겠어요.,
공부하기 너무 힘들어. 이러다가 대학에 떨어질 것 같아.,공부 때문에 불안하고 힘드셨겠어요.,
이번에 건강검진을 받으면서 내가 만성질환자라는 걸 알게 됐어. 선생님 직업을 잃을지도 몰라.,만성질환자라 직업을 잃을까 봐 슬프시겠어요.,
부모님도 배우자도 모두 떠나고 나 홀로 남아 살아가고 있어. 가진 것도 없고 희망도 없어.,가족을 떠나보내시고 그립고 외로우시겠어요.,
부모님이 내 진로 문제에 너무 간섭하셔서 답답해.,부모님께서 진로에 지나치게 관여하시는 것 같아 답답하셨군요.,
아토피 때문에 피부가 뒤집어졌는데 깨끗한 피부를 가진 사람들을 볼 때마다 화가 나.,아토피 때문에 스트레스를 받으시는군요.,
이번에도 승진을 하지 못했어. 작은 아이에게 학원을 보내줘야 하는데 어떡하지?,경제적으로 자식에게 해주지 못해 많이 힘드시겠어요.,
육아 때문에 진짜 힘들다. 난 엄마가 될 준비가 안 됐는데 왜 이런 사고를 친 걸까.,육아 스트레스로 인해서 많이 힘드시겠어요.,
장애를 겪고 있는 것에 대해 아무도 내게 관심을 가져주지 않아.,관심을 가져주지 않아 마음이 안 좋으시군요.,
아내가 죽고 나서 아무것도 안 하고 싶어졌어. 나에게는 희망이 없는 것 같아,아내가 돌아가시고 나서 많이 힘드시군요. 조금 더 자세히 말씀해 주시겠어요.,
한 여자와 결혼생활을 오래 하다 보니 이제 즐거움도 모르겠고 다 귀찮아.,오래된 결혼생활에 지치셨군요.,
은퇴하고 친구들이나 가족들의 지지가 사라지니 허탈한 기분만 들어.,은퇴하고 사회적 지지가 적어져 허탈한 기분이 드시는군요.,
독거노인인 나는 기댈 곳도 없고 우울증도 심해져서 삶에 대한 희망이 없어.,우울증이 심해져서 삶의 희망도 잃어버리셔서 힘드시겠어요.,
직장인이지만 드라마 작가를 하고 싶어. 하지만 작가는 돈이 모이지 않아서 힘들 것 같아.,드라마 작가를 하고 싶군요. 현실적인 부분 때문에 속상하겠어요.,
딸이 결혼하고 연락도 없고 집에 잘 내려오지도 않아서 섭섭해.,딸이 결혼 후에 아무런 왕래가 없어 섭섭하시군요.,
돈도 없고 내가 생각하는 것과 현실이 너무 달라서 희망이 없어.,현실과 이상의 괴리가 있어서 희망이 없으시군요.,
내가 돈은 없어 아픈 아내를 수술도 못 한 채 떠나보낸 것 같아.,아내가 돌아가셨군요. 슬프시겠어요.,
나이가 드니 자식들이 나를 다 떠나네. 아무도 엄마를 돌아봐 주지 않으니 정말 절망적이다.,자식들이 곁을 떠나서 많이 절망적이시군요.,
내 아내가 죽었어. 돈도 많이 없는데 이제 어떻게 살지도 모르겠고 그냥 죽고 싶어.,아내의 죽음으로 미래가 걱정되시는군요.,
자꾸 몸이 아파서 병원에 가보니까 유방암 말기라고 진단받아서 더 이상 삶에 희망이 없어.,갑자기 병에 걸리셔서 심적으로 많이 힘드시겠어요.,
우리 부모님이 항상 나에게 유치원생 대하듯이 말해서 스트레스받아.,부모님이 어린아이처럼 대하셔서 스트레스를 받는군요. 많이 힘드시겠어요.,
아내가 긴 투병 끝에 끝내 가버렸어. 나는 이제 어떻게 살지?,아내와 사별로 너무 슬프실 것 같아요.,
나도 이제 나이가 들어가는데 아직도 아이가 생기지 않아 너무 걱정돼.,아이가 생기지 않아 많이 걱정되셨군요.,
젊을 때 모아둔 돈도 떨어져 가는 마당에 부인도 가버렸네. 이젠 더는 희망이 없어.,비관적인 상황에 너무 힘드시군요.,
아빠랑 엄마가 매일 일기와 숙제 검사를 해. 도대체 내가 누굴 위해 공부를 하는 걸까?,좀 더 구체적으로 말씀해 주시겠어요?,
