human,system,
데이트라면 둘이 같이 무언가를 해야 하는데 자기 혼자만 게임을 하고 있으니 상처받았어.,상처받은 마음을 위로하기 위해 어떻게 하면 될까요?,
이제 혼자 집에 있으려니 집이 유달리 커 보여. 이 외로움을 무엇으로 채우지?,외로운 기분에서 벗어나기 위해 무엇을 할 수 있을까요?,
그동안 많이 부탁했지만 이번엔 정말로 마지막 부탁이었는데 정말 마음이 아프군.,계속 제안을 했는데 거절당하셔서 마음이 안 좋으시겠어요. 이제 내가 무엇을 하는 게 좋을까요?,
내가 뭘 잘못했는지 모르겠어. 매일 열심히 일해서 돈 벌어다 주고 싸운 적도 없는데.,어딘가에 이 고민을 털어놓을 사람이 있을까요?,
하루 아침에 이런 일이 나에게 벌어지니 너무 어이가 없고 암울하다.,어떻게 하면 마음의 상처가 아물까요?,
집안에 나 혼자 남자라 목욕탕도 혼자 가는데 이런 취미도 못 끼고 쓸쓸하다.,어떻게 하면 문제가 해결될까요?,
내가 저것들 먹여 살리겠다고 가장으로서 얼마나 노력했는데 그걸 몰라주네.,많이 서운하시겠어요. 어떻게 하면 마음이 풀릴까요?,
이제 나 혼자 남겨졌어. 어쩜 이리도 하늘은 무심하신지 나보고 어찌 살라는 거야.,지금 나는 이 상황을 벗어나기 위해 무엇을 할 수 있을까요?,
같이 은퇴를 앞둔 내 친구는 아내와 카페를 차린다던데 나는 무엇을 해야 할까 답답해.,마음이 편하지 않으시겠어요. 걱정을 덜어내기 위해 현재 할 수 있는 일이 무엇이 있을까요?,
노후 준비용 이었는데 너무 상처야. 세상에 나 혼자인 느낌이야.,지금의 상황을 개선하려면 무엇을 해야 할까요?,
다들 나한테 의지하는데 나는 의지할 곳이 없어.,어떻게 하면 지금 상황을 벗어날 수 있을까요?,
나도 회사에서 친한 사람이 생기면 좋겠어.,친한 사람을 만들기 위해 무엇을 하는 것이 좋을까요?,
난 직원들이랑 대화를 하고 싶어.,직원들과 대화를 하기 위해 무엇을 하는 것이 좋을까요?,
그동안 내가 능력 있다고 생각했는데 아니었나 봐. 너무 속상해.,이 상황을 어떻게 해결하실 걸까요?,
내가 필요할 때 도움 청할 곳이 없다는 게 막막하고 외로워.,지금 이 상황을 벗어나기 위한 다른 방법은 없을까요?,
치료를 받지 못할까 봐 무서워.,지금 이 상황에서 치료를 받기 위해 할 수 있는 일은 없을까요?,
나에게 연을 끊은 자식도 서운하고 그런 자식들로 하여금 지원도 받지 못하다니 막막해.,지금 이 상황을 극복하기 위해 어떻게 하면 좋을까요?,
아내라도 있었으면 좋았을 텐데. 혼자라서 너무 외롭고 슬퍼.,외로운 감정에서 벗어나기 위한 방법이 있지 않을까요?,
돈도 없는데 치료비 때문에 너무 힘들다.,치료비 해결을 위한 방법이 있지 않을까요?,
정말 친한 친구였는데 뒤통수를 쳤어. 신고하는 거 밖에 모르겠어.,신고 외에도 사기 당한 것을 도움 받을 방법이 있지 않을까요?,
치료하면서 계속 일을 하니까 더 아픈 것 같아.,일을 하지 않고서 치료를 받을 수 있는 방법이 있지 않을까요?,
응. 내가 나라에서 지원을 받는 상황이라 마음이 불편하고 안 좋네.,상황을 극복하기 위한 방법이 있나요?,
나는 주변엔 사람이 많았어. 그런데 내 입원 소식을 듣고 그 누구도 연락이 없는 거야.,상황 변화를 위한 방법이 뭐가 있을까요?,
그냥 모든 게 두려워. 기침이 시작되면 정신을 잃을 만큼 힘드니까.,그렇군요. 상황을 호전 시키기 위해 할 수 있는게 있을까요?,
한 달 전 큰 수술을 했고 모든 게 약해졌는데 돈 문제까지 겹치니 마음이 복잡해.,그럼 지금의 기분에서 벗어나기 위해 무언가 할 수 있는 것은 있을까요?,
친구들도 다들 나처럼 은퇴해서 할 일이 없는 사람들이니 만나도 대화 주제가 없어.,현재의 상황을 개선하려면 어떻게 하면 좋을까요?,
우리 동네 복지관에 있는 사람들은 대부분 여성이야. 마음 맞는 동성 친구와 어울리고 싶어.,동성 친구를 좀 더 많이 만날 방법이 없을까요?,
동네 복지관에 가도 다들 자기 남편이나 부인과 자식들 이야기라 소외감이 들어.,가족 이야기를 하지 않고도 마음 맞는 친구들을 찾을 방법이 있을까요?,
이야기를 나누어도 벽이 있는 느낌이 들고 다들 나와는 친해지려 하지 않아.,지금의 상황을 개선할 방법은 없을까요?,
다 잘되라고 한 소리인데 아내가 기분 나쁘다고 들으려 하질 않아.,아내의 기분을 고려한 바람직한 대화 방법은 뭐가 있을까요?,
서로 원만히 넘어가면 될 것을 노인네가 그냥 넘기질 않네.,다툼을 줄이려면 어떻게 해야 할까요?,
전엔 이렇지 않았는데 내가 너무 가정에 무심했던가? 후회돼.,가족과의 관계를 회복하기 위해서는 어떤 방법이 좋을까요?,
요즘은 나 혼자만 외딴 섬에 있는 것 같아서 외로워.,혼자 고립돼있다고 느끼시는군요. 어떻게 하면 지금의 감정을 벗어날 수 있을까요?,
동료들하고는 사이가 좋았었는데 나한테는 해고가 큰 상처라 더 어려운 거 같아.,힘드시겠어요. 이 문제를 어떻게 풀어나갈 수 있을까요?,
사람한테 상처받은 적이 있어서 누구를 만나서 무엇을 해야 할지 더 막막한 것 같아.,답답하고 속상하시겠어요. 지금 무엇을 하는 게 도움이 될까요?,
이러다 정말 나 혼자만 외톨이가 될까 봐 걱정이야.,정말 속상하시겠어요. 이 외로움을 어떻게 하면 좋을까요?,
가족도 없어서 기댈 곳이 없어. 너무 힘들다.,어떻게 하면 현재 상황을 잘 변화시킬 수 있을까요?,
우리 노인정이 교류가 활발해서 행사 참여를 중요하게 여기거든.,현재 상황에서 무엇을 할 수 있을까요?,
내가 당뇨가 있어 자주 아팠어. 이번에도 별거 아니라고 생각하는 것 같아.,내 병환에 대해 가볍게 생각하는 가족들에게 어떻게 할 수 있을까요?,
나한테 같이 갈 거냐고 항상 묻긴 해. 하지만 내가 가기엔 좀 멀어.,현재 상황을 변화시키려면 뭘 할 수 있을까요?,
자식도 없고 아는 지인도 없으니 이렇게 늙어가다 혼자 죽겠지.,그런 생각에서 벗어날 방법에 어떤 것이 있을까요?,
찾아오는 사람도 없는데 내가 나가지도 못하니까 점점 더 고립되는 것 같아.,지금의 상황을 극복하고자 한다면 어떻게 하면 될까요?,
자식들이 요양원에 보낼 때 자주 온다고 하더니만 일 년에 한 번 밖에 안 와.,어떻게 하면 마음이 나아질 수 있을까요?,
아직도 일을 해야 먹고 사는데 자꾸 일자리를 못 잡으니까 더 힘들어지고 고립된 것 같아.,어떻게 하면 상황이 좀 더 나아질까요?,
우울증 때문에 사람들과 말을 하면 싸움이 돼서 혼자 있다 보니 점점 외롭게 돼.,그런 상황을 극복하기 위해서 어떻게 하면 될까요?,
몸이 아파서 먹는 약인데 안 먹을 수도 없고 철없는 아이들에게 화도 못 내고 상처가 되네.,상처받은 감정을 치유하기 위해 할 수 있는 일이 있을까요?,
사람들이 자주 어울려야 친해지는데 나만 빠지니 외톨이 같은 기분이라고 할까.,외톨이가 된 기분에서 벗어나려면 어떻게 하면 될까요?,
만나는 사람도 거의 없고 늘 혼자서 지내는 생활을 하니 누가 오겠어.,그런 상황을 좀 변화시켜보려면 어떻게 하면 좋을까요?,
몇 년 전 남편이 죽고 난 후 자식들과 유산상속으로 크게 싸우고  발길이 끊겼어.,유산상속을 둘러싼 자식들의 행동에 큰 상처를 받으셨군요. 지금 할 수 있는 일이 없을까요?,
평소 막역지간이라 말에 허물이 없었는데 갑자기 아무 말 없이 어느 날 자살했지 뭐야.,충격적인 소식에 상처를 받으셨군요. 어떻게 하면 마음이 진정될 수 있을까요?,
요새 갱년기라 그런지 기분이 자주 오락가락하고 짜증이 밀려와. 밖에 나가기도 싫거든.,갱년기 증후군을 앓아서 집에만 있으면서 외로워하시네요. 상황이 나아질 방법이 있을까요?,
이러다 혼자 죽는 건 아니겠지? 혼자 있으니까 말이지.,혼자 있어서 불안해하시는군요.,
죽이 잘 맞았던 김 씨라도 곁에 있으면 좋겠는데.,마음이 잘 맞았던 분이 곁에 없군요.,
심지어 자식 녀석들도 오지 않은지 한 참이 되었어. 괘씸해.,자녀 분들마저 오지 않았군요. 어떻게 해야 지금 이 상황에 도움이 될까요?,
그냥 요즘 좀 기분이 울적하네. 내가 생각해도 좀 이상해.,앞으로는 어떻게 해 보는 것이 좋을까요?,
내가 사는 동네도 사람들이 많이 찾아왔으면 좋겠어.,동네에 사람들이 많이 찾아왔으면 하는 마음이 드시는군요. 지금 할 수 있는 일이 있을까요?,
사람들을 만나기가 두렵지만 밖으로 나가서 사람들을 만나고 싶어.,사람들을 만나고 싶으시군요. 지금 할 수 있는 일이 있을까요?,
혼자 죽게 되면 어떡하지? 혼자서 고립된 채로 아무도 모르게 갈까 봐 겁이 나.,겁나는 마음을 달랠 수 있는 일이 있을까요?,
사실 자살하고 싶지 않아. 너무 외로워. 누군가 알아줬으면 좋겠어.,누군가 알아줬으면 좋겠군요. 주변에 도움을 청할 만한 사람이 있을까요?,
여럿이서 함께 만나는 친구들이 있는데 나만 빼고 자주 만났더라고.,사용자님을 빼고 만나는 일이 많아 서운하셨겠어요. 감정을 어떻게 표현할 생각이신가요?,
코로나 확진자랑 동선이 겹쳐서 나도 검사받고 자가격리 중이거든. 근데 회사도 못 가고 밖에도 못 나가고 혼자 섬에 갇힌 기분이야.,자가격리로 바깥생활을 못해 고립된 느낌이 드시는 것 같아요. 현재 집에서는 무엇을 하며 시간을 보내고 계세요?,
아이들 대화 내용을 듣다 보면 나만 뒤처진 듯해.,아이들 대화를 들으면 뒤처진다고 느끼시는군요. 최근 그렇게 느낄만한 일이 있으셨나요? ,
혼자 그림을 그려봐야겠어.,혼자 그림을 그릴 생각이시군요.,
그동안 시험 준비한다고 친구들과 연락을 끊었더니 먼저 연락해 주는 친구가 아무도 없어. 고립된 느낌이야.,친구들과의 연락이 끊어져 고립된 것 같은 느낌을 받고 있군요. 좋은 방법이 있을까요?,
친구가 없어서 고립된 느낌이 들어.,친구가 없어 고립된 느낌을 받으시는군요. 좋은 방법이 있을까요?,
밥도 혼자 먹고 있고 말할 사람도 없어. 회사에 나 혼자 있는 기분이야.,회사에서 동료들과 어울리지 못 하고 고립된 느낌이시군요. 좋은 해결책이 있을까요?,
오늘 학교에 갔더니 친구들이 나를 따돌리기 시작했어.,따돌림을 당해 속상하셨군요. 좋은 방법이 있을까요?,
스스로 괜찮다고 생각해야지.,스스로 괜찮다고 생각할 거군요.,
남편이 아이를 빨리 낳길 원하는데 나는 일을 더 하고 싶거든. 정말 고립된 느낌이야.,일을 더 하고 싶은 마음을 남편이 알아주지 않아서 고립된 느낌을 받으셨군요. 이를 상의할 사람이 있을까요?,
시어머니가 날 별로 좋아하지 않는 건 알고 있었는데 시댁에 가기만 하면 내가 말할 틈을 주지 않으셔.,시어머니의 행동에 왕따가 되는 느낌을 받으셨군요.,
나도 빨리 좋은 여자를 만나고 싶어. 앞으로는 소개팅 들어오는 거 절대 거절 않고 만나볼 거야. 언젠가는 좋은 인연을 만날 수 있겠지.,소개팅을 하다 보면 좋은 인연을 만나길 바라시는군요.,
스트레스를 받지 않게 다른 것에 집중하거나 아니면 내가 적극적으로 연락을 먼저 해봐야겠어.,다른 일을 통해 외로움을 잊거나 적극적으로 해결하려는 방법을 선택하셨군요.,
질환이 있다고 바로 날 해고하더라고.,상처가 크시겠어요. 어떻게 하면 좋을까요?,
부모님께 나의 진로와 계획을 말씀드리고 열심히 하고 있다는 걸 보여드려야겠어.,부모님께 진로와 계획을 말씀드리는 방법을 선택하셨군요.,
그래도 해야지 뭐. 갑자기 아플 수도 있으니까.,성가시지만 건강검진을 받으려고 하시는군요.,
노년을 즐기고 싶은데 혼자 일을 하고 있어. 일 그만하고 싶다.,현재 상황을 극복하려면 어떻게 하는 것이 좋을까요?,
돈은 필요한데 도움 받을 사람이 없어서 큰일이야.,이런 상황에서 어떻게 대처해야 할까요?,
용돈 받기 싫다고 시작한 주식인데 남은 재산도 축내고 있어.,어떤 방법이 이 문제를 해결하는데 가장 좋을까요?,
나 혼자 이 넓은 교실을 청소하게 돼서 너무 고립된 느낌이야. 억울하고 속상해.,마음의 상처가 정말 클 것 같아요. 이 억울한 상황을 어떻게 해결할 수 있을까요?,
모르겠어. 어느 순간 대화도 줄고 투명인간 취급을 당하는 것 같아. 같이 있어도 혼자 있는 기분이야.,남편분과 함께 있어도 혼자 있는 고립된 기분이 드시는군요. ,
응 만나면 다들 회사 얘기 하는데 나만 대화에 못 끼고 겉도는 느낌이야.,공감대 형성이 잘 안 되니 대화에 끼지 못해 고립되어있다고 느끼시는군요. 어떤 대화를 해야 친구들과 함께 얘기하는 느낌이 들 것 같나요?,
당연하지. 부모님마저 돌아가시면 가족이 전혀 없는 거잖아.,주변에 싱글인 지인이 많지 않으신가요? 비슷한 상황일 텐데 이런 얘기를 나눠보면 어떨까요?,
팀원들은 지금 잘못된 주장을 계속 고집하고 있는 팀장한테 무조건 동조하고 있어. 나만 반대의견을 내는 사람이야.,업무 수행하시면서 혼자만 고립된 느낌을 받으시겠어요.,
맞아. 입원해서 검사비랑 병원비가 많이 나왔거든., 도움을 요청할 곳은 없나요?,
갑자기 문제가 생겨서 카드대출을 받았거든.,가족의 도움을 받으실 수 없으신가요?,
요즘은 그냥 하는 일 없이 집에 있고 나갈 일도 별로 없으니까.,요즘 집에만 있어야 해서 심심하시겠어요. ,
그냥 나이가 들면 주변에 사람이 없어지는 것 같아.,네. 그런 생각이 들면 마음이 쓸쓸하게 느껴질 것 같아요.,
이제는 이렇게 사는 것이 익숙해져서 뭐가 외로운지 아닌지 모르겠어.,외로운 지 모르겠군요.,
친하다고 생각했던 친구들 모두 알아주지 않아 혼자라는 생각이 들었어.,친구분들께 기대하신 것이 이루어지지 않아 거리감을 느끼시는 것 같아요.,
누군가에게 내 고민을 이야기 하고 싶어. 하지만 멀리 떨어져서 생활하는 상황이라서 고민을 나눌 사람이 없어.,이야기 할 상대가 없어 더 힘드시군요. ,
그런데 내가 뭐가 문제인지 잘 모르겠어.,문제가 무엇인지 몰라 더 답답하시겠어요. ,
나만 빼고 친구들은 그동안 계속 연락을 해왔었나 봐. 친구들 대화에 낄 수가 없어서 혼자 밥만 먹고 돌아왔어.,오랜만에 친구들을 만났는데 본인만 서먹해서 쓸쓸하셨겠어요. ,
응 많이 외로워. 나는 육아를 끝낸 후 아이들이 자는 시간이 행복해.,자는 시간이 행복하시군요. 또 언제 제일 행복할까요?,
친구들이 연애한다고 바쁘니 주말에 혼자 집에서 텔레비전을 보는 일이 많으니 속상해. 차라리 새로운 취미를 만들어보는 게 나을까?,주말에 혼자 집에서 지내는 시간이 많군요. 새로운 취미를 만들려고 하시는군요.,
우리 부서만 안 하거든. 타부서는 다 하는데 우리만 안 해서 소외감을 느껴. 조금 속상해.,속상하시겠어요. 어떻게 하면 소외감을 덜 느끼는 데 도움이 될까요?,
세상에서 단절된 느낌이야. 친한 사람이 없으니 많이 외로워.,모임에 참석하지 않아 친하신 분을 만들지 못해 고립감을 느끼시는군요. 기분이 나아지려면 무엇을 해야 할까요?,
다들 친하니깐 나는 낄 자리가 없는 거 같아.,이럴 때 동료들과 친해질 방법 있을까요?,
나만 못하니까 고립된 기분이야.,혼자 공부를 못해서 고립된 기분이군요.,
퇴직하고 나서도 일해야할 것 같아. 그래야 노후자금을 마련할 수 있을 것 같아.,노후자금 마련을 위해 퇴직 후에도 일을 하실 계획이시군요.,
교과목 동아리에 가입해볼까해.,성적향상을 위해 교과목 동아리에 가입하려 하시는 군요.,
동료들과 잘 어울리지 못해 힘들어.,동료들과 잘 어울리지 못해 힘든 상황이시군요.,
새로운 동아리에 가입해서 친구들을 사귀어야 겠어.,동아리 활동을 통해 새 친구들을 사귀어 외로움을 극복하려 하시는 군요.,
보험든게 없어서 치료비 걱정이 크지. ,보험이 없이 병원비가 가장 걱정되는 상황이시군요.,
나만 참석하지 못해서 고립된 기분이야.,노인 정기모임에 참석하지 못해서 고립된 기분을 느끼시는군요.,
마음이 너무 외로워. 뭐가 문제인지 나도 깊이 고민을 해봐야겠어.,마음이 외로운 이유를 찾으려고 하시는군요.,
맞아. 사람들과의 연락이 끊기지 않게 내가 먼저 연락해봐야겠어.,사람들에게 먼저 연락하면서 고립된 기분을 느끼지 않으려고 하시는군요.,
요즘은 고독사가 남의 일 같지가 않아. 이러다 혼자 죽어도 모르지 싶어.,너무 혼자 외롭다 보니 그런 생각도 하시는군요.,
내일은 선생님께 찾아가서 상담해볼까해.,따돌림을 당하는 것 같아 내일은 선생님께 찾아가 상담을 해보려고 하시는군요.,
업무 중간에 주부인 친구들에게 카카오톡 소통을 자주 해볼까? 혼자라는 생각이 줄어들 것 같아.,카카오톡 소통을 통해 고립감을 해소하고자 하시는군요.,
일단 건강을 위해 식단을 바꿔야겠어.,건강을 위해 식단 관리를 하실 계획이군요.,
나의 꿈이 과학자라서 좀 더 열심히 공부를 파고 들면 나아지겠지.,과학자의 꿈을 이루기 위해 수학 공부에 더 집중하실 생각이군요.,
같은 반 친구들한테 당했어.,반 친구들에게 따돌림 당해서 외롭고 속상하시겠어요.,
다들 나한테만 관심이 없어.,관심을 보이지 않는 가족 때문에 고민하시는군요.,
맞아. 친구들과 대화하고 싶어서 내가 먼저 말을 걸어 볼거야.,학교 친구들에게 먼저 말을 걸어서 따돌림을 해결하실 생각이군요.,
가족들도 딱히 물어볼 사람이 없어. 인터넷에다가 문제를 올려 봐야겠어.,어려운 수학 문제를 인터넷에 문의하실 생각이군요.,
아니. 나도 그냥 학교 끝나면 내 방에만 있어.,대화가 없는 가족 관계 때문에 답답하시겠군요.,
내가 친구들한테 다가가서 말 걸어보려고.,친구들에게 먼저 다가가실 생각이군요.,
가족 다들 바빠서 나를 돌아봐주질 않아.,가족이 바빠서 관심이 없는 것 같아 많이 섭섭하시겠네요.,
학교에선 맞기만하고 같이 다닐 친구도 없어.,학교 폭력으로 학교 생활이 외로우시군요.,
농어촌 전형이 있긴하지. 그걸 노리려고.,학원이 없어서 입시에 고립되었지만 대책을 찾으셨군요. ,
가족과 함께 밥을 먹으면 자연스러울 것 같아.,가족과 식사를 통해 대화를 시도하실 생각이군요.,
뭔가 이세상에 나 혼자 고립된 느낌? 좋은 느낌은 아니야.,학업 때문에 혼자 있어서 외로우시군요.,
아이들이 나를 싫어해.,인간 관계로 고립감을 느끼셔서 고민이 많으시겠어요.,
죽음이 다가와서 그런가봐.,죽음이 다가오니 고립된 감정이 느껴지시는 군요.,
내일 가족이랑 대화를 해보려고.,고립감을 해서하기 위해 가족들과 대화를 시도하려 하시는 군요.,
업무가 너무 많아.,업무가 많아 고립감을 느끼시는 군요.,
내가 몸이 아파서 혼자 가기 힘드니까 날 돌보기 귀찮을 거라고 생각하나 봐.,돌보기 귀찮아서 같이 가지 않는다고 생각하시는군요. 어떻게 해야 속상한 마음이 조금이라도 나을까요?,
응. 가족들이 모두 가버리니까 혼자 고립된 느낌이야.,어떻게 하면 지금 상황을 나아지게 할 수 있을까요?,
응. 등산 동호회에 가입했어.,고립된 기분이 들어 등산 동호회에 가입하셨군요.,
그런데 직장 동료들이 눈치를 주는 것 같아서 고립된 기분이야.,직장 동료들이 눈치를 주는 것 같아서 고립된 기분을 느끼시는군요.,
자식들도 연락을 자주 안 하고 부모님은 돌아가신지 오래고. 근처 사는 친구들도 없거든. 너무 외로워.,근처 사는 친구들도 없어서 외로우시군요.,
남편한테 다시 한번 잘 이야기 해보려고.,남편한테 이야기하는 방법을 선택하셨군요.,
도움의 손길이 쉽게 다가갈 수 있게 고민해봐야겠어.,따돌림 당하는 애들을 위해 도움의 손길이 쉽게 갈 수 있는 방법을 고민중이시군요.,
다 독립해서 나 혼자 살고 있어.,주변에 돌봐 줄 가족이 없어서 섭섭하시겠어요.,
매일 나만 혼자 있으니 고립된 기분이야.,혼자 있어서 외로우시겠어요.,
나도 모르겠어. 형이랑 이야기해 볼까?,형과 대화하며 해결방법을 찾아 볼 생각이시군요.,
맞아. 같이 일하는데 왜 몰라줄까?,지금 기분이 나지려면 어떻게 하면 좋을까요?,
은퇴한 다음부터 사회에서 고립된 기분이 들어.,어떻게 하면 외로움을 해소할 수 있을까요?,
말 그대로 관 모형에 들어가서 죽음을 체험해 보는 거야.,사후 체험으로 어떤 생각이 들었나요?,
회사 사정이 어려워져서 일을 그만두려고 해.,회사 사정이 어려워서 그런 생각을 하시는군요.,
남편의 직장을 따라 이사를 오게 되었는데 친정도 너무 멀어서 도움을 청할 곳도 없어.,감정적으로도 힘든 상황에서 물리적인 도움을 얻을 수도 없어 참 혼자 된 기분을 느끼시는군요.,
남편이랑은 이혼한 지 십년이 넘었고 애들은 아직 어린 편이라 엄마한테 관심도 없어. 막내 여동생이 근처에 살기는 하는데 언니가 되어서 막내한테 의지하기도 뭣하네.,어려움을 오롯이 혼자 견뎌내시려니 고립감이 드시는군요.,
이제 편하게 아무때나 만날 수 있는 친구도 드물고 혼자 있을때 가끔은 외롭다는 기분도 들어.,외로울 때 무엇을 하면 기분이 나아질까요?,
임신해서 감정 기복이 심한 것도 영향이 큰 것 같아.,이럴 때 어떻게 하면 기분이 나질 방법이 있을까요?,
월말 되면 늘 있는 일이긴 한데 그래도 너무 회사생활만 하니 고립된 바위섬에 갇힌 느낌이야.,회사생활만 하니 고립된 바위섬에 갇힌 느낌이시군요.,
긍정적으로 사람을 봐야겠어. 처음 보는 사람에게 두려움이 심해서 말이야.,긍정적으로 사람을 볼 생각이시군요.,
자기들 연애하느라 나는 안중에도 없어. 참 쓸쓸하다. ,친구들이 관심을 안 가져주니 서운하시군요. 혹시 소개해준다는 경우는 없었나요?,
돈이 없는데 빌려줄 사람도 없고 대출해 줄 사람도 없어. 그래도 어떻게든 사니까 버텨봐야지.,돈을 빌려줄 사람도 없고 대출해 줄 사람도 없어서 재정적으로 고립되셨군요.,
대학 입학하고 사귄 친구들인데 다들 남자 친구는 필요 없다고 하더니 한 학기 지나자마자 남자 친구 사귀고 자기 연애만 중요하게 생각하더라고. 만나도 내 얘기는 듣지도 않고.,약속을 지키지 않고 자신을 소홀하게 대하는 친구들 때문에 속상하셨군요.,
굉장히 외로워. 뭔가 주말에도 혼자서 게임만 하고 있으니까 고립된 기분이야.,외롭고 고립된 느낌이군요. 외로움을 달래고 싶을 때 만나는 친구가 있으신가요?,
대화를 나누면 특정 사람들을 욕할 때마다 불편해. 내가 그 대상이 될 것 같아.,특정 사람을 뒷담화하는 모습을 보고 내가 그 대상이 될까봐 걱정되서 그러시군요. 그 뒤로 어떻게 하셨나요?,
왜 친구들을 못 만나게 하는지 모르겠어. 친구들이 이제 나한테는 연락도 안 해.,남자친구 때문에 친구들과 연락이 끊겨 슬프시겠어요.,
빨리 건강을 되찾아 도시 생활로 돌아가는 방법밖에는 없는 것 같아.,건강을 되찾아 도시 생활로 돌아갈 생각이시군요.,
없는 사람이 된 것 같아서 외롭고 우울했어.,친구들과의 대화에 끼지 못해서 고립감을 느끼셨군요.,
