human,system,
앞으로 회의에서 의견을 내지 않고 싶어. 스스로 위축되게 되고 자신감이 사라져서 힘들어.,위축되고 자신감이 상실돼버린 이 상황을 어떻게 하면 좋을까요?,
또 실수하게 될까 봐 두려워서 일도 손에 안 잡히고 내가 잘하고 있는지도 모르겠어.,현재 상황을 벗어나기 위해 어떻게 하면 좋을까요?,
같이 하는 프로젝트에 나만 열심이고 내가 한 일도 자신이 한 일처럼 말해서 상처 받았어.,상처 받은 마음을 어떻게 하면 좋을까요?,
중소기업에 떨어져서 그동안 내 자신감이 사라져 버렸어. 어떻게 헤쳐 나가야 할지 모르겠어.,현재 상황에서 벗어나기 위해 어떻게 하면 좋을까요?,
그 상사가 잘못된 방향으로 가더라도 아무도 말을 하지 않는다니 너무 답답했어.,이럴 때 OO님이 할 수 있는 일이 있을까요?,
지각한 건 잘못했지만 그렇게까지 화를 내고 욕을 해야 하는지 모르겠어.,기분이 많이 나쁘셨겠어요. 나쁜 기분이 나아질 만한 방법이 없을까요?,
내 대학 선배이기도 해서 내가 많이 믿고 따랐거든.,지금 이 고민을 털어놓을만한 사람이 있을까요?,
이제는 사람을 믿기가 힘들어. 배신감이 너무 커.,배신감을 조금이라도 누그러뜨리기 위해서 지금 내가 무엇을 할 수 있을까요?,
그 부서는 이번에 신사업부서라 다른 직원들이 가길 꺼리는 부서거든. 정말 상처야.,인사 발령으로부터 받은 상처를 어떻게 하면 회복할 수 있을까요?,
밤낮없이 열심히 살던 동생인데 왜 그런 동생에게 이런 일이 벌어졌는지 하늘이 원망스러워.,정말 상심이 크시겠어요.,
동호회 회계가 회비를 가지고 있는데 연락이 되지 않아. 많이 믿었던 사람인데 충격이야.,지금 이 충격을 없애기 위해 어떤 일을 해볼 수 있을까요?,
나도 엄마가 어렵다는 걸 알지만 앞으로 어떻게 해야 할지 모르겠어.,어떻게 해야 할지 고민을 이야기 할 사람이 주변에 없을까요?,
평소에 그렇게 멋있고 일 잘하던 선배가 편법으로 돈을 벌고 있었다는 게 믿기지 않아.,충격적인 감정에서 벗어날 방법이 있을까요?,
코로나 때문에 취업도 힘든데 미치겠어.,지금의 기분을 벗어나려면 어떻게 하는 게 좋을까요?,
왜 이렇게 되는 일이 없을까? 괴로워서 미치겠어.,지금의 기분에서 벗어나기 위해 할 수 있는 일이 있을까요?,
추억이 없어지는 것 같아서 서러워.,지금의 기분에서 벗어날 수 있는 것이 무엇이 있을까요?,
정성을 쏟아 부으며 준비해 왔는데 너무 아쉬워.,아쉬움을 달래는 방법에 무엇이 있을까요?,
다른 직장 알아봐야 하는 데 힘이 없어. 계속 눈물만 나와.,너무 슬프시겠어요. 이 상황을 극복하려면 어떻게 해야 할까요?,
안 그래도 손버릇 때문에 그 사람 소문이 안 좋긴 했는데 나한테도 그럴 줄이야.,어떻게 이 상황에서 벗어날 수가 있을까요?,
평소에도 예의 없는 태도이기는 했는데 그런 말까지 할 줄은 몰랐네.,어떻게 하면 이 상황이 해결될 수 있을까요?,
아직은 우리 부서에서 그 사실은 나만 알고 있는 것 같아.,지금 내가 할 수 있는 것이 있을까요?,
내가 사장님과 친척 지간이라 낙하산 의혹을 갖고 있더라.,지금 나는 무엇을 하는 게 좋을까요?,
상처 좀 받았어. 부자인 친구 가족이랑 잠깐 봤더니 그래.,친구 분을 만나고 그러셨군요. 기분이 상했을 때 푸는 방법이 있나요?,
아들이 사춘기가 오면서 나와 대화를 안 해.,이 상황을 변화시킬 최선의 방법이 뭘까요?,
많이 상처 받았어. 알면서 안 챙겨주는 건지 모르겠어.,어떻게 하면 좋게 해결할 수 있을까요?,
왜 회사까지 와서 저러는 걸까?,이 상황에서 할 수 있는 것들이 무엇이 있을까요?,
회사 사정이 좋은 것도 아닌데 다들 너무해.,어떻게 하면 지금 상황을 변화시킬 수 있을까요?,
직장 내 왕따가 이런 건가 봐.,직장에서 왕따가 된 것 같아 충격이 크시겠어요.,
치료를 받으라고 말했지만 여전히 도박에서 손을 못 떼고 있어.,이 상황에서 어떻게 하는 것이 좋을까요?,
다행히 다친 곳은 없다고 하시는데 새벽에 갑자기 전화를 받아 너무 놀랐어. 아직도 떨려.,지금 기분에서 벗어나기 위해 무언가 할 수 있는 것이 있을까요?,
나는 병원에 있느라 할 수 있는 것도 없고 아들은 과수원 일을 잘 몰라.,예전에는 이런 일이 있을 때 어떻게 하셨어요?,
눈물만 나와. 아내도 울기만 하고 나도 그동안 많이 지치고 힘들었어.,많이 슬프시겠어요. 어떤 것이 슬픔을 덜 느끼는 데 도움이 될까요?,
아내가 고생하니깐 이해가 가면서도 우울하고 요양병원에 가기 싫어.,이 상황을 어떻게 대처해야 좋을까요?,
내가 몸이 안 좋지만 나랑 상의했으면 좋았을 텐데. 강아지가 보고 싶어.,이 상황을 어떻게 극복해야 좋을까요?,
아내는 내 소중한 사람인데 어떻게 내가 시신을 기증할 수 있겠어. 결정이 어려워.,아내는 사후 시신기증을 원하고 계신데 어떤 선택을 내릴지 계속 고민되시겠어요.,
힘들게 일하는 것도 힘든데 이런 병까지 걸리니 상처만 입고 앞으로 어떻게 해야 좋을지 망막해,그 고통 충분히 이해해요. 어떻게 하면 지금의 상황을 잘 이겨낼 수 있을까요?,
남일 같지가 않아 나도 그런 쪽으로 아파서.,그러시군요. 어떻게 하면 아프지 않고 건강하게 살 수 있을까요?,
그래서 마음이 너무나도 허해.,어떻게 하면 허한 마음을 달랠 수 있을까요?,
응. 실제로 보니 너무 놀랐고 누군가가 죽는다는 게 너무 슬퍼.,어떻게 대처하는 것이 좋을까요?,
내가 이제 많이 약해졌다는 생각에 힘들고 생각이 많아져.,다음 팔씨름 경기를 이기기 위해 어떻게 하면 좋을까요?,
맞아. 건강해 보이던 친구가 갑자기 떠나니까 너무 슬프고 겁나.,이 슬픔을 어떻게 극복하면 좋을까요?,
벌써 이게 몇 번째야? 왜 멈추지를 못해.,아내 분이 술을 계속 못 끊으시니 충격이 크시겠어요. 이제 어떻게 하시면 좋을까요?,
나이 먹는 게 너무 슬프네. 충격이야.,나이를 먹는 게 너무 슬프신가 봐요. 어떻게 하면 슬픈 기분을 좀 떨쳐낼 수 있을까요?,
지금 뭐를 해야 할지 아무 것도 떠오르지 않아. 너무 충격적이야.,충격 많이 받으셨겠어요. 그래도 지금 해야 할 일이 있지 않을까요?,
언제는 좋다고 하더니 이제 와서 몸에 안 좋다고 하네. 따라한 내가 바보지.,마음이 안 좋으시겠어요. 이제 어떻게 하실 생각이세요?,
이름을 들어도 계속 까먹고 물건을 어디다 뒀는지도 기억을 못해. 건망증이 심해졌어.,어떻게 하면 이 상황을 해결 할 수 있을까요?,
저번에 넘어져서 다친 뒤로 무릎이 많이 안 좋아졌어. 이제는 등산은 못 다닐 것 같아.,앞으로 어떻게 하면 좋을까요?,
그동안 회식하며 술을 너무 많이 마신 게 문제였나 봐.,이 상황을 해결하기 위해서는 어떻게 해야 할까요?,
나중에 내 자식들도 그러지 않을까 걱정스러워.,앞으로 자식들이 싸울까 봐 걱정이 되었군요. 어떻게 하면 이 걱정을 덜 수 있을까요?,
나이도 그렇고 더 이상 일을 할 수 없다고 생각하니 사람들 앞에서 내가 너무 초라해 보여.,상처를 많이 받았군요. 어떻게 하면 이 마음의 상처를 치료를 할 수 있을까요?,
왜 이런 말을 들어야 하는지 모르겠고 내가 하는 봉사가 무슨 의미가 있는지 생각이 들어.,힘들겠어요. 현재의 감정에서 벗어나기 위해서 어떻게 하면 좋을까요?,
큰 문제없이 인테리어가 잘 되었다고 생각했는데 혼자만의 착각이었나 봐.,어떻게 대처하는 게 좋다고 생각하시나요?,
세상 사람들은 왜 그렇게 양심적이지 못한가 생각하면 기분이 좋지 않아.,양심적이지 못한 사람들 때문에 언짢으시군요. 어떻게 하면 그 기분에서 벗어날 수 있을까요?,
세상이 어찌 되려고 이러는지 젊은 애들이 어른을 대하는 태도를 보면 기분이 언짢아.,젊은이들이 어른을 공경하지 않아 마음이 상하셨군요. 어떻게 하면 그 기분에서 벗어날 수 있을까요?,
세상이 정신없이 바뀌어 가는 데 따라가지 못하는 나 자신이 한심하게 느껴져.,자신이 한심하다고 느끼고 계시군요. 어떻게 하면 그 마음에서 벗어날 수 있을까요?,
늙은 사람과 어울리기 싫어하는 사람들을 보면 도망치고 싶어져.,도망치고 싶은 마음을 어떻게 극복할 수 있을까요?,
어떻게 부모뻘인 어른에게 저렇게 몹쓸 짓을 할까? 세상이 안전하지 않은 것 같아.,어떻게 하면 지금 상황을 변화 시킬 수 있을까요?,
나도 폐암 선고를 받게 될까 봐 두려워.,어떻게 해야 예방할 수 있을까요?,
손주가 더 이상 나를 싫어하게 될까 봐 슬퍼.,어떻게 하는 것이 최선의 방법일까요?,
보험도 안 들어놨는데 큰돈이 나가서 생활이 어려워.,어떻게 해야 문제가 해결될까요?,
내가 가장인데 나한테 묻지도 않고 일을 벌여서 충격이야.,어떻게 해야 이 문제가 해결될까요?,
힘들면 얘기 좀 하지 어쩌다가 노숙자가 됐는지 안쓰러워.,어떻게 하면 충격이 가실까요?,
월세나 전세로 시작해도 좋을 텐데 그쪽에서 너무 바라는 게 많아.,어떻게 하면 고민이 해결될까요?,
괜히 비싼 돈 들여가며 여러 개 들어놓았어. 어차피 보상 못 받을 거.,이 상황에 대해 어떻게 하면 좋을 것 같으세요?,
이성적인 친구인데 많이 힘든가봐. 도와줘야겠어.,어떻게 도와주면 좋을까요?,
나도 집이랑 약간의 돈밖에 없는데 고민이 많아.,어떻게 하면 상황을 바꿔 볼 수 있을까요?,
가입할 때 설명 받은 것의 반도 안 되어서 어이가 없어.,이 상황에서 무엇을 시도해 볼 수 있을까요?,
돈을 많이 지불하더라도 치료하고 싶은데 너무 속상하고 우울해.,지금의 상황에서 무엇을 해야 기분이 나아지실까요?,
사람 대우를 못 받는 것 같은 기분이 드는 게 가장 슬퍼.,슬픈 지금의 감정을 변화시키려면 무엇을 하면 좋을까요?,
내 모습이 병원비도 못 낼 정도로 보이나?,이런 일이 생겼을 때 어떻게 대처하면 좋을까요?,
내가 지금까지 힘들게 자식들을 키웠는데 그때의 시간이 다 부정당한 기분이야.,지금의 상황에서 무엇을 할 수 있을까요?,
건강을 진심으로 걱정해주지 않는 것 같아서 충격 받았어.,충격이 크셨겠어요. 현재의 감정에서 벗어나기 위해서 어떻게 하면 좋을까요?,
생명이 위급해질 수도 있다는데 보험이 되는지부터 물어봤어 상처받았어.,상처가 크시겠어요. 현재의 감정에서 벗어나기 위해서 어떻게 하면 좋을까요?,
다들 건강하고 돈이 많은데 나만 아프고 돈 없는 노인인 거 같아서 속상했어.,속상하셨겠어요. 현재의 감정에서 벗어나기 위해서 어떤 일을 해야 할까요?,
돈 때문에 수술을 꼭 해야 하냐고 자꾸 물어봐 나를 걱정하는 게 아닌 것 같아 기분이 너무 안 좋아.,딸들의 말 때문에 힘드시겠어요. 지금의 감정에서 벗어나기 위해서 어떤 일을 해야 할까요?,
재산을 미리 주어야 할까? 재산만 받고 날 버리면 어떡하지?,재산 상속 및 처분에 대한 고민이 많으시군요. 걱정이 정말 많으시겠어요. 어떻게 하고 싶으세요?,
딸이 그런 말을 하다니 너무 슬퍼. 앞으로 내 치료비를 안 내주면 어떡하지.,딸에게 치료비를 지원받지 못할까봐 걱정이 되시는군요. 어떻게 걱정을 덜 수 있을까요?,
그 말 때문에 요새 잠도 잘 못 자고 못 자니까 몸이 더 아픈 거 같아.,매일 잠을 못 주무시다니 힘드시겠어요. 생각을 떨치려면 어떻게 해야 할까요?,
너무 충격적이었어. 내가 뭘 잘못한 건지 모르겠어.,왜 그렇게 고함을 지르신 건지 여쭈어보셨나요?,
어쩌다 이런 소문이 나게 되었는지 너무 상처받았어.,왜 그런 소문이 나게 되었는지 여쭈어보셨나요?,
갑자기 이렇게 돼버리니까 당황스럽고 너무 충격이야.,당황스러운 마음을 이야기 나눌 사람이 있을까요?,
난 아예 생각해본 적도 없어서 손발이 덜덜 떨려오는 것 같아.,매우 놀라신 것 같습니다. 마음을 진정시키는데 좋은 방법이 있을까요?,
믿을 수 없지만 살이 엄청나게 쪘어. 충격적이야.,체중이 늘어나 충격을 받으셨군요. 체중감량을 위한 목표를 세우셨나요?,
 차가 오래되어서 도로에서 운전하고 가다가 멈췄대. 얼마나 충격을 받았는지 몰라.,차가 멈췄다하니 충격을 받으셨군요.,
평소에 단골이고 친하다고 생각했는데 그동안 물건값을 더 받은 것 같아. ,친하다 생각한 사람이 물건 값을 더 받은거 같군요.,
가장 친한 친구가 나에 대해 안 좋은 소문을 내고 다닌단 걸 알게 되었어.,가장 친한 친구가 안 좋은 소문을 내고 다녀서 충격을 받으셨군요. 좋은 방법이 있을까요?,
맞아. 정말 믿었던 친구인데 나에 대해서 이상한 소문도 만들어서 퍼뜨리고 다녔어. 정말 어떻게 해야 할지 모르겠어.,민었던 친구가 험담을 해서 어떻게 해야할지 모르시겠군요. 좋은 방법이 있을까요?,
친한 친구가 다른 친구에게 내 비밀을 말했다는 거야. 난 그 친구를 믿고 털어놓은 건데 말이지.,친한 친구가 내 비밀을 다른 사람에게 말해 충격받으셨군요. 좋은 해결책이 있을까요?,
몇 번 연락했는데 선배가 전화를 받지 않아.,어떻게 하면 선배와 통화할 수 있을까요?,
동성애자에 대해 나쁘게 생각하지는 않아. 하지만 몰랐던 사실이라 충격이야.,몰랐던 사실을 알게 되어 충격이군요.,
오 년 동안 친하게 지냈던 친구가 나에게 절교하자고 연락을 했어.,갑작스럽게 친구가 절교를 하자고 해서 충격을 받으셨군요. ,
친하다고 생각했는데 갑자기 그렇게 나오니 충격적이었어.,친하다고 생각한 친구분의 행동이 충격적이셨군요.,
작년 친구 모임은 커플 모임이었는데 거기서 눈이 맞았다나. 아무리 사랑에는 국경도 없다지만 이건 아니지.,친구의 잘못된 행동에 충격받으셨군요. 좋은 방법이 있을까요?,
아니. 더 싸울 것 같아 아직 말하지 못했어.,더 싸울 것 같아서 남자친구와 대화를 못해보셨군요. 그럼 이 문제를 어떻게 해결하면 좋을까요?,
십년지기인데 정말 충격이야. 누굴 믿고 살아야 하는지.,오래 알고 지낸 친구여서 상심이 더 크시군요.,
응. 심지어 그 내연녀가 나보다 열 살이나 어리다고 해서 배신감이 너무 커.,충격과 배신감이 정말 크실 것 같아요. 지금 이 상황에서 무엇을 하면 이 감정을 조금이나마 누그러뜨릴 수 있을까요?,
응. 다음 주 산부인과에 재검사 가는데 벌써부터 마음이 불안해,많이 걱정되시겠어요. 지금이 불안함을 덜기 위해 어떤 것을 하는 게 좋을까요?,
심지어 내가 아는 사람이라서 더 충격이야. 손도 떨려.,손이 떨릴만큼 충격이 크실 것 같아요. 이 충격을 가라앉히기 위해 어떤 것을 하면 좋을까요?,
남자친구를 믿었는데 믿음이 와르르 무너졌어. 상처 받았어 정말.,어떻게 하면 남자친구에게 받은 상처가 나아질 수 있을까요?,
응. 노산이라 걱정했는데 의사에게 직접 들으니 억장이 무너져.,어떻게 하면 마음의 충격을 가라앉힐 수 있을까요?,
빚도 많은데 이제까지 일부러 숨긴 것 같아서 그것도 충격이야.,빚이 많은데다 남자친구가 속인 것 같아 충격이 정말 크실 것 같아요.,
잠깐 다툴 때 들었던 말인데. 이상하게 자꾸 생각나.,속상한 마음을 풀기 위해 어떤 것을 하면 좋을까요?,
부모님 사이가 안 좋은 것 같아서 마음이 안 좋아.,부모님 사이가 소원한 것 같아 마음 쓰일 것 같아요.,
성공할 때까지 계속 잔소리를 할 생각이야. 올해 안으로 끊게 만들고 싶어.,남편에게 담배를 끊을때까지 잔소리를 하려고 하시는군요.,
내가 먼저 손 내밀어 연락을 해볼까해.,먼저 연락하는 방법을 선택하셨군요.,
우리 작은 형의 지인이라는 걸 알았다면 괴롭히지 않았을 텐데 후회돼.,매우 후회되시겠어요. 어떻게 지금 하는 후회를 덜 하게 만들 수 있을까요?,
이 상황이 너무 무섭고 힘들어.,다시는 이런 일이 일어나지 않을 방법이 있을까요?,
내가 나서서 친구를 위해서 무엇을 해야 할지 모르겠어.,다른 사람에게 도움을 요청해서 해결하는 방법이 있을까요?,
많이 친했던 친구인데 너무 슬프고 충격적이야.,이 상황을 잘 헤쳐나가기 위해 어떻게 해야 할까요?,
나 스스로에게 충격이고 미안했어. 어떻게 해야 아내에게 이런 내 마음을 전할까?,많이 충격적이고 상처 입으셨군요. 아내 분에게 이런 마음을 전할 무슨 방법이 있을까요?,
가장 친해서 믿었던 사람인데 배신감이 많이 크고 슬프고 우울해.,소문을 잠재우기 위해 어떻게 하면 좋을까요?,
아무도 나를 믿어주지 않았다는 것에 우울하고 배신감을 느껴.,동료들이 사용자님을 믿어주지 않아서 힘드셨겠어요. 도난 사건의 용의자를 찾을 수 있을까요?,
정수기 물이 안 좋다고 아들이 말해준 거 같은데 아들한테 괜히 섭섭해.,이 상황에서 할 수 있는 방법에는 무엇이 있을까요?,
가져다 주면 좋아할 거라는 당연한 생각을 하고 가져다 주었는데 말이야.,정말 속상했을 것 같아요. 이 상황을 어떻게 하면 좋을까요?,
예전에는 잘 놀던 친구인데 이제는 도박 중독자가 되어서 몰골이 말이 아니야.,어떻게 하면 예전처럼 잘 지낼 수 있을까요?,
같이 일하던 정이 있는데 벌써 날 잊은 건가? 동료들의 생각이 궁금하네.,동료들의 마음을 알 수 있는 방법에는 어떤 것이 있을까요?,
짐만 되는 나를 보살피기 싫다며 서로 나를 미루다가 싸우더라고.,어떻게 해야 두 아들을 화해시키고 상황을 호전시킬 수 있을까요?,
그 노인이 먼저 지나가면서 날 밀쳤는데 사과하라고 했더니 내 탓으로 돌리더라고.,상처받은 마음을 회복하고 기분이 나아지기 위해서 어떻게 해야 할까요?,
내 남편이 이번에 병원에 입원했거든. 자신이 아픈 것이 평생 일만 해 온 내 탓이라고 소리쳤어.,그래서 속상하셨던 거군요. 마음을 편하게 가지기 위해서 할 수 있는 방법에는 어떤 것이 있을까요?,
집도 카드도 통장도 다 조카가 뺏고 집에 모시는 줄 알았더니 요양원 행이 됐어.,충격이 크셨겠네요.,
알게 된 지 얼마 지나지 않았는데 크게 싸웠다는 사실이 충격이야. 그동안 속 깊은 이야기를 나보다 더 많이 나눴더라고.,소개해 준 지인들이 깊은 이야기를 나눈 사이로 발전했는데 그 사이가 틀어졌다면 중간에서 매우 힘드실 것 같아요.,
아직 서른 살밖에 안됐는데 너무 충격이야.,그러게요. 건강검진은 꼭 챙겨서 해야 하는 것 같아요.,
다음 병문안 때 책을 선물하려고. 친구가 좋아하는 작가가 신작을 냈거든.,친구를 위해 친구가 좋아하는 작가의 책을 선물할 계획이시군요. ,
지금은 직장에 있지만 바로 병원으로 가봐야 할 것 같아.,아내를 보러 병원에 가셔야 하군요. 이럴 때 함께 갈 다른 누군가 있을까요?,
점수가 모두 오십 점이 안돼.,점수가 모두 오십점이 안되는군요.,
저번에 시험을 봤는데 오늘 시험 점수를 확인했거든.,시험 점수를 확인하셨군요.,
우선을 실업급여를 받으면서 알아봐야 할 것 같아.,실업급여를 수급하면서 고민해보실 계획이시군요.,
처방해준 약 잘 먹고 운동 꾸준히 해야할 것 같아.,처방된 약을 잘 챙겨 먹고 운동을 하는 것으로 당뇨 수치를 낮출 계획이시군요.,
나라도 힘을내서 슬퍼하시는 엄마에게 의지가 되어드리려고 해.,슬퍼하시는 어머니를 위해 힘을 내서 의지가 되어드리려 하시는 군요.,
그 친구한테 가서 왜 그랬는지 물어봐야 겠어.,친구에게 앞뒤가 다르게 행동한 이유를 물어보려 하시는 군요.,
내 노력이 헛된 거 같아서 충격 받았어.,노력해도 헛 된 것 같아서 충격을 받으셨군요.,
모아놓은 퇴직금이 다 날라갔어. 앞으로 뭘 해먹고 살아야하나.,병원비로 퇴직금마저 다 쓰셔서 막막한 상황이시군요.,
나는 건강하게 오래 살고싶어.,나는 건강하게 오래살고싶군요.,
지금부터라도 소비를 줄이고 저축을 해야겠어.,소비를 줄이고 저축을 할 생각이시군요. 정말로 좋은 결과 있기를 바랄게요.,
맞은 곳보다 충격이 더 컸어.,따돌림 때문에 맞게 되어 속상하셨겠어요.,
아니 옆집 남자가 다른 사람한테 갑자기 화를 내잖아. 나 참 어이가 없어가지고.,옆집 남자가 다른사람에게 갑자기 화를 내어 충격받으셨군요.,
모르겠어. 애들 대학 등록금도 내야 되는데. 정말 걱정이야.,정년인데 자녀분들 대학 등록금 때문에 고민이 많으시겠어요.,
그런데 문병을 오는 사람이 없어 그래서충격 받았어.,문병을 오는 사람이 아무도 없어서 충격받으셨군요.,
몸이 많이 안 좋대.,몸이 많이 안좋다고 해서 충격을 받으셨군요.,
배다른 자식이었데.,배다른 자식이 있다는 소식을 들어 충격을 받으셨군요.,
응 내장지방이 심하고 고혈압이라면서 관리 열심히 하라고 하더라.,건강 검진 결과가 내장지방에 고혈압이 나와서 관리를 열심히 하라고 들으셨군요.,
난 아직 열여섯살이라 이해가 안가지만 부모님 사이에 무슨 일이 있었나 봐.,집을 나간 아버지 때문에 부모님의 사이가 걱정이 되시는군요.,
나에 대한 관심이 이렇게 없다니.,관심을 보이지 않는 가족 때문에 고민하시는군요.,
그 친구가 자살했어. 그럴 이유가 없는 친구인데.,친구의 생각지 못한 일에 충격 받으셨군요.,
응. 선생님께 가서 채점이 정확한지 물어봐야겠어.,예상치 못한 시험 결과를 선생님께 문의하실 생각이군요.,
아니. 언니가 얘기해줬어.,언니의 얘길 듣고 많이 놀라셨겠어요.,
친구들과 만나 대화로 풀어보려고.,친구들과 대화로 따돌림을 해결하실 생각이군요.,
응. 열심히 공부했는데 성적이 떨어져 슬퍼.,노력에 비해 성적이 잘 나오지 않아 우울하시겠어요.,
시험 성적이 더 떨어졌어.,성적이 좋지 않아 상심이 크시겠어요.,
엄마 아빠가 이혼한대.,부모님의 이혼 소식으로 많이 충격받으셨군요.,
맞아. 나랑 엄청 친하게 지내는 애들이었는데 믿기지 않아.,친했던 친구들이 뒤에서 욕을 해서 충격받으셨군요.,
많은 시간을 믿고 의지했는데 지금은 너무 혼란스러워.,아버지의 일로 크게 충격받으셨군요.,
내 성적으로는 원하는 대학교를 갈 수가 없다고 그러셨거든.,선생님과 진학 상담으로 충격을 받으셨군요.,
친구가 세상을 떠났어.,친구의 사망으로 상심이 크시겠어요.,
노인정에서 친구가 죽었어.,노인정 친구분이 돌아가셔서 충격을 받으신 상황이시군요.,
후배랑 상사랑 불륜을 저질렀어.,직장 후배와 상사의 불륜으로 큰 충격을 받으셨군요.,
내일 장례식장에 가서 할머니랑 마지막 인사를 해야겠어.,장례식장에서 할머니께 마지막 인사를 하는 것으로 슬픔을 달래려 하시는 군요.,
결혼식에 참석해서 그 많은 남자들 중 누구와 결혼하는지 봐야겠어.,친구 분의 남편될 사람이 누구인지 확인 하기 위해 결혼식에 참석하려 하시는 군요.,
응.그동안 정말 열심히 준비했는데 결과가 이렇게 나오니 충격이야.,충격받았겠어요. 어떻게 하면 기분전환을 할 수 있을까요?,
사업이 망하니까 주변 사람들이 나를 대하는 태도도 변한 것 같아.,주변 사람들의 태도 때문에 충격 받으셨군요. 지금 상황을 나아지게 하려면 어떻게 하는 게 좋을까요?,
돈문제지 뭐. 돈이 빨리 해결되어야 할텐데.,돈문제로 부부 사이가 안좋아지셨군요.,
