human,system,
지금 그냥 어이가 없고 화가 날 뿐이야. 세상에 믿을 사람 하나 없다.,염세적인 속담을 믿을 만큼 당황스럽고 화가 난 상태 시군요.,
친구들에게 왜 그런 행동을 했는지 직설적으로 물어보려고 해.,상황을 피하지 않고 친구들과 바로 대화를 시도하려고 하시는군요. 좋은 결과가 있길 바랄게요.,
장례식장에 가서 위로해줬는데 어떤 말로도 위로가 되기는 어려운 것 같아.,나의 위로가 큰 도움이 되지 못해서 더욱더 안타까우실 것 같아요.,
그 집 부부가 교사고 나랑도 아는 사이거든. 아이가 착하다고 자랑하던데 담배를 피울 줄은 몰랐어.,아는 분들의 자제라서 더 놀랍고 충격이었을 것 같아요.,
비만이면 당뇨도 위험하다니까 건강을 더 챙겨야겠어.,미리 알게 돼서 다행이에요. 앞으로 건강을 열심히 챙겨서 원하시는 체형으로 돌아가길 바랄게요.,
나도 잘 모르겠어. 모임에 다른 사람들은 어떻게 할 것인지 물어봐야 할까?,다른 분들의 의견을 들어보면서 신중하게 판단하시면 좋겠어요. 좋은 선택을 하시길 바랄게요.,
퇴근 후에 카톡으로 잠깐 일하는 건 괜찮다고 사규에 쓰여있대. 어이가 없었어.,회사의 부당한 규정에 충격받으셨군요.,
관리를 잘해서 동안이라는 이야기를 많이 듣고 싶어.,앞으로 관리를 잘하시기 바라요.,
이러다가 치매 증상이 더 심해질까 봐서 걱정으로 밤을 지새우고 있어.,예상치 못한 질환에 스트레스 많이 받으시겠어요.,
삼십오 년간 같은 직장에 다닌 동기생인데 술 한잔하면서 그 말을 들으니 충격이야. ,친구분께서는 노후자금에 대한 준비를 잘하셨나 봐요.,
법원으로부터 파산 서류가 왔는데 채권 신고하라는데 알아보니 거의 회수하지 못한다는 거야. ,많이 심란하시겠어요. 노년에는 투자나 자금 대여 등에 신중하게 대처해야 할 것 같군요.,
선배들에게 이력서 보완에 관련해서 조언을?받으려고 해.,이력서가 보완된다면 더 좋은 결과가?있을 거예요. 응원합니다.,
진지하게 대화를 나누며 오해를?풀고 싶기도 해.,대화를 나누어 오해를 푸는?방법 것은?좋은 방법 같습니다.,
남편에게 가사를 조금만 도와 달라고?부탁하려 해.,좋은 생각이네요. 좀 더 편안해지셨으면 좋겠어요.,
그랬으면 좋겠다. 다시 노력해봐야겠어.,잘하실 수 있을 거예요. 제가 항상 응원할게요.,
나한테 말 한마디 없이 행동한 게 너무 속상하더라.,남편분이 따로 이야기가 없으신 게 속상하셨군요.,
나도 아프기 전에 미리 검진받아 보려고.,검진을 받으러 가실 생각이군요.,
아무래도 헤어지는 게 나을 것 같아.,이럴 때 곁에 있어 줄 누군가가 있었으면 좋겠네요.,
모르겠어. 그냥 눈앞이 깜깜해.,지금 곁에서 힘이 되어 줄 사람이 있었으면 좋겠네요.,
남편한테 확인이라도 해 봐야겠어.,남편분과 대화가 잘 되시길 바라요.,
어떻게 나한테 이럴 수 있는 건지. 너무 상처야.,상처 받은 마음을 달래 줄 누군가가 옆에 있었으면 좋겠어요.,
너무 충격적이야. 내 앞에서는 그렇게 사랑꾼인 척하더니.,남자친구의 행동에 큰 충격을 받으셨군요.,
잔잔한 음악을 들으면서 마음을 좀 진정시키려고.,잔잔한 음악을 들을 생각이시군요.,
남자친구와 헤어질 거야.,남자친구와 헤어질 생각이시군요.,
이번에 저소득층 상대로 취업 지원 훈련한다고 하더라?,혹시 참가할 생각이 있으신 건가요?,
응. 제일 친한 친구에게 연락해서 내 놀란 마음을 알려줘야겠어.,친구에게 이야기를 털어놓으면서 놀란 마음을 가라앉히고자 하시는군요.,
지금부터라도 돈을 열심히 모아야지.,돈을 많이 모아서 꼭 결혼하실 수 있을 거예요.,
그 친구랑 나랑 함께 다니는 또 다른 친구가 있어. 걔한테 전화를 해봐야지.,공통된 친구에게 고민을 토로하고자 하시는군요.,
더럽게 밥을 먹는 사람의 영상을 한번 보여줄래.,친구에게 충격요법을 사용하시려는 것처럼 보여요.,
맞아. 내년에는 꼭 진급해야지.,내년에는 반드시 진급 성공하시기를 바라요.,
자주 연락하려고.,친구분에게 자주 연락하려고 생각하시는군요.,
가난하지만 않았다면 대학을 가고 싶은데 현실적으로는 취업을 해야 할 거 같아.,현실적인 문제 때문에 많이 힘드시겠어요.,
너무 속상해서 아무것도 먹고 싶지 않고 아무 생각도 없어 지금.,친구들이 다 좋은 가방을 메고 와서 비교가 되셨나 봐요.,
모르겠어. 일단 설득해봐야지.,대화가 잘 이루어졌으면 좋겠네요.,
내가 미리 치료받았어야 했는데 늦게 가서 그렇지 뭐. 그래서 심하지 않을 때 가려고.,심하지 않을 때 가면 덜 아플 거예요.,
그래서 사장님이 회사 전 직원을 대상으로 스트레스 검사를 할 거래.,사장님이 좋은 생각을 하셨네요.,
나한테도 이런 일이 일어날 줄 몰랐어. 놀란 마음 진정 좀 시켜야겠어.,일단 마음을 좀 가라앉히시는 게 좋을 거 같아요.,
그냥 팔고 지금 사는 곳에서 계속 전세 살아야겠어.,그거 좋은 생각이에요.,
믿을 수 없었고 너무 놀랐어.,갑작스러운 친구의 죽음에 너무 힘들고 당황스러우셨겠네요.,
이제부터라도 건강에 더 신경을 써야겠어.,건강에 좀 더 신경을 쓰려고 하시는군요.,
나도 혼란스럽고 마음이 착잡하네.,급작스러운 일이 생겨 많이 놀라셨겠네요.,
시골은 너무 적막하고 살기가 불편할 거 같아. 서울이 얼마나 편한데. ,서울이 살기 좋은 곳이라고 생각하고 계시는군요.,
앞으로는 미리미리 검진하고 치료도 잘해야겠어.,잘 치료하셔서 꼭 회복하시길 바랄게요!,
병원에서는 무조건 그냥 집에서 편안한 마음으로 있으라고는 하지. 하지만 내가 직장을 다녀야 하는 맞벌이인데 쉽게 그렇게 할 수 없고. ,이러지도 저러지도 못하는 상황에서 그런 소식을 들으시니 더 충격이셨겠어요. ,
맞아. 안정적인 곳이라고 생각하고 들어왔는데 그렇지 않다는 사실이 충격적이야.,안정적이라고 생각했기에 부장님의 해고가 더 충격적일 수밖에 없겠네요. ,
응. 너무 충격적이어서 아직 여자 친구에겐 그 모습을 봤다는 얘기도 못 했어.,충격을 받으셔서 아직 여자 친구에게 말을 못 하셨군요.,
친오빠에게 그 언니의 어떤 점이 좋은지 물어봐야겠어. 내가 모르고 있었던 그 언니의 장점을 찾아볼 생각이야.,선배 언니의 장점을 찾아볼 생각이시군요.,
잘 모르겠어. 그냥 머릿속이 복잡하기만 해.,누군가에게 속마음을 털어놓는 것이 조심스러우시군요.,
평소에 너무 착해서 학교생활도 착실히 하는 줄 알았는데 결석이라니. 오늘 저녁에 아들하고 이야기해 봐야겠어.,하고 싶은 말과 궁금한 점이 많겠군요.,
맞아. 어떻게 하는 게 좋을까?,주변에 같이 이야기를 나눌 분이 계실까요?,
학교에서 자주 마주치지.,자주 마주치게 되어 더욱 신경 쓰이시는군요.,
내 보기엔 죄다 신통치 않은 것들이었어. 점차로 좀 나아져야 할 텐데 말이야.,그러게나 말이에요. 나아져야 할 텐데요.,
맞아. 그냥 흔히 벌어지지 않는 상황이다 보니 개인적으로 충격이었을 뿐이야. 두 분이 아름다운 사랑 하시길 빌어.,사제 간 사랑은 드물게 벌어져서 그렇게 생각하셨군요.,
일단 한 명에게 먼저 연락해봐야겠어.,통화 잘하시길 바라요.,
은퇴하고 굶고 살 수는 없잖아. 특별한 대책이 필요해.,당장 준비할 수 있는 일은 무엇이 있을까요?,
응. 난 당연히 미혼인 줄 알았는데 앞으로 조심해야겠어. ,앞으로는 이런 일이 안 생기기를 바라요.,
앞으로 식비가 많이 나갈 것 같아. 버는 것도 많이 없는데.,앞으로가 정말 걱정스러우시겠군요.,
너무 충격받아서 더 이상 얘기하고 싶지 않아.,마음이 진정되시길 바라요.,
생활이 문란하다 뭐 그런 얘기를 하고 다녔더라고.,너무 상처받지 않으시길 바라요.,
아무리 출산 연령이 늦어졌다지만 내 나이가 이렇게 많은지는 실감을 못 했네.,출산을 생각하니 불안한 마음이 드셨겠어요.,
절대 용납 못 해. 내 자존감을 무너뜨렸어.,자존감이 무너지셨다니 마음이 너무 힘드실 것 같아요.,
아무래도 부서장님과 개인적인 친분이 있어서 그런 것 같다는 생각이 들어. ,공정하지 않다는 생각에 상처를 받으셨겠어요.,
그냥 마음에 들지 않는 것을 넘어서 좀 부끄럽고 열 받더라고.,인간적이지 않은 동기들에게 분노하시는군요?,
응. 전혀 예상하지 못했어.,생각과 달라 충격받으셨겠어요.,
너무 실망스러워. 이 남자는 아닌가 봐.,남자친구의 행동에 충격이 크시군요.,
응. 나는 다 잘 대했는데 뭐가 그렇게 마음에 안 들었지.,최선을 다한 관계에서 그런 말을 듣다니 정신적으로 충격이 클 것 같아요.,
정말 친한 친구란 말이야. 이게 꿈인가 싶을 정도야.,친구의 태도에 충격이 크셨군요.,
내일 한번 제대로 된 원인을 알아봐야겠어. 이건 너무 말도 안 되는 일이야.,네. 꼭 좋은 결과가 있기를 응원할게요.,
이건 불공평해.,불공평한 조치라고 생각해 충격을 받으셨군요.,
엄마와 친구 문제에 대해 상담도 하고 안심도 시켜드려야 할거 같아.,엄마와의 대화를 통해 놀란 마음을 진정시킬 수 있기를 바라요.,
친구랑 한 번 진지하게 얘기를 한 번 나눠 봐야 될 것 같아.,친구랑 진지하게 얘기를 나눠보려고 하시는군요.,
우선 부모님께 내 힘든 마음을 토로해 볼 생각이야. 왜 혼냈던 건지도 물어보고 해결 방법을 함께 생각해 본다면 좋겠어.,부모님께 힘든 점을 토로하며 대화를 나눠서 해결 방법을 고민해 보려 하시는군요.,
동기들과 사장님에게 연락을 해봐야겠어.,동기들과 사장님에게 연락해서 상황이 잘 해결되었으면 좋겠네요.,
매출 관련 긴급회의를 열고 문제분석 및 향후 전략을 세우는 게 중요할 것 같아.,회의를 통해서 매출실적 부진에 관해 잘 해결하길 바라요.,
일단 상사에게 이 상황을 설명하고 타 부서와 협력할 수 있는 부분을 찾아봐야겠어.,상사분과 이야기하며 매출 목표에 대해 잘 해결해가길 바라요.,
내가 정한 진로와 비슷하지만 향후 비전이 있는 진로를 찾아봐야겠어.,향후 진로를 잘 찾아보길 바라요.,
기계로 대체할 수 없는 분야가 있으니 그쪽을 알아봐야겠다.,기계가 대체할 수 없는 분야를 찾아서 걱정을 덜 수 있었으면 좋겠네요.,
대체되는데 까지 걸리는 시간이 있으니 새로운 직무에 대해 알아봐야겠어.,새로운 직무에 대해 알아보며 불안함을 덜기를 바라요.,
퇴근하고 팀원들이랑 술 마시기로 했어.,팀원들과의 대화로 기분이 나아지길 바라요.,
퇴근하고 맛있는 저녁을 먹어야겠어.,맛있는 음식을 먹으면서 기분이 나아지기를 바라요.,
친구들에게 오늘 있었던 일을 하소연 할 거야.,친구들과의 대화로 기분이 나아지기를 바라요.,
원래 일하던 부서로 갈 수 있는 지 먼저 알아봐야겠어.,원래 일하던 부서로 갈 수 있으면 좋겠네요.,
회사 건의함에 부장님에 대해서 써야겠어.,회사에 건의해서 상황이 나아지면 좋겠네요.,
그 사람을 잊고 새로운 사랑을 찾아야겠어.,새로운 사랑을 찾으셔서 행복해지시길 바랄게요.,
전혀 모르겠어. 그 사람을 만날 자신이 없어.,주위에 지금 상황을 위로해 줄 수 있는 사람이 있었으면 좋겠어요.,
그에게 나를 어떻게 생각하고 있었는지 직접 물어봐야겠어.,애인분과의 대화가 잘 풀리셨으면 좋겠어요.,
당장 애인에게 헤어지자고 해버려야겠어.,애인분과의 일이 잘 정리되셨으면 좋겠어요.,
전 애인에게 찾아가서 왜 그랬는지 당장 따져야겠어.,전 애인분과 대화가 잘 풀리셔서 잘 해결됐으면 좋겠어요.,
전혀 모르겠어. 지금의 나를 생각하면 계속 눈물만 나와.,주위에 지금 감정을 나눌 사람이 있었으면 좋겠어요.,
아무래도 애인에게 나한테 화가 난 게 있는지 물어봐야겠어.,애인분과의 대화로 기분이 풀리셨으면 좋겠어요.,
당장 애인을 찾아가서 그 신발에 대해 물어봐야겠어.,애인분과의 대화가 잘 풀려서 상황이 해결됐으면 좋겠어요.,
일을 열심히 해서 다시 돈을 모아야겠어. 처음부터 다시 준비하는 것이 좋을 것 같아.,청혼 준비가 다시 잘 돼서 상황이 잘 풀리셨으면 좋겠어요.,
애인을 찾아가서 모두 오해라고 이야기해야겠어.,애인분과의 대화로 일이 잘 해결되셨으면 좋겠어요.,
당장 그 사람에게 이별을 통보하고 집을 나와야겠어.,상황이 잘 해결되셨으면 좋겠어요.,
모르겠어. 나 혼자 할 수 있는 건 아무것도 없을 것 같아.,주변에 감정을 나누고 이야기할 수 있는 상대가 있었으면 좋겠어요.,
연락을 다시 한 번 해볼까?,연락이 되셔서 서운함 감정 푸시길 바라요.,
그 분에게 내 입장을 설명을 해봐야겠어.,대화로 서로를 이해 하게 되길 바라요.,
일단 대화를 다시 해봐야겠어.,친구 분과의 관계가 좋아지길 바라요.,
친구한테 왜 그랬냐고 물어봐야겠어.,친구와의 관계가 회복되면 좋겠네요.,
일단 화가 진정되면 전화를 해봐야겠어.,친구와의 통화로 문제가 해결되길 바라요.,
지인 찬스로 들어왔을 텐데 회사 측에 고발해봐야겠어.,이 상황이 잘 해결되길 바라요.,
옆집에 과일을 가져다 주면서 한 번 물어봐야겠어.,옆집에서 악의적으로 떡을 버린 것이 아니었다면 좋겠네요. 좋은 이웃관계가 되길 바라요.,
주선해 준 애한테 도대체 어떤 사람인가 알아봐야겠어.,이 상황을 잘 극복하길 바라요.,
엄마에게 하소연 하면서 위로받고 싶어.,엄마와의 대화로 기분이 풀렸으면 좋겠네요.,
내가 열심히 하는 모습을 아빠에게 보여줘야겠지.,아버지에게 열심히 하는 모습을 꼭 보여주셨으면 좋겠네요.,
오늘 하루 언니와 같이 있어 줄 생각이야.,언니가 위로를 받기를 바라요.,
직접 찾아가서 말해 봐야겠어.,언니와 대화가 잘 풀리길 바라요.,
할머니가 어린 동생 편만 드는 건 심적으로는 불편하다는 걸 직접 말씀드려야겠어.,할머니와의 대화가 잘 풀렸으면 좋겠네요.,
그래. 이렇게 고민만 하지 말고 직접 이야기해봐야지.,어머니와의 대화를 통해 고민이 해결되었으면 좋겠어요.,
가만히 있기보다는 따로 만나서 이야기를 해 봐야겠어.,두분과 대화를 통해 좋은 결과가 있길 바라요.,
다음번엔 미리 말씀을 드린 뒤 도시락으로 만들어 보려고.,직접 만든 도시락으로 부모님이 감동받으셨으면 좋겠어요.,
그 전까지 미리 돈을 모을 거야. 잘 찾아보면 학교를 다니면서도 할 수 있는 아르바이트들이 있어.,아르바이트를 해서 수학여행에 갈 수 있었으면 좋겠네요.,
충격이지만 앞으로 새엄마랑 잘 지내야겠지?,앞으로 새엄마랑 잘 지냈으면 좋겠어요.,
누나에게 말해야겠어. 내 물건 같으니 돌려달라고 말하는 게 좋은 방법인 것 같아.,대화를 통해서 잘 해결 되었으면 좋겠어요.,
형과 먼저 대화를 해봐야겠어. 어떻게 할지 우리끼리 먼저 이야기해봐야겠어.,대화로 좋은 결론을 얻었으면 좋겠어요.,
글쎄. 아무것도 위로가 안 될 것 같아.,나를 위로할 방법이 없어 답답하시겠어요.,
슬프지만 받아들이고 아내한테 이야기해야겠지.,아내와 대화를 나누며 기분이 나아지셨으면 좋겠어요.,
글쎄. 지금은 아무것도 생각나지 않아. 마음만 아플 뿐이야.,슬픔이 너무 커서 아무것도 생각할 수 없으시군요.,
아무래도 운동이랑 식이요법을 도와줄 사람이 필요할 것 같아. 아들에게 부탁해봐야지.,아들에게 도움을 요청하여 상황이 잘 풀렸으면 좋겠어요.,
내가 할 수 있는 건 아무것도 없어. 미안하고 슬플 뿐이야.,아드님에게 많이 미안해 하고 계시는군요.,
일단 내가 아주 큰 상처를 받았단 사실을 말해 주고 사과를 받아야겠어.,친구와 대화가 원만하게 잘 되어서 사과를 꼭 받으셨으면 좋겠어요.,
친구에게 가서 내 마음 상태를 말해 줘야겠어. 그래야 어떤지 알겠지.,친구와의 대화가 잘 끝나 기분이 조금이나마 풀리셨으면 좋겠어요.,
남편에게 너무 기분이 나쁘니 사과하라고 말해야겠어.,남편과 대화가 잘 되어 사과를 꼭 받으셨으면 좋겠어요.,
카운터에 가서 컴플레인을 걸고 확실하게 의사전달을 해야겠어.,이야기가 잘 끝나 상처받고 속상한 마음이 잘 달래졌으면 좋겠어요.,
다른 헬스장에도 가서 상담해보고 비용을 비교해봐야겠어.,적정한 가격대로 운동하실 수 있길 바라요.,
왜 그런 말을 안 했는지 그냥 허심탄회하게 물어봐야겠어.,대화가 잘 끝나 께름칙한 기분이 조금이나마 풀리셨으면 좋겠어요.,
내게도 며칠 시간이 필요한 것 같아.,며칠 시간을 가지시면서 마음이 나아졌으면 좋겠어요.,
김 과장의 능력을 이제 확실히 알았으니까 그걸로 됐네.,진실을 알았으니 되었다고 생각하시는군요.,
힘들어도 옷이라도 좀 말끔히 입고 다녀야겠어.,사용자님의 기분이 좋아지시기를  바라요.,
내가 잘못한 게 아닌 말들은 그냥 무시할거야.,무시를 해서 사용자님의 기분이 좀 나아지셨으면 좋겠어요.,
가족들에게 사실대로 말하고 도움을 구해야겠어.,가족 분들과의 대화로 지금의 상황이 나아지셨으면 좋겠어요.,
사람들하고 이야기해서 오해를 풀어야겠어.,대화로 오해가 풀리기를 바라요.,
앞으로 잘 될 수 있다고 긍정적으로 생각해봐야겠어.,다 잘 해결되길 바라요.,
자식들한테 도와달라고 연락을 해봐야겠어.,자녀분들과의 연락으로 잘 해결되길 바라요.,
경찰에 신고하고 김 사장을 찾아내야겠어.,김 사장을 찾아서 꼭 문제를 해결하길 바라요.,
박 사장 부인 전화번호가 있으니 그쪽으로 연락을 해봐야겠어.,연락을 취해서 문제가 잘 해결되길 바라요.,
당장 주변 사람들에게 도움을 구해봐야겠어.,꼭 문제가 잘 해결되길 바라요.,
영순 할머니가 갈 만한 곳에 다 가봐야겠어.,조만간 영순 할머니와의 문제가 잘 해결되길 바라요.,
남편과 한번 진지하게 이야기를 나눠봐야겠어.,남편 분과의 대화를 통해 이 문제가 속히 해결되면 좋겠어요.,
이 상황에서 뭘 어찌 해야 할지 도무지 모르겠어.,따님이 힘을 얻으시기를 바라요.,
우선은 할 수 있는 일을 찾아봐야겠어. 간호를 잘 해야지.,남편 분께서 속히 건강이 회복되시면 좋겠어요.,
부디 걱정했던 것만큼 심각한 상황만은 아니길 바라야지.,심각한 상황이 아니었으면 좋겠어요.,
내 마음을 자세히 전달해 봐야겠네. 딸이 내 마음을 이해해주면 좋겠어.,나의 마음이 따님에게 잘 전해졌으면 좋겠어요.,
우선 아들과 솔직하게 이야기를 나눠봐야겠어.,아드님과 대화를 통해 이 문제가 잘 해결되면 좋겠어요.,
당장 하고 싶은 일과 미래를 위한 투자에 대한 저울질에 대해 이야기 해봐야겠어.,사용자님의 마음이 따님에게 잘 전해졌으면 좋겠어요.,
내가 옆에서 정성껏 간호 할거야.,정성 어린 간호로 지금 상황을 잘 극복하길 바랄게요.,
자식들과 대화를 해서 찾아오지 않으면 유산 한 푼 주지 않겠다고 해야겠어.,대화로 상황이 잘 해결되시길 바랄게요.,
남편을 많이 생각하고 좋은 곳으로 갔기를 기도해야겠어.,원하시는 대로 이루어지시길 바랄게요.,
어떤 지원도 아끼지 않고 다 할 거야. 간호도 열심히 할 거야.,정성 어린 간호와 지원으로 지금 상황을 잘 극복하길 바랄게요.,
친구와의 추억을 되새기면서 다시 만나게 될 날을 기다리겠어.,생각하시는 대로 이루어지시길 바랄게요.,
이따 전화해서 대화라도 해봐야지.,며느리분과의 대화가 잘 이루어졌으면 좋겠네요.,
모르겠어. 이제 정말 이런 게 남일 같지도 않아.,우선 얼른 놀란 마음이 진정되셨으면 좋겠네요.,
나까지 아프면 큰일이니 앞으로 건강 잘 챙겨야겠어.,지금 다짐으로 상황을 극복하시길 바라요.,
아직 어린애들이니 그냥 자주 보면 또 익숙해지겠지 라고 생각해보려고.,손자분들이 얼른 익숙해지면 좋겠네요.,
친구도 많이 속상할 텐데 나라도 마음을 다잡아야겠지.,마음을 다잡고 상황을 잘 극복해내시길 바랄게요.,
모르겠어. 주민 센터에 전화해서 도움을 요청해볼까.,부디 상황이 잘 해결되었으면 좋겠네요.,
그냥 당분간 집 밖에 안 나가고 싶어.,상황이 얼른 나아졌으면 좋겠어요.,
다시는 이런 일이 생기지 않도록 내가 언니 옆에 항상 붙어있어야겠어.,부디 당신의 바람대로 이루어졌으면 좋겠어요.,
내가 친구한테 조금이라도 힘이 되어주고 싶어.,친구분께 당신의 진심이 전해졌으면 좋겠어요.,
내가 옆에서 잘 돌봐드리는 게 최선이겠지.,얼른 상황이 나아지길 바랄게요.,
이제 평생 내가 옆에서 다 챙겨줘야겠지.,상황을 잘 극복하고 이겨내셨으면 좋겠어요.,
너무 혼란스럽고 아무것도 하고 싶지 않아.,충격적인 소식에 마음이 많이 괴로우실 것 같아요.,
치매에 걸린 아내이지만 정성껏 돌보고 아껴주어야겠어.,아내에게 따뜻한 마음이 전달되었으면 좋겠어요.,
앞으로 아이와 대화하는 시간을 많이 가지려고.,대화를 통해서 서로를 알아가는 시간이 되면 좋겠어요.,
죽음을 준비할 수 있겠구나. 마지막 추억들을 남기면서 기다릴 수 있겠어.,주변의 소중한 사람들과 좋은 추억 남겼으면 좋겠어요.,
친한 동료에게 이야기를 털어놓으면 될 거 같아.,친한 동료와 위로가 되는 시간이 되길 바라요.,
약만 다시 제대로 처방받으면 완치할 수 있다고 했어. 천만다행이야.,옳은 처방으로 병을 완치할 수 있었으면 좋겠어요.,
미안하지만 자식들에게 도움을 요청해야 할까 봐.,자식들에게 도움을 요청해서 상황을 잘 극복하면 좋겠어요.,
자식들에게 도움을 신청해 봐야 할 것 같아.,도움을 신청해서 상황을 잘 극복하기를 바라요.,
못 해본 것들을 많이 해봐야겠어.,못 해본 걸 해보고 기분이 나아졌으면 좋겠어요.,
손자들과 대화를 많이 해보려고 해. 그래야 내 마음을 알아줄 것 같아.,대화를 많이 해서 지금 상황을 잘 극복했으면 좋겠어요.,
짧게 남은 인생 더 즐기고 싶어. 고통스럽지만 후회스럽지 않게 가고 싶어.,지금 생각이 전보다 나은 상황으로 이어지길 바라요.,
자식들에게 나의 건강함을 알려야겠어.,대화로 지금 상황을 잘 벗어났으면 좋겠어요.,
친구들과 맛있는 것을 먹으면서 수다를 떨면서 기분 전환을 해야겠어.,맛있는 것도 먹고 친구들과의 대화로 기분이 나아지면 좋겠어요.,
다른 친구들과 김 씨를 생각하며 술 한잔 마시며 슬픔을 달래야겠어.,친구들과의 술 한 잔으로 슬픔을 달랠 수 있으면 좋겠어요.,
물리치료를 받으면서 최대한 마비가 늦게 오게 해야 할 것 같아.,물리치료로 지금보다 더 나은 상황이 왔으면 좋겠어요.,
음식도 저염식으로 먹고 운동도 하고 혈압약도 꾸준히 잘 챙겨 먹으려고 해.,꾸준한 관리로 지금 상황을 잘 극복해 냈으면 좋겠어요.,
뇌졸중 초기라 조치만 잘 취하면 문제없다고 안심시켜야겠어.,빠른 조치로 탈 없이 완쾌하셨으면 좋겠네요.,
내일 학교에 가서 선생님께 다시 한 번 더 진지하고 정확하게 지금 상황과 내 감정을 말씀 드려야겠어.,선생님께 다시 진지하게 얘기해 보려 하시는군요.,
담임 선생님께 그 영상을 보여드리면 나를 도와주실 거야.,담임 선생님께 도움을 요청하려 하시는군요.,
