human,system,
오늘 성적이 너무 하락했어. 충격이야.,괜찮으세요? 많이 떨어지셨어요?,
오늘 내 생일인데 엄마가 망각하고 출장갔어!,생일인데 진짜 속상하시겠어요.,
내가 학교에서 왕따 당하고 있는데 오늘은 맞기까지 했어.,맞았다니 당황하셨겠어요. 맞으신 데는 괜찮으신가요?,
아빠가 불치병에 걸리셨어. 진짜 충격이네.,충격이 크시겠어요. 어떤 질환에 걸리신 건가요?,
내가 학교에서 왕따 당하는데 오늘은 맞기까지 했어.,맞았다니 당황하셨겠어요. 맞으신 데는 괜찮으신가요?,
아빠가 불치병에 걸리신 것 같아. 진짜 충격이네.,충격이 크시겠어요. 어떤 질환에 걸리신 건가요?,
오늘 약속에 친구들이 한명도 나오지 않았어.,약속 장소가 변경된 건가요?,
퇴직 후에 좋은 점 한가지 말해줄까?,네. 얘기해 주세요.,
나이 든 어른이라고 다 살 집이 있는 건 아닌데 말이야.,갑자기 그런 생각을 하시게 된 게 아닐 거 같은데요. 계기가 있을까요?,
요즘 내가 생각하는 일들이 부하 직원에게 호응을 받지 못하는 것 같아.,부하 직원들의 지지를 받지 못하신다는 말씀이죠?,
마누라가 예전 같지 않고 바가지를 자주 긁어!,아내와의 관계 때문에 힘드시군요.,
직장 생활이 정말 어렵네. 야근도 많고.,직장 생활이 힘이 드시는군요.,
동생하고 연락을 안 하고 살아.,동생하고 연락을 안 하시는군요. 무슨 일이 있으셨나요?,
요즘 집사람이 사사건건 내 말에 반대만 하고 시비를 거네.,부인과 무슨 일이 있으셨나요?,
나이들어서 주위사람들로부터 호감이 떨어져서 너무 실망스러워.,다른 사람들의 호감이 떨어졌다고 여기시나요?,
사람은 간사하구나.,그런 생각을 하게 되신 계기가 있을까요?,
나이가 들면서 회사 직원들이 무시하는 게 느껴져.,나이가 들어서 직원들이 무시하는 느낌을 받으시는군요.,
나이 들고 심각한 질환이 생기니 마누라가 내게 잘못하니 젊은 시절 내가 못한 것을 앙갚음한다는 생각이 자꾸 들어. 내 인생은 철저히 실패한 인생이란 패배감과 말이야.,젊은 시절 가끔 사모님께 못 해 드린 것이 가슴에 와 닿아 많은 생각들을 하고 계시는군요.,
이런 감정 정말 견디기 힘이 드네.,어떤 감정을 말씀하시나요?,
주위의 어떤 모임에서나 회장단을 맡고 왕성히 살아오다가 증세가 없었는데 육십 이 넘어 갑자기 협심증으로 수술을 받으니 이제는 아무것에도 의욕이 없어.,최근에 수술을 받으시고 의기소침해 계시는군요. 완전 회복의 길은 없는 건지요?,
직업을 바꾸는 것을 진지하게 고려하고 있어.,이직을 생각하시는 이유가 있나요?,
모임에서 회장 선출하는데 떨어졌어.,많이 아쉬우셨겠어요.,
요새는 어디 가도 내 말발이 먹히지 않아 실패한 인생이란 자책감이 많이 들어. 젊을 때는 잘 먹혔는데 말이야.,그렇게 된 원인이 뭐라고 생각하시나요?,
오십 대에 군의원 한번 하고 육십 대에 선거에서 낙선하니 동네에 나가면 주민들이 대하는 태도가 아주 마음에 안 들어.,낙선하셔서 상심이 크시겠어요.,
요즘 사람들이 왜 이래?,무슨 일이 있으셨나요?,
우리 집사람이 도박중독이란 거 회사 사람들이 알아버렸어. 정말 고개를 들 수가 없고 창피해.,회사에서 아내분의 일을 알았군요. 그 일이 일하는 데 지장을 주나요?,
나이 육십이 넘으니 취직도 안 돼.,직장 구하기 힘드신가 보네요.,
나의 친구들은 모두 부자인데 나는 가난해서 화가 나.,경제적으로 차이가 나서 불편하시겠어요.,
나 이번에 또 승진에서 탈락했어. 승진 발표 때마다 탈락하니 회사를 그만 다니고 싶어.,승진이 안 되어 상심하셨겠어요.,
내가 고삼일 때 아버지 사업이 망했어. 그땐 참 꿈도 많았는데.,어릴 때 많이 힘드셨겠어요.,
내 인생은 실패한 것 같아.,어떤 계기로 그렇게 느끼시는지 말씀해 주시겠어요?,
나이 들어 몸에 병이 생기니 어딜 가도 인간 취급을 못 받아. 헛산 인생이지.,무엇 때문에 그렇게 낙담을 하고 계십니까? 건강 때문에 그러시는지요?,
나이 먹은 사람 중에 성공한 인생과 그렇지 못한 인생의 차이는 뭘까?,참 어렵고 쉬운 문제네요.,
사회생활에 실패한 경험이 많다네.,사회생활에 실패한 경험이요?,
노년에 실패한 사람이 되고 싶지는 않네.,더 자세히 얘기해주시겠어요?,
난 실패한 인생이야.,실패한 인생이요?,
난 정말 실패한 인생이야.,그렇게 생각하신 계기가 있으실까요?,
나 지금 너무 비관적이야.,무슨 계기로 그렇게 느끼게 되셨나요?,
집 안에서도 밖에서도 나의 자리가 없어.,어디에도 속하지 못한다는 느낌을 받으시나요?,
나이 먹고 몸이 불편해서 힘들어.,몸이 예전 같지 않으셔서 힘드신가 봐요.,
직장 퇴직 후 마땅한 일을 찾지 못해 지인과 동업으로 과일가게 시작했는데 몇 달 못하고 빚만 늘었네.,과일 가게를 여셨군요. 근데 어떤 일로 어려움을 겪고 계신가요?,
눈이 침침하다 못해 돋보기에 확대경까지 필요하고 시력 좋던 눈은 백내장에 녹내장 걱정도 해야 한다네.,시력이 안 좋아 지고 있으신가 봐요. ,
오래된 지인들과의 친목 모임이 얼마 전 해체되었다네.,모임이 해체되었군요.,
요새 친구들과 연락이 뜸해져서 외롭네.,친구들과 연락이 뜸하시군요.,
내 삶은 실패한 것 같아. 돈도 많이 없고.,돈이 중요한 것은 사실이지만 절대적이진 않으니 너무 비관적으로 생각하시지 마세요.,
사회적지지를 받지못해 비관적이야.,그런생각을 왜하시나요?,
올바른사회지지가 필요한거같아.,사회적지지는 중요한거같아요.,
퇴직하고 나니 내가 아무 쓸모도 없는 실패한 인생인 것 같애,왜 그런 비관적인 말씀을 하시나요?,
인생을 헛산 것 같아.,그렇게 느끼시는 이유가 있나요?,
젊었을 때는 매우 흔한 게 사람이고 널려 있는 게 친구인 줄 알았는데 인제 보니 그게 아니네.,주변 분들이 한 분 두 분 줄어든다는 게 느껴지시나 봐요?,
난 이제 틀렸어.,비관하시는군요. 무슨 일 있으신가요?,
나 지금까지 살아온 인생이 패자 같다는 생각이 자주 들어.,패자 같다고 느끼시는군요. 자세히 말씀해주세요.,
사는 게 힘드네.,무슨 일 있으세요? 특별히 힘든 일이라도 있나요?,
지금까지 살아오면서 실패한 인생이라고 생각한 적은 한 번도 없었는데.,좀 더 자세히 이야기를 들을 수 있을까요?,
편히 쉬어야 할 나이에 일해야 먹고 사니 괴롭네.,왜 그런 생각 하세요. 건강하게 일하시는 모습도 보기 좋아요.,
따지고 보면 인간이란 동물과 뭐가 다른가. 너무 기대가 크면 실망도 크다.,네. 기대가 크면 실망도 클 것 같아요.,
나는 실패한 인생이야.,자신의 인생이 실패하셨다고 생각하시는 데 그렇게 생각하시는 이유가 있나요?,
이젠 아무도 나를 믿어주지를 않아.,영철님을 믿어주지 않는다고 생각하시는 계기가 있었나요?,
젊은 날 열심히 노력해서 고위 공무원으로 정년 퇴임했는데도 아무도 찾아주는 사람이 없어.,높은 자리에 오래 있으면서도 이어지는 인연이 없어 무척이나 허무하신 모양입니다. ,
직장에선 잘 나가는 유능한 과장이었는데 이제는 집에서 어깨를 못 펴겠어. ,예전과는 다른 입신이 무척 낯설게 느껴지시나 봅니다. ,
사람들은 나를 싫어해. 나를 만나주려는 사람이 별로 없어. 살고 싶지 않아.,사람들이 싫어한다는 것을 어떤 계기로 느끼셨어요?,
나는 실패한 인생이야., 왜 본인의 인생이 실패했다는 생각이 드시나요?,
언니가 뇌출혈로 쓰러졌는데 오히려 내가 우울증이 왔어,언니분의 병환이 큰 충격으로 받아들여지셨나 봅니다. ,
온 몸이 아프니까 내 삶이 비관적이고 실패한 삶 같네.,몸이 아프셔서 더 그런 생각을 하시는 것 같아요.,
그냥 화가 나. 내가 뭘 잘못한 건지.,왜 화가 나시나요?,
나는 대단한 새로운 걸 창조해냈다고 생각했는데 다른 사람들은 전혀 관심이 없는 것 같아.,어떤 새로운 걸 창조하신 건가요?,
왜 잘나가는 사람들을 질투하는지 그 심리를 이제는 알겠어.,깨달은 걸 구체적으로 이야기해주실 수 있나요?,
아들이 곧 대학생인데 등록금 마련하기가 너무 부담돼. 어떻게 하지?,자녀분의 등록금을 마련하기가 부담되시는군요. 힘드시겠어요.,
인생 목표가 없어서 내 인생이 실패한 것만 같고 비관적으로 느껴져.,인생 목표가 없어서 인생이 실패한 기분이 드시는군요.,
나이 먹으니 소득이 많이 줄었어. 나는 실패한 인생이야.,소득이 많이 줄어 힘드시겠어요.,
내가 하던 한복 사업이 망했어. 내 브랜드는 실패한 브랜드가 되었어.,사업에 실패하여 많이 힘드시군요.,
요즘 잦은 회식 때문인지 지방간이 생겼어.,잦은 회식 때문에 지방간이 생기셨군요.,
아내에게조차 신뢰받지 못하는 나는 실패한 사람 같아.,아내에게 신뢰받지 못해 실패감을 느끼시는군요.,
부모님은 늘 내가 청각장애가 있다는 이유로 아르바이트를 반대해. 난 실패작인 걸까.,부모님의 아르바이트 반대로 많이 슬프시겠군요.,
내 우울증을 친구들에게 이야기하면 싫어하겠지. 해봤자 싫은 소리만 들을 거야.,친구들에게 자신의 우울증을 이야기해야 할지 고민이 많으시겠어요.,
직무가 나한테 안 맞아 스트레스가 많아져서 이직하려 했는데 보기 좋게 실패했어.,이직을 못 하게 되어서 마음이 안 좋으시군요.,
이번에도 일하던 사람들과 좋지 않게 일을 그만두고 나왔어. 역시 또다시 실패해버렸어.,함께 일하던 사람들과 안 좋은 관계로 일을 그만두셨나 봐요. 많이 속상하셨겠어요.,
앞으로 무엇을 목표로 살아야 할지 모르겠어. 난 실패자야.,목표를 잃어서 상심이 크시군요.,
요즘 나 자신이 너무 한심한 것 같다는 생각이 자꾸 들어서 힘들어.,자신이 한심하다고 생각하셔서 힘드시군요.,
아이가 아픈데 연차를 못 써서 유치원에 맡기고 왔어. 아이에게 못 할 짓을 한 것 같아.,아픈 아이를 유치원에 맡기고 회사에 가서 아주 속상하시군요.,
사춘기 겪는 아들이 맨날 사고 쳐서 지치고 힘들어. 내 자녀 교육은 실패한 거 같아.,자녀분이 사고를 치고 다녀서 마음고생이 심하시군요.,
나는 항상 잘못해서 가족들에게 학대를 당하는 것 같아.,가족들에게 학대를 당하는 것이 자신의 탓인 것 같아 기분이 안 좋으시군요.,
시험 기간에 게임만 했어. 그랬더니 게임 때문에 성적이 안 좋게 나와서 아빠한테 혼났어.,게임 때문에 성적이 안 좋게 나와서 아빠께 혼이 났군요.,
요즘 취업난이 심각해서 직장을 구하는 게 쉽지 않아. 이번 면접에서도 떨어졌어.,취업이 쉽지 않은 상황으로 마음이 아주 힘드시겠어요.,
회사에서 직무 때문에 스트레스를 받는데 남편 소득도 적어 일을 그만둘 수도 없어.,직무 스트레스가 있는 상황에 경제적으로도 곤란하셔서 마음이 힘드시군요.,
요즘 서로 회사일 때문에 스트레스받아서 남편이랑 싸우는 일이 잦아.,업무 스트레스로 남편과 싸우는 일이 잦으시군요.,
직장 생활을 하는데 나이가 많다 보니 대인관계가 축소돼서 비관적이야.,나이 때문에 대인관계가 축소되어 속상하시겠어요.,
몇백 군데 이력서를 넣어봐도 면접은커녕 서류합격도 못 해. 역시 내 스펙이 부족한 거야.,여러 군데 이력서를 넣어도 합격이 되지 않아 걱정이시군요.,
자식들 뒷바라지하느라 아직 일하고 있으니 친구들도 못 만나고 내가 뭘 하는지도 모르겠다.,자녀분들을 지원하느라 아직 일하고 계시니 자기 생활이 없어서 힘드시군요.,
어제 딸이 울면서 전화했어. 내가 가지고 있는 병으로 가족들을 힘들게 안 했으면 좋겠대.,가지고 있는 질환 때문에 가족과의 갈등이 있으셨군요.,
요즘 남편이 주식에 미친 것 같아 너무 화가 나. 주식이 망해서 우리 집 이사했어.,남편의 주식으로 인해 엄청 속상하시겠군요.,
요즘 우리 가게에 손님이 한 명도 없어서 곧 있으면 망할 거 같아 너무 짜증 나.,식당 매출의 감소로 인해 속상하시겠군요.,
아무것도 하고 싶지가 않아. 너무 무기력하고 우울해.,무기력하고 우울한 마음이 들었군요.,
장애가 있다는 걸 알게 되면서 주변에 나를 지지해주던 사람들의 태도 달라졌어. 허탈한 것 같아,지지해주던 사람들이 태도가 달라져서 허탈하셨겠네요.,
내가 사고 후에 못 걷게 되었어. 더 비참한 건 부모님이 어디 갈 때마다 따라오려고 해.,다리를 다치신 후에 부모님의 간섭 때문에 비참함을 느끼셨군요.,
대학을 가기 위해서 입시 준비를 열심히 하면서 점점 우울해지기까지 했어. 그런데 대학에 떨어졌어,고등학교 인생을 바쳤을 텐데 너무 힘들고 슬펐겠어요.,
게임을 많이 해서 낮아진 성적 때문에 부모님과 다퉜어. 또 실패한 것 같아.,게임으로 인해 낮아진 성적 때문에 실패한 것 같은 기분이 느끼셨군요.,
자꾸 엄마랑 아빠가 잔소리해서 짜증 나! 친구들이랑 안 노냐고 해.,부모님이 친구 관계에 대해 잔소리를 해서 짜증이 났군요.,
남편이 죽고 나니까 죽은 것만 힘든 줄 알았는데 돈이 없어서 힘드네.,사별 후의 생계 때문에 힘드시군요.,
부모님이 오빠와 나를 비교하며 자꾸 나를 깎아내려. 그래서 내가 실패한 사람처럼 느껴져.,부모님의 지지 부족으로 스트레스를 받고 계시는군요.,
회사에서 명예퇴직을 강요하는군. 내 딸은 이제 대학생인데 말이야.,회사에서 힘든 일이 있으셨군요.,
일하던 곳에서 해고됐어.,직장에서 해고되어 속이 상하시군요.,
남편과 잦은 다툼으로 우울증이 생겨서 실패한 인생 같다는 생각이 들어.,남편과 다툼으로 인한 우울증으로 비관적이시군요.,
결혼해서 이제 돈을 벌어야 하는데 공무원 시험 때문에 학업 스트레스가 커서 비관적이야.,공무원 시험 때문에 학업 스트레스가 커서 힘드시겠어요.,
얼마 전 췌장암 말기판정을 받았어. 말기라 치료를 받아도 희망이 없는 것 같아.,췌장암 말기판정으로 비관적인 감정이 드시는군요.,
건강검진 결과가 나왔는데 폐암이래.,정말 슬프겠어요.,
다니던 회사에서 잘려서 경제적으로 문제가 생겼어. 이번 생은 실패한 것 같아.,회사에서 나와 경제적 불안까지 더해져서 많이 힘드시겠네요.,
남편이 죽었어. 이제 나 혼자 어떻게 살아가지?,남편분이 돌아가셔서 슬프시군요.,
내 공황장애가 친구들을 자꾸 불편하게 해. 앞으로도 친구들과 친해질 수 없을 것 같아.,장애로 인해 친구 관계에 문제가 생겨 괴로우시군요.,
요즘 따라 내가 뭘 위해서 열심히 살았나 싶고 허탈한 기분이야.,지속되는 허탈감에 많이 속상하시군요.,
대학에 들어오고 나서 목표가 사라졌어. 학점도 낮고 전공도 맞지 않아서 실패한 인생 같아.,청소년 시절 목표였던 대학입학을 이루고 나니 목표가 사라져서 실패한 기분이 드시는군요.,
내가 얼마 전 허리를 다쳐서 병원에 입원했는데 아무도 찾아오지 않았어. 실패한 노년이야.,병원에 입원해 있는 중에 아무도 찾지 않아 허탈하셨군요.,
회사 안에서 따돌림을 당하고 있어. 잘하고 있다고 생각했는데 실패한 기분이 들어.,회사 내에서의 불화로 기분이 상하셨군요.,
경제 불황으로 회사 월급이 감소했는데 월급 액수를 보니 나의 낮은 지위 때문인 것 같아.,낮아진 월급으로 자신감이 떨어지셨군요.,
지속되는 탈모로 자신감이 없어졌어. 팀원들도 나를 무시하는 것 같아.,신체장애로 인한 자존감 하락으로 고민이 있으시군요.,
엄마한테 취업 못 한다고 꾸중을 들었어. 매우 스트레스를 받았어.,취업을 못 한다고 꾸중을 들어 스트레스를 받으셨군요.,
남편한테 일이 너무 힘들다고 말했더니 너만 힘드냐고 하네. 내 마음을 알아주면 좋겠는데.,남편이 마음을 알아주지 않아 속상하시겠어요.,
학원도 못 다니고 혼자 공부하니 자꾸만 성적이 떨어져. 난 뭘 해도 안 될 거 같아.,성적이 떨어지니 앞으로 하는 일에 대해 자신이 없으시군요.,
난 음악 교사인데 돌발성 난청이 생겼다는 사실을 알게 되었어. 난 이제 교사를 못 하겠지.,음악을 가르치는 교사이신데 난청이 생기셔서 많이 힘드시겠군요.,
난 경계선 인격 장애 때문에 회사에서 해고당했고 일용직을 해. 다신 복직을 못 할 거야.,가지고 계신 정신 장애 때문에 소득이 많이 줄어드셔서 슬프시겠군요.,
아내와의 결혼 생활이 오래되니 이젠 아내가 날 봐주지 않아. 너무 외롭고 쓸쓸하네.,부인께서 결혼 생활에 신경을 써주시지 않으셔서 많이 쓸쓸하시군요.,
지방대를 나와서 그런지 취업이 계속 안 돼. 너무 불안해.,취업이 되질 않아서 많이 불안하시군요.,
나이가 많아서 하는 일도 없고 요즘 함께 대화를 나누는 사람도 많이 없어서 너무 외로워.,지금 하는 일이 없고 함께 대화를 나누는 사람이 많이 없어 외로우시군요.,
요즘 젊은이들 내가 나이가 들었다고 뭔 말만 하면 꼰대라고 비아냥거리면서 내 말을 듣질 않아.,젊은 분들과 대화가 힘들어서 속상하시겠어요.,
응원해주는 사람도 없고 지지해주는 사람도 없는 내 인생은 실패한 것 같아.,인생이 실패한 것 같다는 생각이 드시는군요.,
다리를 못 쓴다고 못 걷는 게 아닌데 부모님은 날 멀쩡한 사람으로 대해주지 않아.,부모님께서 무능력한 사람으로 보시는 것 같아서 정말 속상하겠어요.,
회사에서 중요한 프로젝트를 진행하고 있는데 간암에 걸린 것을 알아버렸어. 실패한 인생이야.,암에 걸리셨다니 많이 힘드시겠어요.,
불편한 다리 때문에 더는 일을 못 하니까 아무도 날 찾지 않아. 삶이 허탈하게 느껴져.,사용자님을 아무도 찾지 않아 허탈한 기분이 드시는군요.,
불안장애 때문에 계속 친구들 사이에서 눈치를 봐. 불안장애 때문에 뭘 하든 안 될 거야.,불안장애 때문에 주변 눈치를 보셔서 실패한 듯한 기분이시군요.,
내 신체적 장애 때문에 부모님의 간섭이 너무 심해.,부모님의 간섭이 심해서 힘드시겠어요.,
나는 실패자야. 무슨 일을 하든 성공하지 못할 것이 뻔해.,마음이 괴로우시군요.,
요즘 친구들 사이에서 눈치가 보여. 내가 실패한 사람 같다는 패배감이 들어.,친구들 사이에서 눈치를 보느라 힘드셨겠군요.,
나는 다리가 불편한데 엄마가 매일 따라다니면서 지나치게 간섭해. 혼자서는 아무것도 못 해.,엄마의 간섭이 지나치다 보니 혼자서는 아무것도 할 수 없다는 부정적인 생각이 들었군요.,
친구랑 다퉜는데 그 후로 다 나를 싫어하는 것처럼 느껴져. 같이 있어도 눈치를 보게 돼.,친구들이 싫어할까 봐 같이 있어도 눈치를 보게 되는군요.,
요즘 집에 들어가면 엄마가 날 때려서 들어가기 너무 겁나.,집에 들어가시는 게 아주 두려우시겠어요.,
얼마 전에 한 건강검진에서 유방암이라는 진단을 받았는데 앞으로 회사를 다닐 수 있을지 걱정돼.,유방암이라니 너무 슬픈 소식이네요. 게다가 직장 거취도 문제가 되고 계시는군요.,
내 체력이 예전 같지 않다 보니 현장 일에서 나를 원하지 않는 것 같아 슬프네.,예전 같지 않은 체력 때문에 일에 지장이 있으시군요?,
남편과의 불화와 우울증으로 이혼을 했어. 난 실패한 인생이야.,남편과의 불화와 우울증으로 아주 힘드시겠어요.,
아버지께서 술을 드시고 오셔서 폭언을 하셔서 너무 힘들어.,아버지의 폭언 때문에 많이 힘드시네요.,
대학원 공부가 많은데 집안에서 결혼을 서두르려고 해서 힘들어.,학업에다 결혼문제로 힘드시네요.,
내 인생은 실패했어. 아무도 날 존경하지 않아.,인생이 실패했다고 느껴 자신을 비관하고 계시는군요.,
과도한 업무로 인해 심장질환이 생겼어. 수술을 받아야 하는데 회사에 말하면 잘릴 것 같아.,건강 상태가 많이 안 좋으시군요.,
아내가 금전적 문제에 시달리다 세상을 떠났어. 나는 실패한 인생이야.,배우자와 사별하고 실패한 인생이라는 생각이 들어 힘드셨겠어요.,
일하며 인간관계에 지치고 허탈한 감정들에 외로워 실패한 삶처럼 느껴져.,인간관계에 있어 많은 어려움을 느끼고 계시는군요. 많이 속상하시겠어요.,
나는 왜 사는 걸까? 뭐 하고 싶은지도 모르겠고 실패한 인생인 거 같아서 짜증 나.,뚜렷하지 않은 목표 때문에 기분이 혼란스럽군요.,
직장에서 은퇴를 했어. 이제 아무것도 아닌 사람 같아서 아내 앞에서 주눅이 들어.,아무것도 아닌 사람이라는 생각이 들어 아내 앞에서 주눅이 드시는군요.,
학교에 가면 자꾸 친구들 눈치를 보게 돼. 다 나를 싫어하는 것 같아.,친구들과의 관계가 힘드시군요.,
작년에 아내와 사별하고 아이 둘을 혼자 키우는데 여의치 않아서 정말 힘드네.,혼자서 아이 둘을 키우시면 많이 힘드시겠어요.,
공무원 시험에 세 번 떨어졌어. 너무 절망스러워.,시험에 떨어져 너무 힘드셨군요.,
아내가 대학원 공부할 때마다 장학금 이야기를 꺼내. 난 자신 없는데.,아내가 장학금 이야기를 할 때 마다 우울하시군요.,
건강 상태가 많이 악화하고 있어. 치료받으러 다니면 직장에서 잘릴 거야.,치료와 직장 사이에서 고민하고 계시는군요.,
걷는 것도 힘드니 나를 바라보는 시선도 영 좋지 못하네.,사회적 시선이 힘드셨군요.,
퇴직하고 나서 나를 지지해주는 사람이 없어. 아내에게도 대우를 못 받으니 허탈하네.,사회적으로 지지를 받지 못해 허탈하시군요.,
젊었을 때 좀 더 많은 사람을 사귀고 좋은 직장을 갈 걸 난 실패한 인생인 것 같아.,젊었을 때 못한 것을 실패했다고 생각하시는군요.,
내 아내는 내가 대학원생인 거에 불만이 많은가 봐. 내가 잘하고 있는가 요즘엔 잘 모르겠어.,아내의 불만에 고민이 있으시군요.,
수능 성적이 너무 좋지 않아서 원하는 대학을 진학할 수 없을 거 같아.,결과가 나빠서 속상하시겠어요.,
결혼 후에 삶이 더 힘들어졌어. 대학원을 병행하니 아내가 힘들어해.,결혼 후 학업 스트레스가 있으시군요. 많이 힘드시겠어요.,
아내의 장례를 치르고 나니  생활이 넉넉하지 않아. 실패한 인생이야.,아내가 죽고 생활이 어려워져  마음이 괴로우시군요.,
이번에 병이 더 심해졌다는 결과가 나왔네. 내 인생은 정말 실패한 인생이야.,병세가 더 악화하셔서 많이 힘드시군요.,
우리 대학교는 교육 수준이 너무 높아서 나만 늘 하위권이야. 내 미래의 전망이 안 보여.,교육 수준이 높은 학교에서 하위권이라 미래에 대해 불안하시군요.,
내가 실패한 인생이라 만날 가족들한테 맞는 건가 봐.,실패한 인생이라고 생각하여 비관적인 감정을 가졌군요.,
나도 결혼을 해야 할 때가 됐는데 결혼을 하면 학업을 챙기지 못할 것 같아 걱정이야.,결혼으로 인해 소홀해질 학업에 대한 걱정이시군요.,
내 진로가 무엇인지 고민돼. 내 미래가 성공적이지 않을 것만 같아.,요즘 진로 문제로 고민이 많으시군요. 많이 힘드시겠어요.,
결혼생활과 육아가 내 학업에 지장을 주고 있어.,결혼생활과 육아로 인해 스트레스가 많으시군요.,
나는 이제 암 환자니까 사람들이 나를 무시하겠지? 그러면 나는 혼자서 죽어갈 거야.,조금 더 자세하게 말씀해주시겠어요?,
