human,system,
내가 주도했던 프로젝트가 채택이 안 되었어. 팀원들 볼 낯도 없고 너무 슬프네.,프로젝트가 채택이 안 된 것에 크게 낙담하셨군요.,
오늘 소개팅 나갔는데 완전히 망했어.,오늘 아쉬운 일이 있었나 봐요. 무슨 일인지 말씀해 주시겠어요?,
세상에. 뼈에 금이 가다니 나도 많이 약해진 것 같아 슬프네.,뼈를 다치셔서 많이 슬프시겠어요.,
이번에 며느리가 손자를 낳았는데 보고 싶어도 내가 이렇게 입원해 있으니 아쉽네.,손자를 보지 못해서 많이 아쉬우시겠어요.,
아들이 친구랑 놀 때 나를 욕하는 걸 들었어. 내가 그런 부모라니 속상하고 참담해.,아이가 친구와 놀면서 사용자님을 모욕하는 말을 했군요. ,
학부모 면담 때문에 딸 아이 학교에 갔는데 나를 보고도 모른 체하더라. 정말 속상해.,따님이 사용자님을 모른 체해서 낙담하셨군요.,
우리 딸이 학교에서 다른 아이들을 괴롭혀서 정학을 당했다고 하네. 부모로서 참담한 심정이야.,그런 일이 있으시군요. 많이 슬프시겠어요.,
나는 은퇴할 나이가 되었는데 아내가 작년에 교통사고로 죽으면서 우리 가족의 미래가 불투명한 것 같아.,아내의 사망과 은퇴로 낙담하신 것 같군요.,
아내는 나에게 한 번도 사랑한다고 한 적이 없어. 나를 사랑한 적이 없는 거 같다는 생각에 너무 슬퍼.,아내분이 사용자님을 사랑하지 않는다고 느껴서 당황스러웠겠어요.,
내 친구는 자식과 손주들이 엄청 잘 챙기는데 우리 자식과 손주들은 그러지 않아서 부러우면서 슬퍼.,당신에 비해서 친구의 자식과 손주는 친구를 잘 챙겨준다니 슬프면서도 부럽겠어요.,
언제부턴가 아내는 자식 얘기만 꺼내면 무조건 자식 편만 드네.,자식 얘기만 꺼내면 무조건 자식 편을 드는군요. 많이 서운하시겠어요.,
내가 그리 잘해준 건 없지만 그렇다고 못 해준 것도 없는데 아내는 내 친구와 나를 왜 비교하는지 모르겠어.,아내가 친구분과 비교를 하는군요. 많이 속상하셨겠어요.,
우리 자식은 무슨 일이든 얘기 좀 하려고 하면 다들 나를 피해서 나 자신이 한없이 초라해지는 것 같아.,많이 속상하시고 초라함을 느끼시는 마음 이해해요.,
우리 손주들은 용돈 준다고 놀러 오라고 해도 전화 한 통도 없어.,용돈 준다고 해도 손주들이 오지 않군요. 많이 서운하셨겠어요.,
어릴 때부터 큰 손주를 키우다시피 했는데 요즘 큰 손주가 나를 보면 데면데면하네.,큰 손주가 데면데면하군요. 많이 서운하시겠어요.,
남편은 건강해서 자식들에게 병원비 부담을 안 주는데 난 아픈 못난 엄마라 자식들에게 병원비 부담을 주네.,많이 아프시군요. 남편분과 비교되니 많이 속상하시겠어요.,
상사에게 영업 능력을 인정받고 싶었는데 매번 꾸지람만 듣고 있어서 우울해.,상사에게 영업 능력을 인정을 받지 못하고 꾸지람만 들어서 우울하겠어요.,
참여 인원 제한 때문에 내 이름을 뺀 작품이 입상했어. 기분이 별로야.,내 이름이 제외된 작품이 입상했다는 소식을 들었을 때 어떤 기분이셨나요?,
친구가 알선해 준 회사에 입사했는데 내가 맡은 일이 친구에게 들었던 게 아니라 낙담스러워.,생각했던 업무가 아니라서 많이 낙담하고 계시는군요.,
입사 시작은 똑같았는데 학벌이 좋은 동료가 승진이 계속 빠른 것 같아. 억울하고 슬퍼.,학벌 때문에 승진이 뒤처진다는 생각에 슬프시군요.,
나는 지방대라 대기업에 가기 힘들다고 말하는 선배의 말에 낙담이 됐어.,내 학벌로 대기업에 가기 어렵다는 선배의 말을 듣고 낙담하셨군요.,
회사 동기들 모임이 있는데 언제부턴가 내게 연락이 오지 않고 있어서 속상해.,회사 동기들 모임에 나에게는 연락이 안 와서 속상하겠어요.,
내가 낸 아이디어인데 직장 상사가 마치 자기 아이디어인 것처럼 말하고 다녀서 슬퍼.,내가 낸 아이디어가 상사의 것으로 둔갑하여 슬프겠어요.,
회사에서 같이 점심을 먹던 동료들이 점점 나와 같이 밥을 먹으려고 하지 않는 것 같아 속상해.,어떤 점에서 회사 동료들이 나와 같이 밥을 먹으려 하지 않는다고 생각하시나요?,
오늘 기대했었던 회사 면접에서 떨어졌어.,조금 더 구체적으로 듣고 싶어요.,
난 형편없나 봐! 내 연주를 듣고 사람들이 한숨만 쉬어.,사람들 반응에 낙담하신 것 같아 보여요.,
어떻게 친구가 대충 그린 그림이 나보다 나아 보이지? 너무 낙담 돼.,친구가 그린 그림이 더 잘 그린 그림 같아 낙담하셨군요.,
이번에 소개팅 한 사람이 마음에 들어서 애프터 신청을 했는데 답장이 없어서 슬프네.,마음에 드는 이성에게 아직 연락이 없어 속상하시겠군요.,
이번 진급에서 내 동기들은 다 대리가 됐는데 나만 또 제외됐어. 실망스럽네.,나만 뒤처진다는 생각에 많이 낙담하셨겠어요.,
죽음이 너무 두려워.,왜 죽음이 두려우신가요?,
대입 컨설팅에서 내 성적으로 원하는 대학에 갈 수 없대.,컨설팅 결과를 듣고 속상하셨겠어요.,
고등학교 친구가 평생 간다는데 나는 그럼 평생 갈 친구가 없는 걸까.,평생 간다고 하는 고등학교 친구가 없읏군요. 무슨 일인지 자세히 말씀해 주실 수 있나요?,
아빠가 맨날 술 먹고 집에 들어와서 날 폭력적으로 대해.,아버지 때문에 힘드실 것 같아요. 도움을 요청할 사람이 있을까요?,
동생이랑 사이가 안 좋아서 부모님께 혼나서 속상해.,동생과 서로 친하게 지내지 않아서 야단맞았군요.,
시험을 망쳤어. 어떻게 하면 좋지?,시험을 망쳐서 걱정이 되시는군요.,
제일 친한 친구가 먼 곳으로 떠나게 되어서 정말 슬퍼.,친구가 먼 곳으로 떠나서 정말 슬프겠어요. 친구에게 연락할 방법은 있나요?,
짝사랑하는 남자에게 고백했는데 거절당해서 낙담했어.,좋아하는 이성에게 거절당해 우울하시군요. 이럴 때 어떻게 기분을 끌어올리나요?,
요즘은 연애하기도 힘들고 결혼하기는 더 힘든 것 같아.,요즘 연애랑 결혼하기 쉽지 않으셔서 힘드시겠어요.,
공부를 하는데도 성적이 안 올라서 속상해.,속상하시겠어요. 노력한 만큼 결과가 나오지 않으니까요.,
요즘 일하기가 너무 힘들어.,일하기가 힘드시군요. 무슨 일 있으세요?,
여자친구 부모님께서 결혼을 반대하셔.,마음이 아프시겠어요. 왜 결혼을 반대하시는지 말씀해 주실 수 있나요?,
나는 성격이 소심하고 나서기를 잘 못 해서 사람들과의 관계에서 굉장히 낙담을 많이 해.,소심한 성격 때문에 고민이 많으시겠어요. 본인의 소심한 성격이 마음에 들지 않으신가요?,
오늘 진로 상담 선생님께서 서울에 있는 대학교에 가는 건 힘들다고 말씀하셨어.,선생님의 말씀에 많이 낙담하셨겠어요.,
친구들과 오해를 풀어보려고 했는데 하나도 뜻대로 되지 않았어.,친구들과의 오해로 기분이 좋지 않으시군요. 어떤 오해가 있었는지 물어봐도 될까요?,
친구가 남자를 소개해 줬는데 정말 마음에 드는 거야.,소개받은 분이 좋은 분인가 봐요.  ,
내가 평소에 얼마나 건강관리를 열심히 했는데 암에 걸리다니!,건강관리에 힘쓰셨는데 상심이 크시겠네요. ,
오십 중반에 들어서면서 업무능력이 떨어지는 것 같아 걱정돼.,어떤 점에서 업무능력이 떨어지시는 것 같이 느껴지시나요?,
내 딸에게 좋은 생각과 방향을 보여주고 싶고 말해주고 싶은데 맘처럼 잘 되질 않는 거 같아.,그렇군요. 그런 마음이 드실 때가 언제세요?,
이력서를 이백 통을 넣었는데 연락 오는 곳이 없어. 실망이 커.,이력서를 넣어도 연락이 오는 곳이 없으신가 보네요.,
지난달부터 남편이 소화가 잘 안 되고 가끔 헛구역질도 난다고 해서 엊그제 병원에 다녀왔었어. 남편이 걱정돼.,병원 진료 결과는 받아 보셨나요?,
내가 몸이 안 좋다네. 너무 힘들다.,어디가 편찮으세요?,
오늘 하루 너무 힘들었어. 이제 좀 쉬고 싶어.,오늘 하루 힘드셨군요. 어떤 일로 힘드셨나요?,
요즘 나 상태가 안 좋아. 뭐든지 내려놓고 싶어.,요즘 상태가 안좋으시군요. 무슨 일인가요?,
또 거절당했어. 아무래도 나는 평생 연애도 못 할 건가 봐.,좋아하는 분께 거절당하셨나 보네요. 마음이 안 좋으시겠어요.,
오늘 새로 지시받은 일로 늦게 퇴근했어. 지치고 힘들어.,회사에서 늦게 퇴근해서 피곤하시겠군요.,
연애를 잘하고 싶은데 마음대로 잘 안돼. 이젠 지쳤어.,연애가 잘 안 돼서 걱정이신가요?,
요즘 직장에서 스트레스를 많이 받네.,일 때문에 스트레스를 받으셔서 아주 속상하시겠어요.,
건강은 장담하지 말라더니 그 말이 꼭 맞네.,무슨 일이라도 있으세요?,
아무래도 친구가 나 때문에 화가 많이 났나 봐. 아무리 전화를 해도 받지 않아.,친구와 문제가 있었나 보군요. 무슨 일인지 말해줄래요?,
결혼하기로 약속한 남자가 있는데 그쪽 집안에서 나를 반대해.,결혼이 반대에 부딪혀서 낙담하셨군요. 어떤 면이 가장 마음 쓰이시나요?,
직장에서 일하다 실수하는 바람에 상사한테 크게 혼났어. 난 왜 그런 일 하나 제대로 못 할까.,업무 관련 실수로 안 좋은 소리를 들으셨군요. 기분이 안 좋으셨겠어요.,
동생이 중요한 시험에서 떨어져서 가족 모두 실망이 커. 열심히 했는데 좋은 결과가 나오지 않아서 안타까워.,동생이 열심히 노력했는데 결과가 좋지 않아 안타까우시군요. 옆에서 응원한 가족들도 마음이 안 좋으시겠어요.,
대기업 최종 불합격해서 속상해.,아주 속상하시겠어요. 주변에서 충분히 위로받고 있나요?,
어제 회사에서 단체로 등산을 갔었는데 너무 힘들었어.,등산하느라 많이 힘드셨나 보군요.,
요새 취업이 너무 안 되네.,요즘 취업이 아주 어려운가 봐요. 어떤 것이 제일 어려우세요?,
요즘 가슴은 처지고 배는 많이 나오고 그래서 옷맵시가 안 나서 속상해.,외모 때문에 스트레스가 심하시군요.,
나는 나 스스로에 너무 좌절감이 들어.,왜 그렇게 낙담이 되셨나요? 어떤 부분에서 스스로가 좌절하는가요?,
여자친구와 헤어졌어.,여자친구와 관계를 끝내셨군요.,
곧 은퇴해야 할 것 같아서 걱정이야.,주로 어떤 게 걱정되시는지 말씀해주실 수 있나요?,
이제 친구 따윈 안 만들 거야.,친구분에게 무슨 일이 있으셨나요?,
이번 승진에도 떨어졌어. 마지막 기회라고 생각하고 정말 열심히 했는데.,마지막 기회라고 생각하셔서 더 낙담하신 거 같아요. 다른 기회는 없을까요?,
직장 상사와도 동료와도 사이가 좋지 않아. 나는 인간관계에 소질이 없나 봐.,저런. 매일 마주치는 분들과 사이가 좋지 않아 많이 힘드시겠어요.,
계속 알고 지내고 싶은 지인이 계속 내 연락을 받지 않아.,지인이 일부러 연락을 피하는 건가요?,
친구가 건강 때문에 낙심하고 있어.,무슨 일로 그런가요?,
오늘 희망퇴직을 신청했어. 아내가 낙담할 거 같은데 앞으로가 걱정이네.,회사가 안 좋은 상황인가요? ,
이번 주말에 친구와 여행을 가기로 했는데 태풍으로 취소됐어.,기분이 아주 속상하시겠어요.,
코로나로 학교에 못 가니 아이가 친구 사귈 기회가 없다고 풀이 죽었어.,요즘 학생들이 원격 수업을 해서 친구 만날 기회가 없군요.,
이번 프로젝트는 완전히 망했어.,일이 잘되지 않았나 봐요. 어떻게 된 건가요?,
올해 안에는 꼭 남자친구랑 결혼하고 싶었는데. 뜻대로 되지 않아서 속상해.,결혼 시기가 생각대로 이루어지지 않아서 속상하시겠어요. 속상한 마음을 남자친구 분께 말해보셨나요?,
열심히 노력하는데 실적도 오르지 않고 동료보다 승진이 늦어져서 나 자신이 한심하다고 느껴져.,회사에서 열심히 노력한 만큼 인정받지 못하시는 것 같아 낙심한 마음이 드는 것 같네요.,
친구가 올해는 내 생일을 잊었나 봐.,친구가 생일을 잊었다고 생각하시는군요. 왜 그렇게 느끼셨나요?,
몸도 아프고 저축도 못 했는데 앞날이 걱정이야!,여러 가지로 걱정이 되는군요.,
세상에 믿을 사람이 진짜 없는 것 같아.,믿었던 사람에게 상처를 받았나 보군요. 어떤 일인지 이야기해 주실 수 있나요?,
이번에 대기업에 면접을 봤는데 연락이 안 오는 것을 보니 떨어진 것 같아.,취업의 문이 좁아 어려움이 있으시군요.,
얼마 전에 싸운 친구한테 연락했는데 답장이 없네. 뜻대로 되지 않아서 마음이 안 좋네.,친구랑 싸워서 마음이 안 좋으시군요. 친구랑 어떻게 화해하고 싶으신가요?,
이번엔 꼭 되는 줄 알았어. 졸업만 하면 쉬운 줄 알았는데 취업이 정말 어렵다.,요즘 취업이 어렵군요.,
친구 소개로 한 사람을 만났는데 식사하고 헤어졌는데 다시 연락은 안 올 것 같아. 느낌이 오더라고 난 마음에 들어서 서로 엇갈린 상황이었어.,소개로 만났는데 상대로부터 연락을 받지 못할 것 같은 느낌을 받아 실망했군요. 지금은 마음이 풀리셨나요?,
이번에 연봉 협상을 했는데 올리지 못했어. 조금이라도 더 받고 싶었는데. 생각했던 것과 반대가 돼서 실망했어.,연봉협상이 생각했던 대로 되지 않아서 실망했군요. 앞으로 어떻게 하실 생각인가요?,
이번 검진이 마지막 검진이라고 했는데 다음에 또 오라는군.,마지막 검진인 줄 알았는데 또 가야 해서 낙담하셨군요.,
동호회에서 친하게 지내는 형님이 계시는데 얼마 전부터 온라인과 오프라인에서 활동을 전혀 하지 않으시네.,좋은 인연이 끊어진 것 같아 실망스러우신가 보네요. 혹시 개인적으로 연락해 보신 적이 있으신가요? ,
부인이 다른 집 남편들과 나를 비교해. 나는 위축되는 기분이고 이게 꿈에 그리던 신혼 생활이 맞나 싶어.,결혼이 생각했던 것과는 달라서 마음이 아프시겠어요. 혹시 부인에게 이러한 문제로 상처받았다고 얘기해 본 적 있나요?,
이번에 배치받은 부서가 내가 하던 일과 달라. 회사에서 나를 내치려고 일부러 보낸 거 같아.,새 부서 발령으로 상사나 주변 동료들과 이야기를 해보셨나요?,
정말 절망스러워. 왜 나를 배신하는 거지.,배신을 당하셔서 절망스러우시군요.,
또 면접에서 떨어져서 너무 슬퍼.,면접에서 떨어지셔서 속상하시군요. 속상하실 때는 어떤 걸 하면 기분이 좋아지세요?,
아들이 면접에서 떨어졌는데 너무 슬퍼.,아들의 면접 결과가 좋지 않아 속상하셨군요.,
정기 건강검진을 받았는데 어떡하면 좋아.,자세히 말해 주실 수 있으신가요?,
한 달 동안 조깅을 했는데 몸무게에 변화가 없어 실망했어.,노력했는데 결과에 큰 변함이 없어 슬퍼하시는 것처럼 느껴져요.,
피부가 하루하루 다르게 노화되는 것 같아 속상해.,나이 먹으니 피부가 점점 안 좋아져 속상하시군요.,
회사 일은 해도 해도 끝이 없어서 너무 힘들어.,회사 업무가 괴로우신 것 같아요. 어떤 점이 가장 힘드신지 더 듣고 싶어요.,
회사 정기 검진에서 간에 이상이 생겼다는 소견이 나왔어. 어찌할 바를 모르겠네.,생각지도 못한 결과에 많이 충격받으신 것 같아요. 몸 상태를 어떻게 느끼셨나요?,
요즘 밤에 통 잠을 못 이루어.,밤잠을 설칠만한 일이 있으셨던 것 같아요.,
어떡하면 좋을지 모르겠네.,무슨 안 좋은 일이 생기셨나요?,
요즘 내 뜻대로 되지 않아서 속상해.,요즘 어떤 일 때문에 속상한지 자세히 말해줄 수 있나요?,
최근 코로나 영향으로 취업 자리가 많이 줄어서 너무 힘들어., 코로나 영향으로 취업의 어려움이 있어서 많이 힘드시군요.,
친구들은 벌써 다 결혼해서 아기도 낳고 육아도 하고 있는데 나는 늦은 거 같아.,주변에 육아와 출산을 경험한 친구들이 많군요.,
요즘 같은 시기에는 결혼도 하고 싶지 않아.,결혼에 대한 부정적인 생각의 이유가 있나요?,
이 나이에 갑자기 주재원으로 나가라니 어쩌면 좋지?,갑작스러운 소식에 당황하셨군요.,
회사 일을 이십 년 넘게 해왔는데도 더 힘들어지는 것 같네. 내가 부족한 걸까?,오랜 경력에도 불구하고 업무의 부담으로 힘드시군요.,
이번에 서류 제출한 곳도 탈락이래. 취업이 이렇게 힘들 줄 몰랐어.,서류 탈락해서 아주 속상하시군요. 어떻게 하면 기분이 좋아질까요?,
친구들이 나만 빼고 이번에 여행 간대. 난 그 친구들과 친하다고 생각했는데 혼자 착각이었나 봐.,친구들이 여행에 초대하지 않아 배신감을 느끼는군요. 어떤 부분이 그 친구들과 친하다는 생각을 들게 했나요?,
내가 요즘 많이 힘들어.,요즘 많이 힘드신 상황이군요. 좀 더 얘기해 주시겠어요?,
내가 성격이 이상한 건가? 이상하게 사람들하고 관계를 오래 유지하지를 못해.,대인 관계로 고민이 있으신가 보네요. 보통 어떠한 이유로 관계가 끝나시나요?,
노력한다고 하는데 대인관계가 어려운 것 같아.,대인관계로 어려움을 겪고 계시는군요.,
이력서를 넣어도 자꾸 탈락해. 취업하기 정말 어렵다.,계속되는 탈락으로 속이 상하시는군요.,
여자친구와 이별했는데 아무도 날 위로해 주지 않아.,주변 사람들로부터 이별의 슬픔을 위로받지 못했군요.,
지난여름에 노무사 이차시험이 있었는데 잘 못 본 거 같아.,시험 결과가 안 좋을까 봐 걱정이시군요.,
오 년 넘게 사귀었던 사람이 결혼하자니까 갑자기 태도가 돌변하네.,결혼 이야기 이후 연인의 갑작스러운 변화에 놀라셨군요.,
이번에도 또 서류 탈락했어. 벌써 몇 번째 서류 전형에서만 탈락한 건지 몰라.,계속되는 서류 탈락으로 마음이 좋지 않으시군요.,
인간관계 유지하는 게 너무 어렵네. 다들 나에 대해서 너무 오해를 많이 하는 거 같아.,오해를 많이 받아 속상하시군요. 본인의 진심이 잘 전달되지 않아서 힘들겠어요.,
건강해 보인다는 소리 자주 들어서 방심했나 봐. 건강진단 좀 해봤더니 관리해야 할 때라네.,건강진단 결과가 어떻게 나오셨나요?,
코로나로 인해 경기가 많이 안 좋아져 이번에 명예퇴직했어. 앞으로 취업할 수 있을지 걱정이야.,명예퇴직을 당하셔서 낙담하시고 계시는군요.,
나 남자친구와 헤어졌어.,남자친구와 헤어져 힘드시군요. 어떤 이유로 헤어진 건가요?,
건강검진 결과가 나왔는데 혈압이 높게 나와서 재검하라고 통지가 왔어.,혈압 수치가 높게 나와 재검을 받으셔야 하는군요.,
옆집 아줌마랑 오늘 어울리면서 커피를 마시고 식사도 했어. 그런데 너무 내가 한심하고 바보 같다는 생각이 들더라고.,한심하고 바보 같다는 생각이 드셨군요. 무슨 일이 있으셨어요?,
오늘 병원에 다녀왔는데 건강검진 결과가 좋지 않아서 기분이 상당히 우울해.,건강검진 결과가 좋지 않아 기분이 우울하시군요.,
이번에 청년임대주택 청약에 떨어져서 너무 실망스러워.,주택 청약을 받지 못해서 낙담한 상태 시군요. 어떤 사유에 의해서 떨어지게 되었을까요.,
오늘 또 짝사랑하는 여후배에게 좋아한다고 말을 못 했어. 왜 이렇게 바보 같은지!,좋아하는 사람에게 고백하지 못하고 있어서 낙담하고 계시는군요.,
좀 우울한 일이 있어. 친구가 취업에 성공해서 축하해주긴 해야 하는데.,친구가 취업에 성공했는데 어떤 일 때문에 우울하신가요?,
나 완전 좌절감을 느끼는 상태야.,왜 좌절감을 느끼고 계시는지 편하게 얘기해 줄 수 있을까요?,
새로운 관계를 맺는 게 너무 어려워. 절망적이고 슬프네.,관계를 맺는 것에 어려움을 겪고 계시는군요. 그런 상황이 특별히 있었나요?,
싸운 친구와 화해하려고 하는데 마음처럼 안돼. 그게 너무 슬퍼.,친구와 잘 화해하지 못해 슬픔을 느끼고 있군요. 편하게 더 말씀해 주세요.,
인간관계에 스트레스를 받는데 사람들과 어울려 살기가 힘들 것 같아.,인간관계에 어려움을 겪고 계시나 봐요.,
주변에서 연애하라 결혼하라 왜 이렇게 감 놔라 배 놔라 하는지 모르겠어.,결혼하라는 소리가 듣기 싫으신 가 봐요.,
이제 곧 육십인데 노후준비가 돼 있질 않아서 걱정이야.,걱정이 많으시겠어요.  노후준비의 계획은 있으신가요?,
매일매일 야근을 하는데도 일은 줄지 않고 부장님은 빨리 안 한다고 채근하시고 너무 스트레스가 많아서 힘들어.,업무가 과중하셔서 힘드시겠네요. 부장님까지 채근하시니 더 힘드시겠어요.,
아직도 내가 뭘 좋아하는지 모르겠어.,무엇을 좋아하는지 몰라서 고민이시군요. 무엇에 관한 고민인가요?,
나 차였어.,무슨 일인지 자세히 알려주시겠어요?,
나 친구한테 생일 선물 못 받아서?낙담 중이야. 기대했는데 마음이 상했어.,친구분께 선물을?기대했다가?못 받아?실망하셨군요.,
결혼식을 준비 중인데 못할 것 같아.,결혼을 열심히 준비하셨는데 못할 것 같다는 생각이 드셨군요. 어떤 계기로 그렇게 생각하게 되었나요?,
이번에 내 친구 잘나가는 대기업에 취직했다더라?,친구분의 소식을 듣고 마음이 어떠셨어요?,
결혼하려는데 비용이 너무 많이 드네. 돈도 없는데.,결혼 비용 때문에 낙담하신 것 같아 보여요.,
내가 사람들이랑 친해질 수 있을지 모르겠어.,무슨 문제라도 있나요?,
오늘 생일이었는데 기분이 별로야.,생일 축하해요! 기분이 왜 별로이신지 자세히 말해줄 수 있나요?,
이거 배운 지 몇 년짼데 아직도 취업이 안 되고 있어.,취업이 뜻대로 되지 않아 속이 상하시는군요.,
난 정말 주변에서 인기가 없나 봐.,주위 사람들이 나를 좋아해 주지 않는 것 같아 속상하시군요.,
어제 친구가 나를 험담하는 걸 우연히 듣게 되었어.,친구가 험담하여서 기분이 상하셨겠어요. 무슨 사정이 있지 않았을까요?,
자식들 다 키워봐야 소용없다는 말이 이제 실감이 나네. 슬퍼라.,자식들로 인해 슬픔을 느끼고 계시군요. 혹시 어떤 문제인지 여쭤봐도 될까요?,
회사에서 실수를 하는 바람에 상사의 눈 밖에 난 것 같아.,상사의 눈 밖에 난 것 같아 기분이 안 좋으시겠어요. 어떻게 하면 좋을까요?,
나도 빨리 시험에 합격해야 하는데 나 자신에게 기대가 안 돼.,준비하시는 시험에 자신이 없는 것처럼 보여요.,
친해지고 싶은 친구와 끝끝내 친해지지 못했어. 새로운 친구 사귀는 거 정말 포기를 해야 하나 싶어.,친구를 새로 만드는 데에 실패하신 것처럼 보여요. 사용자님이 생각하는 원인이 있을까요?,
면접 붙은 줄 알았는데 떨어졌어. 너무 낙담해서 기운이 안 나.,면접에서 떨어져서 많이 속상하실 것 같아요. 속상함을 달래기 위한 나만의 방법이 있을까요?,
퇴직금으로 준비한 펀드가 사기였어.,퇴직금으로 준비한 펀드가 사기여서 기분이 안 좋으시겠어요.,
삼차 연구 실험이 또 실패했네.,정말 안타깝네요.,
나이 들고 하니 진정한 친구가 주변에 없는 거 같아.,나이 들고 하니 진정한 친구가 주변에 없는 것 같으시군요. 무슨 일 있으셨어요?,
아 인생 부질없다.,무슨 일 있으신 거예요?,
아이 성적이 떨어져서 속상해.,성적이 떨어지면 부모님이 아이보다 더 속상해하시던데 힘드시겠어요.,
어제 화장실에서 나오다가 쓰러졌어.,어머 그런 일이 있어서 정말 놀라셨겠네요. 다치신 데는 없으신가요?,
어제 사장님께 보고한 보고서를 다시 쓰라는 말을 들었어.,왜 다시 쓰라고 하시던가요?,
인간관계가 다 쓸모없다고 느껴져.,최근 그렇게 인간관계에 낙담한 감정을 느끼게 한 사건이 있었나요?,
