human,system,
난 스스로 밥을 해 먹을 줄 몰라. 오로지 아내가 밥을 차려주는 것만 먹어왔기 때문이지.,밥을 못 먹게 된다는 마음이 무서움을 느끼게 하였군요. 앞으로 이를 어떻게 해결하실 생각이신가요?,
평소에 여자친구가 전 남자친구와 나를 종종 비교하곤 했었는데 아마 본인의 마음속에는 여전히 남아있었나 봐.,지금의 감정상태에서 벗어나기 위해 무엇을 하는 것이 효과적일까요?,
스트레스 받지 않아야 한다는 것을 알지만 이 허무한 마음을 떨쳐 버릴 수가 없어.,스트레스를 많이 받으시는군요. 좋은 방법이 없을까요?,
죽기 전에 내가 할 수 있는 일들을 찾아보고 싶어.,할 수 있는 일을 찾아보고 싶으시군요. 어떻게 해야 할 수 있는 일들을 찾을 수 있을까요?,
이제 친구들조차 나를 외면하는 것 같아. 내 곁에는 아무도 없어.,친구들에게조차 외면당하는 느낌이 드시는군요. 어떻게 하면 그 상황을 벗어날 수 있을까요?,
믿었던 친구도 이렇게 배신을 하는데 믿을 수 있는 사람이 있겠어? 너무 슬프다.,이런 마음을 어떻게 하면 해결할 수 있을까요?,
병마랑 홀로 싸우고 있는 아내를 응원해주고 싶어.,아내 분에게 뭔가 도움이 될 수 있는 건 없을까요?,
최선을 다 했다고 생각했는데 더 잘 해드릴 걸 하고 후회돼.,최선을 다 했다고 생각했는데 더 잘 해드릴 걸 하고 후회되는군요. 이런 상황에선 어떻게 하는 게 좋을까요?,
열심히 살아왔는데 세상은 너무 불공평한 것 같다는 생각이 들어.,열심히 사셨는데 이런 일이 생겨 더욱 힘드시군요. 지금 상황에서 할 수 있는 일이 무엇이 있을까요?,
그냥 손가락이라도 한 번 움직여줬으면 좋겠어.,많이 힘드시겠어요. 어떻게 하면 기분이 나아질 수 있을까요?,
병에 걸린 사실만으로도 힘든데 약까지 먹어야 된다니 미칠 노릇이야.,조금이라도 상황이 나아지게 뭔가 할 수 있는 건 없을까요?,
그래. 생활체육 대상자에 포함되면 혜택이 있거든.,지금 기분에서 벗어나기 위해서는 어떤 시도를 해볼 수 있을까요?,
그래. 병원이랑 가까워서 꼭 가고 싶었거든.,이제 어떻게 하실 생각이신가요?,
그래. 최대한 돈을 긁어모아서 투자 했는데 수익률 때문에 걱정이네.,저도 걱정이네요. 지금 상황에서 벗어나려면 어떻게 해야 할까요?,
신입 직원들은 금방 배우고 적용하는데 나만 늦어지는 것 같아.,업무 습득 속도가 느려진 나의 능력에 낙담하고 계시는군요. 이 상황을 어떻게 해결할 수 있을까요?,
응. 현실적인 말인데도 불구하고 막상 이런 이야기를 들으니 너무 슬퍼.,지금의 기분에서 조금이라도 벗어나기 위해 해볼 수 있는 일들에는 무엇이 있을까요?,
업무강도가 갈수록 세지는 것 같아.,업무강도가 갈수록 세지는 상황에서 벗어나기 위해 취할 행동이 있을까요?,
너무 피곤해 잠이 와서 죽을 것 같아.,너무 피곤한 상황을 바꾸기 위해 어떻게 하면 좋을까요?,
내가 뭔가 잘못된 생각을 했었나 봐.,그런 상황을 어떻게 하면 변화시킬 수 있을까요?,
기대했었는데. 너무 속상해.,속상한 기분을 달랠 때에 사용자님의 특별한 방법이 있나요?,
그러니까 말이야. 건강한 할아버지가 되고 싶은데.,사용자님이 건강해지기 위해 할 수 있는 행동은 무엇이 있을까요?,
아내는 내가 뭐가 그리 못마땅한지 늘 그런 식이라니까 정말 속상해서. 너무 슬프다.,많이 슬프시겠어요.어떻게 해야 아내분이 친구분과 비교하는 일이 없을까요?,
명절이나마 자식들 얼굴 보는 건데 그마져도 안오니 너무 슬프네. 어떻게 해야 자식들 얼굴 자주 볼 수 있을까?,많이 슬프시겠어요. 자식들을 자주 볼 수 있는 방법이 있을까요?,
늙으니 고집만 세지고 툭하면 슬프고 무기력해지고. 그래서 그런 거 같아.,어떻게 하면 지금의 상황에서 벗어날 수 있을까요?,
몸에 이상이 있을까 봐 두려워.,몸에 이상이 있지 않기 위해서는 무엇을 해야 할까요?,
무릎 관절이 아파서 이제는 아무데도 못 가겠어.,무릎 때문에 돌아다니지 못해서 속상하시겠어요. 대신에 할 수 있는 것은 없을까요?,
이제 이빨도 다 빠지고 살 맛이 안나.,건강이 나빠지셔서 정말 힘드시겠어요. 앞으로 어떻게 해야 좋을까요?,
당뇨에는 식이요법이 중요하다는데 건강한 식단으로 밥을 챙겨먹는 게 참 어려워.,당뇨 때문에 건강한 식단으로 밥을 챙겨 드시느라 많이 번거롭겠어요. 앞으로 어떻게 하면 좋을까요?,
그것보다는 손자를 보지 못하는 게 더 슬퍼.,정말 슬프네요. 어떻게 하면 이 슬픈 감정을 떨쳐내면서 병을 이겨낼 수 있을까요?,
움직이면 무릎이 아파서 요즘에는 집 밖으로도 잘 못 나가서 우울해.,움직이는 게 불편해 집에만 계속 있어서 기분이 안 좋으시겠어요. 어떻게 하면 기분이 좀 나아질까요?,
늙어서 이제는 내가 쓸모 없는 사람이 된 것 같아 슬퍼.,일자리 센터에서는 걱정돼서 그럴 거예요. 어떻게 하면 울적한 기분이 나아질까요?,
앞으로 약에 의존해서 살아야 한다는 생각에 너무 힘들어.,앞으로 계속 약을 드셔야 한다니 정말 힘드시겠어요. 어떻게 하면 이 어려운 상황을 잘 헤쳐 나갈 수 있을까요?,
응. 꾸지람을 들을 때마다 주눅 들고 우울해.,이 상황을 변화시키기 위해서 어떤 일을 시도해 볼 수 있을까요?,
응. 친구가 나보다 높은 공인 어학 성적을 갖고 있어서 그런 것 같아.,어떻게 하면 다음번에 공채 지원에서 좋은 결과를 얻을 수 있을까요?,
응. 친구들과 이번 일로 멀어질까 봐 티를 안 내고 있어.,어떻게 하면 기분이 나아질 수 있을까요?,
응. 생각해봤는데 발표할 때 친구가 자신감 있게 또박또박 말한 것 같아.,어떻게 하면 지금의 상황보다 더 나아질까요?,
친구는 전 직장의 경험을 살릴 수 있다고 했는데 막상 입사했더니 아니야.,예상과 다르니 속상하시겠어요. 그러면 앞으로 어떻게 하실 계획이세요?,
응. 선배의 말에 기분이 나빴는데 한편으로는 현실이니깐 아무 말도 못 했어.,어떻게 하면 낙담한 기분이 더 나아질 수 있을까요?,
응. 내가 낸 아이디어라고 동료들에게 어필을 해봤는데 소용없어.,어떻게 하면 슬픈 마음이 더 나아질까요?,
뭘 해도 잘 해낼 자신이 없어지니 의욕이 떨어지네.,어떻게 해야 사용자님의 의욕을 다시 끌어올릴 수 있을까요?,
아직 잘 모르겠어. 너무 가고 싶은 학교인데.,그렇다면 아직 시간이 남았으니 최선을 다해 공부한다면 합격 가능성이 높아지지 않을까요?,
응. 그동안 왜 이렇게 공부를 안했을까?,많이 낙담하셨군요. 이제부터라도 공부를 열심히 한다면 미래엔 지금처럼 후회하는 일이 없지 않을까요?,
나에게 예술적 자질이 있긴 한 건지 의문이 들기도 해,많이 낙담했군요. ,
그런 편이지. 지금 내 성적으로는 어림도 없어.,꼭 이루고 싶은 일이라면 지금부터라도 열심히 공부 한다면 이룰 수 있을 거예요.,
나도 열심히 한다고 했는데 왜 내 성적만 떨어졌을까?,성적이 더 오른 친구들을 경쟁자로 삼고 더 열심히 공부해서 다음번엔 친구들의 성적을 뛰어 넘어보는 건 어떨까요?,
나는 머리가 나쁜가봐.,주변에 조언을 구할사람이 없을까요?,
자존심도 상하고 공부도 하기 싫어졌어. 혼자만 성적 오른 친구가 야속하기까지 해.,그럴 만도 해요. 다음번엔 같이 공부 한 후에 따로 복습하며 공부해 보는 게 어떨까요?,
나는 노력한다고 했는데도 잘 안 되더라고.,노력에 비해 결과가 안 좋아서 실망스러웠겠네요.,
성적 반영이 되지 않는 내 특기를 살려보려고 해.,성적이 전부는 아니에요. 특기를 잘 살리신다면 한 분야에서 더 특출한 인재가 될 수 있을 거예요.,
앞으로 뭘 해야 할까? 아르바이트를 해야 할지 공부를 해야 할지 모르겠어.,본인이 필요로 하는 쪽은 어느 쪽인가요?,
너무 실망스러워.,많이 실망하셨군요. 다음 경시대회에도 나가실 건가요?,
그걸로 이번에 어머니 선물을 드리려고 했는데. 너무 아쉬워.,어미니에게 선물을 사드리지 못해 많이 속사하시겠어요.,
아니 괜찮지 않아. 난 너무 이 상황이 실망스러워.,너무 낙담하지 마세요. 그 곳에서도 잘하실 수 있을 거예요.,
맞아. 다른 동기가 올라간 거 보면 정말 배가 아파.,오늘은 집안에만 있지 말고 친구를 만나 회포를 푸는 게 어떨까요?,
맞아 정말 실망스럽기 그지없어. 월급이 올라야 결혼 자금을 모을 텐데.,월급이 올라야 결혼 자금을 모을 텐데 낙담하셨군요.,
맞아. 나 이번에는 솔직히 내 기획안으로 갈 줄 알았거든.,열심히 준비한 기획안은 언젠가 빛을 발할 날이 올 거예요. 너무 낙심하지 마세요.,
언제 또 이 시험을 준비해서 다시 시험을 보지? 앞길이 너무 막막해.,오늘은 잠시 휴식을 취하며 이제까지 노력해온 나를 다독이는 것은 어떨까요?,
맞아 이번에는 정말 잘될 줄 알았거든.,이번에는 정말 잘될 줄 알았군요.,
너무 아쉬워. 우리 부서는 따로 나와서 연습도 했거든.,그래도 연습하는 동안 사이가 좋아졌을 거예요. 함께 회식을 하며 다음을 기약해보는 건 어떨까요?,
맞아. 이번 실적이 좋아서 모두들 기대했었어.,기대에는 못 미쳤을지 모르지만 그래도 수고하셨어요.,
맞아. 내 성적으로 어디를 들어갈 수 있을까.,너무 낙담하지 마세요. 다른 방법을 찾아보는 것은 어떨까요? ,
맞아. 지금 가면 차도 막히고 걱정이야.,차가 막히는 게 걱정이 된다면 조금 늦은 시간이나 다음날 일찍 출발하는 것은 어떨까요?,
시험을 못 보게 되는 상황은 생각을 못했는데 긴장한 것이 문제였던 것 같아.,긴장을 덜 할 수 있는 좋은 방법이 있을까요?,
나는 아직 성적을 올린 기회가 더 있다고 생각했는데 엄마는 벌써 포기한 것 같아서 낙담했어.,어머니 때문에 낙담하셨군요. 어떻게 하면 지금의 상황을 변화시킬 수 있을까요?,
내 성적으로는 그 학교에 입학할 방법이 없다는 사실 때문에 낙담했어.,많이 속상하시겠어요. 현재의 감정에서 벗어나기 위해서 어떻게 하면 좋을까요?,
사람들 앞에서 너무 긴장한 바람에 실수투성이 연주를 보여줘 버려서 낙담했어.,실수를 많이 하셔서 속상하시겠어요. 어떻게 하면 지금의 상황을 변화시킬 수 있을까요?,
엄청 열심히 준비한 연극을 못 보여줘서 슬펐어.,지금 감정에서 벗어나려면 어떻게 해야 할까요?,
내 그림 실력이 부족한 거 같아서 슬펐어.,많이 슬프셨군요. 기분이 나아지려면 어떻게 해야 할까요?,
이미 시간을 되돌릴 수 없어서 슬퍼.,이 상황을 변화시키려고 한다면 무엇을 할 수 있을까요?,
부모님과의 약속을 지켜주지 못해서 슬퍼.,이 감정에서 벗어나려면 어떻게 해야 할까요?,
부모님은 예전부터 내게 좋은 대학에 가야한다고 그러셨어. 근데 대학에 붙을 자신이 없어.,스스로 낙담해 계시군요. 지금의 괴로운 마음을 나눌 사람이 주변에 있을까요?,
나도 내 성적이 안 좋아서 걱정인데 엄마도 그렇게 말하니까 속상해.,이 상황을 개선시킬 수 있는 방법이 있나요?,
아빠가 나에게 말을 심하게 해서 낙담했어.,아버지와 있었던 문제를 해결하려면 어떻게 해야 할까요?,
나는 지금 낙담했어. 공부도 하기 싫어.,이 슬픈 상황을 이겨내려면 어떻게 해야 할까요?,
친구들 중에 나만 롯데월드를 못 간다고 생각하면 너무 슬퍼.,친구들과 함께 가지 못해서 슬프시겠어요. 이 현실을 극복하려면 어떻게 해야 할까요?,
엄마가 내 의견은 하나도 안 물어보고 엄마 마음대로 옷을 사더라고.,많이 속상하고 낙담하셨겠군요.,
내가 할 수 있는 건 공부밖에 없어. 잘하는 게 딱 하나 있다면 공부뿐이야.,현재 상황에서 할 수 있는 게 있을까요?,
날 또 괴롭힐 게 분명한데 벌써부터 학교 가기가 싫어.,이런 상황에서 무엇을 하면 도움이 될까요?,
날 따돌리고 괴롭히는 친구들이 퇴학이 아닌 다른 처분을 받아서 난 전학을 가고 싶었거든.,뜻대로 되질 않았군요. 어떻게 하면 지금의 상황을 변화시킬 수 있을까요?,
무시당할만한 일을 하지 않았는데 그 친구는 내가 그냥 마음에 안 드나 봐.,어떻게 하면 지금의 슬픈 마음을 달랠 수 있을까요?,
얼마 전까지도 친하게 지냈는데 내가 다른 친구가 없다는 걸 알고 사람이 바뀐 것 같아.,그 친구가 예전과 다르게 느껴지는군요. 어떻게 하면 다시 예전처럼 지낼 수 있을까요?,
난 전학 가서 따돌림에서 벗어나고 싶은데 이런 마음을 몰라주셔서 힘들어.,지금 이 힘든 심정이 잘 전해질 수 있는 방법이 있을까요?,
선생님께서 내가 겪는 상황이 얼마나 심각한지 모르시는 것 같아서 답답하고 슬퍼.,어떻게 하면 지금의 답답한 상황을 바꿀 수 있을까요?,
학교 친구들이 나에 대해 이상하게 생각할 것 같아서 답답하고 슬퍼.,정말 답답하시겠어요. 이런 상황에서는 어떤 것을 할 수 있을까요?,
이제 고민을 털어놓을 곳이 없는 것 같아서 힘들고 슬퍼.,정말 힘드시겠어요. 슬픈 감정을 털어내기 위해서 어떻게 하면 좋을까요?,
나 말고는 다들 상황의 심각성을 모르는 것 같아 슬프고 답답해.,정말 답답하시겠어요. 상황을 어떻게 하면 바꿀 수 있을까요?,
회사 사정을 이해 못하는 것은 아니야. 이번에 많은 동료들이 명예퇴직을 신청했거든.,OO님은 어떻게 하고 싶으신가요?,
이혼 후에 재혼하려고 노력을 해봤는데 이번에도 안 될 거 같아.,지금 사용자님은 무엇을 해야 할까요?,
며칠 동안 야근하며 정성 들여 준비했는데 왜 보고서를 맘에 안 들어 하는지 모르겠어.,OO님의 고민을 덜 수 있는 방법이 없을까요?,
무슨 말을 해야 할지도 모르겠고 남편 눈치만 보이네.,눈치만 보이는 상황에서 어떻게 벗어날 수 있을까요?,
사귄 지 오래되어서 권태기가 온 것도 같아.,정말 힘드실 것 같아요. 지금 상황에서 어떻게 하는 것이 좋을까요?,
남편은 출산하면 내가 전업주부가 되길 원하는데 난 싫어.,지금 이 상황에서 내가 어떤 것을 해볼 수 있을까요?,
왜 나에게만 이런 일이 일어나는 걸까 생각하니 눈물만 나.,어떻게 해야 지금 기분이 풀릴 수 있을까요?,
다른 친구들은 다 결혼했는데 나만 못하는 것 같아서 너무 슬퍼.,어떻게 하면 이 기분에서 벗어날 수 있을까요?,
내가 원해서 하고 싶은 결혼이 아니라 더 스트레스라고.,이런 상황에서 가장 쉽게 벗어날 방법은 무엇인가요?,
나는 아이를 좀 더 늦게 갖고 싶었는데 시부모님은 손주를 빨리 보고 싶어 하셔.,많이 힘드시겠어요. 이 상황을 해결하기 위해서는 어떡하면 좋을까요?,
가끔 그런 얘기를 꺼내실 때마다 내가 작아지는 것 같아서 힘들어.,어떻게 하면 이 감정이 조금 덜해질까요?,
둘 다 잘 해내고 싶었는데 그게 마음처럼 잘 안 되는 것 같아 속상해.,생각처럼 잘 되지 않아서 속상하시군요. 어떻게 하면 현재의 감정에서 벗어날 수 있을까요?,
남편은 내 말을 제대로 들으려 하지 않는 것 같아.,어떻게 하면 이 상황이 조금 나아질까요?,
아기 때문이라도 담배를 끊었으면 좋겠다고 했더니 어떠한 개선 의지도 없어서 실망했어.,어떻게 하면 이 상황에서 벗어날 수 있는지 생각해 보셨나요?,
시부모님 이야기만 나오면 무조건 나에게만 잘하라고 해. 결혼 생활이 실망스러워.,이 문제를 해결하기 위해서 어떻게 해야 할까요?,
시어머니는 다른 며느리와 나를 비교해서 속상해.,지금 기분을 나아지게 하기 위해서 무엇을 해 볼 수 있을까요?,
어쩔 땐 내가 가사도우미 같은 생각이 들어서 너무 화가 나.,화가 많이 나신다니 힘드시겠어요. 지금 기분에서 벗어나기 위해 무엇을 하면 좋을까요?,
내가 필요할 때는 바쁘다는 핑계만 대는데 정말 화가 나더라고.,기분이 많이 안 좋으시겠어요. 어떻게 하면 지금 상황을 변화시킬 수 있을까요?,
출산 전에는 하고 싶은 것도 많았는데 지금은 포기한 느낌이라서 너무 슬퍼.,지금의 기분에서 벗어나기 위해 무엇을 할 수 있는 것이 있을까요?,
나이 때문에 내가 더 좋은 곳으로 갈 기회를 놓쳐버리는 것 같아서 너무 슬퍼.,지금 슬픔을 이겨내기 위해 무엇을 할 수 있을까요?,
다 같이 열심히 일해왔는데 나 혼자 그동안 뭘 했나 싶어서 후회가 돼.,후회하지 않기 위해 앞으로는 어떻게 하는 게 좋을까요?,
왜 하필 이렇게 중요한 시기에 실패를 겪게 된 건지 좌절스러운 심정이야.,어떻게 하면 지금의 기분을 이겨낼 수 있을까요?,
그동안 몸 바쳐 왔던 회사를 하루아침에 잃게 되다니 막막하고 너무 슬퍼.,현재의 상황에서 속상한 감정을 조금이나마 덜어낼 수 있는 방법이 있을까요?,
그냥 전부 다 포기하고 싶다.,모두 포기하고 싶은 기분이 드셨군요. 어떻게 해야 지금의 기분에서 벗어날 수 있을까요?,
요즘 일하면서 실수가 잦은데 그럴 때마다 상사가 너무 나를 다그쳐서 너무 속상해.,상사가 자꾸 다그쳐서 속상하신 것처럼 들려요.,
업무를 잘해보고 싶어서 낸 의견인데 상사랑 의견이 달라서 회의 끝나고부터 상사랑 너무 어색해 앞으로도 분명 어색해질 거야.,어떻게 해야 상사 분과의 관계를 회복할 수 있을까요?,
오늘 같이 회의하던 중에 내가 얘기할 때만 서로 눈치 보고 조용해지더라고 난 잘해보고 싶은데 쉽지 않네.,지금의 상황에서 벗어날 수 있는 방법이 뭐가 있을까요?,
세대 차이 문제는 상관들의 고민인 줄만 알았거든.,그 분들은 어떻게 대처하셨을까요?,
내 잘못이면 이해하겠는데 되도 않는 꼬투리 잡는 건 정말 참을 수 없어.,다른 거래처들의 갑질 상황이 있을 땐 어떻게 행동하셨나요?,
점점 설 자리가 작아지고 언제까지 일을 할 수 있을 지 불안해.,젊은 친구들에게도 뒤쳐지지 않고 계속 전문성을 키울 수 있는 방법이 있을까요?,
알려주면 노력이라도 해야 하는데 완전 밑 빠진 독에 물 붓기야.,밑 빠진 독에 물 붓는 답답한 심정이시군요.,
서류는 통과하는데 계속 면접에서 떨어져서 낙담하는 아들을 보는 게 너무 슬퍼.,이 상황에서는 어떻게 하는 것이 좋을까요?,
본인 인생을 사느라 나는 신경 쓰지 않는 거 같아 너무 속상해.,이 기분에서 벗어나려면 무엇을 해야 할까요?,
약속해놓고선 늘 이렇게 어기니 더 이상 기대가 되지도 않아. 너무 실망스러워.,이 상황에서 할 수 있는 게 어떤것이 있을까요?,
공부도 잘하고 인물도 좋고 교우관계도 좋아서 될 줄 알았는데 아쉬워.,이 상황에서 무엇을 하면 좋을까요?,
정말 열심히 준비한 걸 옆에서 봤는데. 떨어진 것 자체보다 딸이 속상해하는 게 가장 속상해.,따님의 마음이 나아지게 하기 위해 어떻게 할 수 있을까요?,
뭘 그런 거로 헤어지나 몰라. 하지만 딸은 잘 헤어졌다고 생각하는 것 같았어.,스스로의 아쉬움을 달래기 위해 무엇을 하실 수 있을까요?,
이번이 처음도 아니야. 어떻게 매번 그럴 수가 있냐고.,예전에 비슷한 일이 있었을 때는 어떻게 대처하셨나요?,
바쁜 건 어쩔 수 없겠지만 일 년에 몇 번 보지도 못하는데 말이야.,아쉬움을 달래기 위해 어떻게 하실 수 있을까요?,
어. 언제부터인지 모르겠지만 원래 이러지 않았는데.,남편 분께서 예전에는 사용자님의 취미를 존중해 주셨나 봐요. 같이 취미생활을 즐겼었나요?,
속상하긴 하지만 딸아이가 너무 걱정돼 내가 어떻게 위로해 줄 수 있는 방법이 없을까?,평소에 자녀 분이 기분이 안 좋아 보일 때 어떻게 하셨나요?,
맞아. 나도 나가서 내 생활을 하고 싶고 어쩔 땐 그냥 다 내려놓고 떠나고 싶어.,어떻게 하면 이 상황을 해결할 수 있을 것 같으신가요?,
모르겠어. 뭐가 그리 바쁘다고 이런 사소한 것 하나 못해주는지 속상하네.,속상한 마음을 어떻게 떨쳐낼 수 있을까요?,
나도 많이 아프지만 여행을 못 가게 된 가족들에게도 미안하네.,미안한 마음이 드시다니 힘드시겠어요. 현재의 감정에서 벗어나기 위해서 어떻게 하면 좋을까요,
일은 너무 잘해서 질투도 나고 스스로가 너무 태만하다고 생각됐어.,유능한 동료 옆에서 스스로가 태만하다고 느끼셨군요. 어떻게 하는 것이 도움이 될까요?,
열심히 항암 치료도 받고 식단도 건강하게 먹었는데 왜 다시 생겼을까? 지금 너무 슬프네.,다시 재발한 암을 완치하기 위해서는 어떻게 노력하실 건가요?,
그래서 그런지 요즘 부쩍 체력이 딸리고 식욕도 별로 없는 것 같아.,지금의 상황을 좋게 할 수 있는 방법이 없을까요?,
요즘은 부쩍 갑작스럽게 죽거나 지병으로 죽는 사람들이 많아서 두렵고 슬퍼.,걱정되고 슬픔감정에 도움이 될 만한 일들이 있을까요?,
자신 있는 영역에서 생각보다 안 좋게 나오니 모든 영역에서 자신이 없어지네.,지금의 상황을 나아지게 할 방법이 없을까요?,
요즘은 하고자 하는 일들이 잘 안되면 자신감이 없어지고 힘이 빠지네.,속상한 마음에 도움이 될 만한 방법이 없을까요?,
친구가 하루 종일 누워있고 내가 어떻게 해야 할지 모르겠어.,이 상황을 벗어나기 위해 어떤 것부터 할 수 있을 까요?,
주변에서 결혼하지 마라 자식 낳지 마라 등 말도 안 되는 조언하는 걸 듣는 게 아니었는데.,기분이 나아지려면 어떻게 해야 할까요?,
내가 제일 좋아하는 게 고기인데 먹기가 힘드니 서럽다.,지금의 기분에서 벗어나기 위해서 무엇을 해야 할까요?,
뭔가 시스템이 잘못된 게 틀림없어.,상황을 바로 잡을 방법이 있을까요?,
신부전으로 입원했을 때 많은 힘이 되었는데 말이야.,병상생활에 큰 힘이 되셨던 분의 죽음에 힘드시군요. 이 상황에서 무엇을 할 수 있을까요?,
응. 의사 선생님 말씀으로는 별로 차도가 없다네.,항암치료에 차도가 없어 슬프시군요. 어떻게 하면 좋을까요?,
운동 좋아하고 열심히 움직이면 뭐 해. 당뇨병이라는데.,현재 기분에서 벗어나기 위해 무언가 할 수 있는 것이 있을까요?,
매주 주말이면 등산을 하면서 좋은 경치도 보고 좋은 공기도 마시면서 좋았었는데 속상하네.,속상한 기분에서 벗어나고자 무엇을 지금 할 수 있을까요?,
좋은 사람들과 술을 마시는 시간이 참 좋았었는데. 슬프네.,간경화 진단으로 술을 마시지 못하게 된 기분을 나아지게 하기 위해서 무엇을 할 수 있을까요?,
딸 결혼은 인생에 딱 한 번 있는 건데 못 가는 게 정말 슬퍼.,정말 서럽고 슬프시겠어요. 슬픈 마음을 덜 느끼는 방법은 어떤 것이 있을까요?,
나이가 많으니 몸이 고장 나는 데가 많아. 죽기 전에 가족여행은 꼭 가고 싶었는데.,심근경색으로 가족여행을 못가게 된 상황을 변화시키기 위해 무엇을 할 수 있을까요?,
아무거나 먹을 수 있었던 젊은 시절로 돌아가고 싶어.,젊은 시절로 돌아가고 싶으시군요. 어떻게 하면 기분이 나아질 수 있을까요?,
댄스로 스트레스도 풀고 그랬는데 못하니까 더 우울해.,어떻게 하면 댄스로 스트레스를 못풀어 우울한 기분을 변화시킬 수 있을까요?,
다른 병보다 당뇨는 주의해야 할 것들이 많아서 힘들어.,당뇨가 다른병에 비해 주의사항이 많아 힘드시군요. 어떻게 하면 상황이 나아질 수 있을까요?,
나이가 드니 이제 하나하나 병만 늘고 서글퍼져.,이 상황에서 무엇을 할 수 있을까요?,
