human,system,
내일 한번 가보려고.가서 더 힘이 날 수 있게 응원해줘야겠어.,병문안 가서 응원해주면 사촌 동생도 더 잘 이겨낼 거예요.,
일단 다른 친구한테 부탁해서 오해라고 설명을 좀 해달라고 해야겠어.,친구와 오해를 잘 풀길 바라요.,
응.어제 다녀왔어. 그래도 내일 다시 찾아가 봐야겠다.,할아버지가 건강을 되찾으셨으면 좋겠네요.,
대학에 못 가도 친구가 행복하게 살 방법이 많이 있었을 텐데.,친구의 일은 너무 유감이지만 이 슬픔 감정이 진정되기를 바랄게요.,
일단 그 사람은 얼굴도 보기 싫으니 당분간 혼자 지내며 머리를 식히고 싶어.,혼자 지내면서 기분 전환이 되었으면 좋겠네요.,
수술이 끝나고 회복한 뒤 다른 일을 찾아볼까 해.,건강을 회복한 다음에 새 일을 찾으려 하시는군요.,
퇴직 후에 새 일을 찾아봐야 할 것 같아.,새 직장을 무사히 찾으시기를 바랄게요.,
일단 주변 지인들에게 돈을 빌릴 수 있는지 물어볼까 해.,지인들에게 무사히 돈을 빌릴 수 있으시기를 바랄게요.,
일단 지출을 좀 줄이고 부업을 해서 저축 액을 늘려야겠어.,돈을 아끼고 부업을 해서 저축을 늘리시려는군요.,
지금부터 모을 수 있는 재산을 생각해서 노후 계획을 잘 세워야겠어.,노후 계획을 잘 세우려고 하시는군요.,
남은 자식들과 손녀들과 시간을 보내야겠어.,자식분들과 시간을 보내서 기분을 전환하려 하시는군요.,
대중교통을 이용하기에 체력이 부족하면 그냥 택시를 이용해야겠어.,체력에 따라서 택시도 이용할 생각이시군요.,
주변 사람들과 더 많은 시간을 보내고 추억을 만들어야겠어.,지인들과 좋은 시간을 보내서 새 추억을 만드시려는군요.,
새로운 친구들을 만들고 다시 좋은 추억을 만들어야겠어.,새로운 친구들과 추억을 만들고 싶으시군요.,
다시 내 전문분야에서 일을 시작하고 싶어.,전문 분야의 일을 다시 시작하고 싶으시군요.,
심리상담 센터를 방문해서 심리치료를 받고 싶어.,심리치료를 받고 아픈 마음이 나아지시길 바라요.,
남은 자녀들과 함께 시간을 보내며 추억을 만들어야겠어.,자녀 분들과 좋은 시간을 보내시길 바라요.,
일단 밖에 나가서 산책을 좀 해봐야겠어. 걷는 것도 도움이 된다더라고.,산책하시면서 기분이 좀 나아지셨으면 좋겠어요.,
남은 시간 최대한 딸과 대화도 많이 하고 긍정적인 생각을 하며 살아봐야겠어.,아프지 않고 딸과 많은 추억을 남기셨으면 좋겠어요.,
긍정적인 생각과 운동을 좀 해야겠어.,앞으로 건강하셨으면 좋겠어요.,
일단 내일 병원에도 다시 가보고 운동도 해봐야겠어.,당뇨병이 빨리 나으셨으면 좋겠어요.,
음식도 중요하다니까 음식도 조절해서 먹어봐야겠어.,어서 건강을 되찾으셨으면 좋겠어요.,
영양제도 챙겨 먹고 음식들도 건강히 먹어봐야겠어.,어서 녹내장이 나으셨으면 좋겠어요.,
산책도 좀 하고 사람들도 좀 만나야겠어.,어서 마음이 괜찮아지시면 좋겠어요.,
남은 시간 남편과 더 시간을 같이 하고 좋은 생각을 하려고 노력해야겠어.,마음이 괜찮아지셨으면 좋겠어요.,
그래도 사소한 것에 감사하면서 주어진 상황을 힘내서 살아봐야겠어.,힘내셔서 다시 기운을 내셨으면 좋겠어요.,
그 시간에 대신 가족들과 대화도 하고 지내야겠어.,가족들과 대화하시면서 즐거움을 찾으시면 좋겠어요.,
이제라도 더 악화되지 않게 음식을 신경 써야겠어.,앞으로 계속 건강하셨으면 좋겠어요.,
그 친구 사진이라도 봐야겠어. 사진보고 한잔하면서 기분 풀어야지.,기분이 잘 풀리시길 바라요.,
병원도 자주 다니고 약을 잘 챙겨 먹어야지. 건강관리를 잘해야겠어.,건강을 빨리 회복하시길 바라요.,
병원에서 하는 말을 잘 듣고 약도 잘 챙겨 먹어야지. 먹는 것도 조심하고.,병원에서 진료 잘 받으시길 바라요.,
아무도 날 달래주진 않겠지만 그래도 가족이랑 이 상황을 잘 해결하고 싶어.,가족분들과 이 상황을 잘 헤쳐나가시길 바라요.,
그 친구랑 찍던 사진을 보면서 마음 정리를 해야겠어.,사진을 보며 마음을 잘 추리시길 바라요.,
나만 늙는 거는 아니니까 긍정적으로 생각하려고 노력해봐야겠어.,긍정적으로 잘 극복하시길 바라요.,
몸이 더 안 좋아지지만 않았으면 좋겠어. 음식도 잘 알아보고 먹고.,건강관리 잘 하시길 바라요.,
우선 자식한테 미안하다고 해야겠어. 빨리 건강이 회복돼서 일하고 싶어.,자식분과 대화로 원만히 해결하시길 바라요.,
나만 늙는 건 아니니까 그래도 최대한 긍정적으로 생각해봐야지.,긍정적으로 생각해서 잘 해결하시길 바라요.,
늙고 아픈 건 서럽지만 그래도 잘 견뎌봐야지.,잘 견뎌내시길 바라요.,
아내도 내가 우울해 있는 걸 원치 않을 거야. 잘 이겨내 봐야지.,우울함을 잘 이겨내시길 바라요.,
자식들에게는 정말 미안하지만 솔직한 나의 상황을 잘 얘기해보는 것이 좋겠어.,자식 분들과의 대화를 통해 도움을 받아 마음이 편해지시면 좋겠어요.,
아들이 내 상황을 이해해줄 지는 모르겠지만 아들에게 도움을 구해볼까?,아드님께 도움을 받으셔서 어려운 형편을 극복하시면 좋겠어요.,
잘 모르겠지만 국가에서 도움을 받을 수 있는 방법이 있을 것도 같아.,좋은 방법을 찾으셔서 몸도 마음도 회복되면 좋겠어요.,
우선 회생 절차를 알아보고 나서 돈을 구하는 방법을 찾아보려고.,재정 문제가 잘 해결되어 어려운 마음이 사라지면 좋겠어요.,
우선 건강을 빨리 회복하도록 하고 재정 문제는 자식들에게 도움을 구해야겠어.,건강과 재정 문제 모두 해결되어 마음이 편해지시면 좋겠어요.,
제도적으로 도움을 구할 수 있는 방안을 알아보는 게 좋겠어.,좋은 방안을 찾으셔서 문제가 속히 해결되면 좋겠어요.,
보험금은 자식들을 위해 쓰고 내가 직접 돈을 버는 것이 좋겠어.,마음과 재정 형편 모두 안정을 찾으면 좋겠어요.,
자식들에게 짐이 되지 않으려면 내 생활비는 내가 벌어야겠어.,재정 문제가 해결되어 슬픈 마음이 사라지면 좋겠어요.,
나도 잘 모르겠어. 노년기에 돈을 쉽게 구할 수 있는 방법을 알면 좋겠어.,재정 문제를 해결할 수 있는 좋은 방법을 구하셔서 어려운 마음이 회복되길 바라요.,
보험에 대해 잘 아는 친구에게 조언을 구하는 것이 좋겠어.,친구의 조언을 통해 마음의 어려움이 해소되면 좋겠어요.,
국가에서 보조금을 받을 수 있으면 좋겠어. 노년에 돈 걱정하는 게 너무 슬프다.,도움을 받을 길이 있어서 몸과 마음 모두 회복되시길 간절히 바라요.,
친구들에게 다가갈 자신이 없어.,어깨를 펴고 크게 숨을 쉬어 봐요. 자신감을 가져요.,
날 좋아하는 친구가 없는 것 같은 생각이 들어서 그래.,날 좋아하는 친구가 있을 거예요.,
내일 학교가면 숙제를 같이 하자고 해볼까?,숙제를 같이하면서 친해질 수 있기를 응원할게요.,
조금씩이라도 매일 운동을 해야겠어. 그럼 체력이 점차 좋아질 거야.,매일 운동으로 체력이 좋아지셨으면 좋겠어요.,
중요한 일은 항상 볼 수 있는 곳에 메모를 해 두는 습관을 길러야겠어.,메모하는 습관으로 중요한 일을 깜빡하지 않으셨으면 좋겠어요.,
영양제 말고 운동으로 건강을 챙겨야겠어.,비싼 영양제 대신 운동으로 건강해지기를 바라요.,
식단뿐만 아니라 운동도 병행해서 다이어트를 해야겠어.,운동과 함께 다이어트를 해서 좋은 결과가 생기면 좋겠어요.,
건강을 지키기 위해선 스트레스를 받지 말고 아내와 함께 운동을 해야겠어.,아내와 함께 운동을 해서 오래오래 건강히 살면 좋겠어요.,
건강한 음식을 먹고 운동도 열심히 해서 건강을 유지해야겠어.,음식 관리와 운동을 열심히 해서 건강이 잘 유지되기를 바랄게요.,
건강검진 받는 병원을 집근처로 바꿔야겠어.,가까운 병원으로 옮겨 더 이상 힘들지 않았으면 좋겠어요.,
서로 얼마나 사랑하는지에 대해 이야기 하는 건 어떨까?,대화로 부모님을 설득할 생각이시군요.,
예식장에 우선 사정을 이야기해서 조정해보고 몸이 회복되는 대로 하려고 해.,어서 몸이 회복되셔서 원하는 결혼식을 진행하실 수 있기를 바라요.,
안 그래도 마음이 많이 진정되었어. 이제부터 나도 엄마니까 내가 더 씩씩해져야지!,이젠 나도 엄마니까 더 씩씩해야겠군요.,
남편이랑 더 자주 찾아뵙고 되도록 덜 싸우는 모습을 보여줘야겠어.,부모님을 더 자주 찾아 뵐 생각이시군요.,
아이가 치료를 잘 받을 수 있게 내가 간호를 더 잘 해줘야지.,정성 어린 간호로 지금 상황을 잘 극복 하시길 바라요.,
나가서 친구들과 이야기를 나눠 봐야지.,친구들과 나가서 대화화면서 기분이 나아지길 바라요.,
오늘은 남편과 나가서 외식해야겠어.,외식으로 마음을 푸실 생각이시군요.,
오늘은 엄마한테 맛있는 요리를 해드리고 감사하다는 말씀을 해드려야겠어.,요리로 고마움을 전할 생각이시군요.,
남자 친구 입장에서 생각해 보는 습관을 가져보고 더 많은 대화를 나눠야겠어.,남자 친구분과 대화가 잘 풀렸으면 좋겠어요.,
남자 친구와 대화를 더 많이 나눠보고 현실적으로 더 생각해봐야지.,대화로 문제를 해결하려고 하시는군요.,
주변에 아는 분들께 연락 드려서 일자리를 구해봐야지.,주변 아는 분들에게 도움을 요청하실 생각이시군요.,
내가 남편한테 잘 할 거야. 응원의 한마디를 해줘야지.,남편에게 더 잘 하실 생각이시군요.,
방에서 혼자 술이나 마셔야지.,술을 마시며 속상한 마음을 달래려 하시는군요.,
상사가 말할 때 노트에 적어야겠어.,노트에 적는 습관으로 문제가 잘 해결되길 바라요.,
모르겠어. 아무 생각도 안 나고 아무것도 안하고 싶어.,아무것도 하고 싶지 않을만큼 슬픔이 크신 것 같아요.,
내가 이제라도 친구 좀 챙겨줘야겠어.,친구를 챙겨 보살펴주려 하시는군요.,
생일 생각 안 하고 좋아하는 아이돌 그룹 노래나 들을래.,좋은 노래를 들으면서 기분이 풀리면 좋겠어요.,
그냥 기분이 너무 안 좋아서 한숨 자야겠어.,자고 일어나서 기분이 풀리면 좋겠네요.,
다른 안전한 곳을 찾아봐야겠어.,마음 맞는 친구와 안전한 장소를 찾을 수 있으면 좋겠네요.,
한두 번이 아니라 상습적으로 나를 괴롭혀서 너무 슬퍼.,주변에 이 사실을 도와줄 수 있는 친구가 있으면 좋겠어요.,
그래서 작년에 같은 반이던 친구한테 가보려고 해.,이야기가 잘되었으면 좋겠어요.,
나를 왜 욕하는지 뭔가 오해가 있는지 알아봐야겠어.,일이 잘 풀려서 즐거운 동아리 생활이 되었으면 좋겠네요.,
맛있는 과자라도 많이 사 들고 가서 얘기해 볼까 해.,조금이라도 즐거운 추억을 같이 남길 수 있으면 좋겠네요.,
조원들한테 미안하다고 말이라도 해야겠어.,같은 조원들이 기운을 북돋아 주면 좋겠네요.,
혼자 먹는 다른 친구들 옆에라도 앉아봐야겠어.,그 친구들과 이야기하며 밥 먹을 수 있으면 좋겠네요.,
김 씨를 찾아가 위로를 해줄까 해. 서로 이야기 하다 보면 기분도 나아질 것 같아.,김 씨와의 대화로 기분이 풀렸으면 좋겠어요.,
응. 함께 등산을 하면 정말 즐거운데 말이야.,관절염이 나아져서 노인정 사람들과 함께 등산을 하는 날이 돌아오길 바랄게요.,
재미없어도 내가 보고 싶어 하는 마음을 전달해야 할 것 같아.,당신의 마음을 손자가 알고 병문안을 왔으면 좋겠네요.,
장례식장에라도 가봐야 할 것 같아. 추모를 하고 싶어.,추모하면서 기분이 나아졌으면 좋겠네요.,
용하다는 병원들을 찾아가서 원래대로 되돌릴 수 있는지 방법을 알아봐야 할 것 같아,좋은 곳을 찾아 당신의 눈이 원래대로 돌아왔으면 좋겠네요.,
지금 당장은 잘 모르겠어. 방법을 알아봐야지.,방법을 찾아서 당신이 콘서트에 갈 수 있기를 바라요.,
며느리랑 손자가 생일에 준 편지를 보면서 위안을 삼아야겠어.,편지를 보면서 기분이 나아지기를 바라요.,
잠깐 마음 정리 겸 산책을 다녀오려고.,산책으로 당신의 기분이 나아지기를 바랄게요.,
매매가 아닌 전세로 가거나 조금 더 낮은 조건의 집을 봐야겠지.,대안을 통해 일이 잘 해결되었으면 좋겠어요.,
암은 잘 치료되었어. 돈이 많이 들었지만 건강을 회복해서 정말 다행이야.,금전적인 부담은 크셨지만 건강을 회복하셨다니 정말 다행이에요.,
모르겠어. 한 숨 푹 자면 조금 나아질지도.,잠시 휴식을 취하면서 지금 기분이 나아지시길 바라요.,
부모님과 조용한 곳에서 저녁을 먹으며 남자 친구와 결혼을 해야 하는 이유로 설득해 볼 거야.,부모님과의 진지한 대화를 통해서 관계도 회복하고 지금의 남자 친구와 결혼도 하기를 바랄게요.,
우선 산재처리가 되는지 회사와 논의해 봐야겠어.,회사 쪽이랑 좋은 마무리를 지으면 좋겠네요.,
정말 미안하다고 사과하려고. 그럼 딸들도 이해해 주지 않을까 해.,진심을 담아 사과하셔서 딸들과의 관계가 회복되길 바라요.,
아니야. 자식들에게 의지하지 말고 내 스스로 용기를 내서 외로움을 이겨내야겠지.,용기를 내셔서 스스로 외로움을 잘 이겨내시길 바라요.,
내가 의지할 곳은 경로당 밖에 없으니 왜 그렇게 되었는지 사실대로 얘기해야겠지. 창피하지만.,잘 말씀하셔서 외롭지 않게 지내셨으면 좋겠어요.,
자식들에게 이런 내 마음을 솔직하게 얘기해 볼까 해. 그럼 이해해주겠지.,잘 대화하셔서 슬프지 않게 잘 지내셨으면 좋겠어요.,
친구네 부부같이 저녁 시간에 산책이라도 함께 나가봐야겠어.,함께 산책하시면서 지금 분위기가 좋게 바뀌시기를 바랄게요.,
친구들은 어떤지 얘기를 한 번 들어보면 어떨까 싶어.,친구 분들과 이야기 나누시면서 지금 기분이 나아지시기를 바라요.,
오늘은 어쩔 수 없지. 우산을 사서 집에 가야겠어.,우산을 사서 집에 가기로 하셨군요.,
나도 모르겠어. 앞으로 어떻게 살아갈지 모르겠어.,주위에 이 막막한 감정을 나눌 수 있는 사람이 있었으면 좋겠어요.,
다행히 수술은 하지 않았고 치료를 받고 있어. 내가 힘이 되어주어야겠어.,아내 분께서 건강이 회복되길 바랄게요.,
서운해도 자식들이 바쁘니 어쩔 수 없지. 명절 때나 얼굴 보고 이야기해야겠어.,명절 때 가족들과 이야기를 나누면서 즐거운 시간을 보내길 바라요.,
지금부터라도 옆에서 잘 챙겨주고 보살펴 주어야겠어.,옆에서 잘 보살펴 주시면서 기분이 더 나아지시길 바라요.,
지금이라도 신경 많이 써주고 잘해야겠어.,아내 분에게 사용자님의 마음이 전해지길 바랄게요.,
정 보고 싶으면 영상 통화라도 해야지.,지금이라도 영상 통화를 해보면서 기분 전환을 해보는 것도 좋을 것 같아요.,
글쎄 해줄 수 있는게 없어 그래서  계속 마음이 아프네.,주변에 이 마음 아픈 심정을 나눌 수 있는 사람이 있었으면 좋겠어요.,
씁쓸해지는데 술이나 한 잔 해야겠어.,술 한잔 하시면서 아쉬운 마음이 달래지셨으면 좋겠어요.,
글쎄. 사과의 편지라도 한 번 적어볼까.,어머니와 관계가 회복되어 기분이 나아지시면 좋겠네요.,
글쎄. 일단은 그냥 기다려 보는 게 최선인 것 같아.,별 문제 없으시길 바랄게요.,
우선 엄마가 일어나시면 전화를 일부로 받지 않아 죄송하다고 다음부턴 그러지 않겠다고 말씀 드려야겠어.,사과가 잘 받아들여져서 엄마와 관계가 회복되면 좋겠네요.,
아빠한테 짜증내서 죄송하다고 오늘 퇴근하시면 바로 말씀 드려야겠어.,아버지께 말씀 드려서 슬픈 기분에서 벗어나면 좋겠네요.,
오늘은 친구들과 만나는걸 미루고 맛있는걸 사서 아빠와 함께 나누어 먹어야겠어.,아버지와 함께 시간을 보내고 슬픈 마음이 사라지길 바랄게요.,
포기하지 말고 다시 도전해서 이번에는 꼭 성공해야겠어.,원하는 꿈을 이루길 바랄게요.,
떨어져서 슬플 친구를 먼저 위로해줘야겠어.,대화로 서로의 기분이 풀렸으면 좋겠네요.,
친구들 만나서 이야기 좀 하고 와야겠어.,친구들과 이야기 나눠보고 기분이 풀렸으면 좋겠어요.,
나의 문제가 뭔지 그 친구한테 상담해봐야겠어.,친구 분과 대화를 통해 문제가 잘 해결되면 좋겠네요.,
부모님에게 내가 하고 싶은 일을 용기 있게 말씀드려야겠어.,부모님과의 대화를 통해 진로에 대한 고민이 해결되길 바라요.,
오늘은 친구랑 만나서 놀아야겠어.,친구랑 즐거운 시간을 보내시고 기분이 풀렸으면 좋겠어요.,
더 많이 연습해서 다음 시험 때는 긴장하지 않고 실수 없게 할 거야.,더 연습하여 다음 시험 때는 긴장하지 않으려고 하시는군요.,
계속 비아냥거린 친구들한테 사과해달라고 말할 거야.,친구들과의 대화가 잘 풀리면 좋겠어요.,
내가 간호를 할 거야. 위암에 도움이 되는 음식들도 직접 만들어 드릴 거야.,어머니를 향한 정성어린 간호로 상황을 잘 극복하길 바라요.,
꿈속에서 사랑하는 아빠에게 딸을 그만 보러 와도 괜찮다고 해야겠어.,꿈속에서 아버지에게 말을 전하고 싶은 심정이군요.,
사소한 것이라도 나의 꿈과 관련된 성과를 보여주겠어.,꿈에 연관된 작은 성과부터 보여주려고 하시는군요.,
내가 하고 싶은 일로 잊거나 못 참겠으면 언니에게 말을 해 봐야겠어.,하고 싶은 일이 잘 이루어지고 언니에게 말을 해서 해결해 보려 하시는군요.,
상황 봐서 아빠한테 무슨 일이 있는지 조심스럽게 여쭤봐야겠어.,아빠에게 물어 보려 하시는군요.,
내가 먼저 부모님께 얘기를 해 볼 거야.,부모님과 다시 예전처럼 속 깊은 얘기를 나눌 수 있기를 바라요.,
평일엔 학교를 가야 하니까 주말에라도 아빠 가게에 가서 일을 도와 드릴 거야.,아버지가 힘을 얻어 나의 슬픔도 사라지길 바랄게요.,
복습을 더 철저하게 해서 시험준비를 해야겠어.,복습을 철저히 하려 하시는군요.,
집안 청소를 해서 부모님을 도와드려야겠어.,부모님 걱정이 줄어들기를 바랄게요.,
외할머니께 화상전화를 연결해서 엄마랑 통화를 하도록 해드려야겠어.,엄마에게 영상통화를 시켜 드리려고 하시는군요.,
엄마한테 솔직하게 이야기 해봐야겠어.,어머니와 직접 얘기를 나눠보려고 하시는군요.,
부모님께 솔직하게 내 고민을 얘기하고 싶어.,부모님께 고민을 솔직하게 털어 놓으려 하시는군요.,
엄마와 솔직하게 대화해봐야겠어.,엄마와의 대화가 잘 되었으면 좋겠어요.,
앞으로 동생하고 싸우기보다 대화로 풀어야겠어.,동생과 싸우기보다는 대화를 통해 해결하기로 하시는군요.,
고마웠다고 잘 가라는 편지를 쓸래.,친구에게 마음을 담아 편지를 남기려고 하시는군요.,
감사하다고 쓴 편지랑 꽃다발을 드릴까?,편지랑 꽃다발을 드리며 속상한 마음을 달래보실 생각이군요.,
지금부터라도 더 열심히 공부해야겠어.,열심히 공부해서 원하는 학교에 꼭 갈 수 있으면 좋겠어요.,
앞으로 혼나지 않으려면 지금보다 더 노력해야겠어.,지금보다 더 노력해서 공부하기로 하시는군요.,
학원에 가서 공부해야겠어. 지금부터라도 더 열심히 해서 원하는 대학교는 꼭 합격할 거야.,학원에 가서 원하는 대학을 목표로 열심히 공부하려 하시는군요.,
선생님께 상담 좀 부탁드려야겠어.,매일 정해진 양을 꾸준히 풀어 보려 하시는군요.,
언니에게 조언받은 대로 매일매일 정해진 양 만큼 반복해서 풀어야겠어.,친구와 대화하시고 문제가 잘 풀렸으면 좋겠어요.,
잘 모르겠어. 선생님께 조언을 구했으면 좋겠어.,그런 노력이 좋은 결과를 가져오길 바랄게요.,
나만의 공부법을 찾아봐야겠어. 그리고 열심히 노력해봐야겠어.,이 학교의 규율에 적응할지 말지를 고민해 보시는군요.,
엄마 생각을 좀 해야겠어. 엄마가 보고 싶어.,경찰의 도움을 받으려고 하시는군요.,
곧 다시 상승세가 되기를 바라며 좀 더 기다려보려고 해.,앞으로 더 이상 과장님 때문에 힘든 일이 없으면 좋겠어요.,
친구에게 진지하게 사과하고 얘기해봐야겠어.,직접 이야기하셔서 이 문제가 잘 해결되길 바라요.,
나도 같이 화내지 말고 다시 사이가 좋아지도록 노력해야겠어.,편지를 쓰셔서 믿음을 회복하셨으면 좋겠어요.,
아내에게 내가 가진 계획들을 진지하게 말해주면서 다시 한 번 설득시켜 봐야겠어.,여자 친구분과 대화를 하려고 하시는군요.,
다른 경력 관련 일을 하면 이력서를 채울 수 있겠지?,선생님과 함께 잘 고려해서 지금 상황을 잘 극복해 나갔으면 좋겠어요.,
내가 부족해서 그런 것이지.,좋은 회사 생활이 됐으면 좋겠어요.,
내가 자존감이 낮고 노력이 부족해서인 것 같아. 그 부분들을 채워야겠어.,친구들과 놀면서 기분이 나아졌으면 좋겠어요.,
가족들과 상의하고 회사 상사와도 상의해야겠어.,지금의 다짐으로 상황이 좋아지길 바랄게요.,
예전에 공부하다가 포기한 자격증 공부를 다시 시작해야겠어.,이직을 고려하고 계시는군요.,
남자친구에게 이별 통보를 해야겠어.,육아를 공평하게 분담하는 것을 선택하셨군요.,
슬프지만 남자친구와 이별해야겠어.,남편에게 위로받아서 기분이 나아졌으면 좋겠네요.,
잘 모르겠어. 지금은 건강관리에 더 전념해서 기력을 회복하는 것이 우선인 것 같아.,아내와 더 많은 시간을 보내지 못해서 후회되시는 것처럼 들려요.,
하긴 하는데. 좀 천천히 해야지 갑자기 술도 음식도 조절하면 너무 슬프니까.,기적이 일어났으면 하시는군요.,
아이와 전문 심리 상담센터에 가봐야겠어.,아무도 없는 곳에서 맘껏 소리치셔서 엉망인 기분이 조금이나마 좋아지길 바라요.,
병원비도 모으고 건강도 챙겨야겠어.,지금 상황을 알아줄 사람이 주위에 있었으면 좋겠어요.,
잘 모르겠어. 자꾸만 초라해지는 기분이야.,대화를 통해 지금 상황을 잘 극복하기 바라요.,
작은 회사를 운영 중인 친구에게 얘기라도 해봐야겠어.,시대에 맞는 노력으로 OO님의 문제가 해결되었으면 좋겠어요.,
오늘 퇴근하고 동기랑 술 한잔해야겠어.,사람들의 태도에 기 죽지 않으려고 하시는군요.,
그래도 이번 실적을 차근차근 쌓아서 좋은 결과를 보일 거야.,회사에 건의하셔서 잘 해결되었으면 좋겠어요.,
컴퓨터 학원에 다녀서 내 능력을 업그레이드 시켜야겠어.,회사에 건의를 하셔서 잘 해결되었으면 좋겠어요.,
회사에 다른 부품을 제조하는 것으로 건의 해봐야겠어.,가족들이랑 자연 속에서 힐링하면서 쉬는 시간을 가지면 좋겠네요.,
나도 시대에 맞게 변화하려는 노력이 필요하겠지.,동기분이랑 이야기 나누면서 속상한 마음이 조금이나마 풀렸으면 좋겠네요.,
알람을 맞추고 미리 약을 나눠놔야겠어.,어머님과 좋은 시간 보냈으면 좋겠어요.,
지금은 슬프지만 아빠를 잘 보내드리는 게 좋을 거 같아.,꼭 건강이 나아지셔서 삶을 잘 즐기셨으면 좋겠어요.,
앨범을 찾아서 사진으로라도 찾아봐야겠어.,전화해서 걱정하고 있는 게 잘 해소되었으면 좋겠어요.,
지금부터라도 가벼운 운동을 해야겠어.,남편 분에게 잘 이야기해서 원하시는 대로 자녀분들이 병문안을 오길 바랄게요.,
일어나자마자 병원에 가서 진료를 받아야겠어.,퇴원하시기 전까지 친구들이 병문안을 와서 기분이 풀리시기를 바랄게요.,
