human,system,
몸이 안 좋아져서 일을 그만두어야겠어.,몸이 많이 안 좋으신가 봐요.,
얼마 전 황혼이혼 한 친구의 전화를 받았어.,친구분과 좋은 대화 나누셨나요?,
지금 너무나 슬픈 심정이야.,어떤 이유로 그렇게 슬프신가요?,
선천적으로 몸이 성치 않은 곳이 있어 일 구하기가 쉽지 않아.,몸이 불편하셔서 구직이 어려우시군요.,
요새는 우리 시절보다 이혼에 매우 무감각해진 것 같아. 주위에서 많이 보기도 하고.,주위에 이혼하신 분들이 많으신가요?,
나 이혼하려고 해. 여태껏 살아온 게 다 헛된 것 같아.,왜 이혼을 하려고 하시나요?,
내 미래를 생각하면 슬퍼져.,무슨 일인지 구체적으로 말씀해주시겠어요?,
나이 들어갈수록 지병이 있으니 의료비가 걱정이야.,몸이 안 좋으세요?,
교통사고 후유증으로 결국 몸이 불편해져서 걱정이야.,후유증이 심한가요?,
아이들이 다 크면 이혼하겠다는 옛날 다짐이 생각나.,이혼에 대해 생각을 하셨어요?,
사업에 실패하여 자기 처지를 비관하며 집에만 있는 친구를 만났어.,사업 실패라니 친구분이 힘드시겠네요.,
병원에 다녀오다 지하철역에서 구걸하는 사람을 보았어. 그 모습이 자꾸 생각나네.,마음이 좋지 않으셨나 보네요.,
내 친구에게 병문안 다녀왔어. 마음이 좋지 않네.,친구분은 어떻던가요?,
나이를 먹을수록 만날 수 있는 사람들이 없어,그러신가요? 동네 친구분들도 많이 계시지 않을까요?,
노년이 되면서 친구가 줄었어.,친구가 적어서 슬프실 것 같네요.,
늙으면서 저학력이라서 정말 불만이야.,고령과 저학력으로 속상하시겠어요.,
집에서 살림과 내조를 하며 평생을 살아온 여성들이 늙어서 이혼을 원하는 경우가 가끔 있지.,네. 황혼이혼 얘기를 들어봤어요.,
내가 노년의 삶을 살면서 달라진 점이 하나 있다네.,무엇인지 여쭈어봐도 될까요.,
예전에 사고 난 것 때문에 여러 가지로 제약이 많아.,불편하시겠어요. 구체적으로 힘든 점이 어떤 것들이 있을까요?,
왼쪽 다리가 짧아 저니까 어디 일하고 싶어도 잘 써주지 않아 슬퍼.,일자리가 구해지지 않아 힘드시군요. 소아마비인가요?,
한 사람과 평생을 사는 일이 얼마나 대단한 일인지 모르겠어.,평생 한 사람과 사는 게 쉽지 않다고 생각하시는 것 같네요.,
소득이 일정하지가 않아.,소득이 일정하지 않으시군요.,
주변에 말들을 안 해서 그렇지 가정사에 문제가 있는 친구들이 많네.,무슨 문제들이 있는지요?,
친구들이랑 모임하고 오면 너무 화가 나서 가기 싫지만 어쩔 수 없잖아.,왜 모임에 가기 싫으신가요?,
은퇴하고 나서 아내가 이혼하자고 해서 슬퍼.,이혼을 원하시는 이유가 있다고 하시던가요?,
오늘 어쩔 수 없이 회사에 사표 냈어. 내일부터 회사 못 간다니 슬퍼서 눈물이 나네.,사표를 내야 하는 이유라도 있었나요?,
요즘 시니어 일자리 구해서 나가는데 한 달에 고작 이십칠만 원밖에 안 주네.,그러시군요. 많은 금액은 아닌 거 같아요.,
내 친구들은 돈도 많아서 너무 부러워.,금전 문제로 너무 속상하시겠어요.,
노년이 되니 정말 돈이 부족해서 불만이야.,고령이 되셔서 금전 문제로 불편하시겠어요.,
올해 초까지 동네에서 삼십오 년간 전자수리점을 했지. 사양직업이지만 단골이 많아 꽤 재미가 있었어. 그런데 이제 가게를 그만두고 쉬고 있어. 슬픈 일이지.,엄청나게 오래 하셔서 그 주변에는 모르는 사람이 없었겠네요? 좋은 기술을 가지셨는데 왜 그만두셨나요?,
왜 들 나이 먹어서 갈라서는지 참 언짢기 한이 없네.,황혼 이혼을 말씀하시는군요.,
이제는 일상생활도 힘들어서 어디 요양원이라도 들어가고 싶네!,아 요양원에 들어가실 계획이신가요?,
얼마 전에 친구를 만났지 뭐야. 얼마나 반갑던지 시간 가는 줄 몰랐다니깐.,무척 즐겁게 지내셨군요. 저도 기분이 좋아지는 것 같네요.,
나 오늘 아내와 이혼했어.,많이 슬픈 하루였겠어요.,
사람의 인생은 노년기에 접어들었다고 끝나는 게 아니지. 좋거나 나쁜 다른 미래가 기다리더라고.,어떤 미래를 겪으신 상황인가요?,
나이가 드니 혼자 사는 것이 더 외로워지는 것 같아.,결혼하지 않으셨나 봐요.,
정말 힘들고 우울해.,왜 그렇게 생각하는지 더 자세히 알려주세요.,
아. 너무나 슬프구나.,슬픈일이 있으셨나요?,
너무 슬프네. 도대체 어쩌면 좋을까?,무슨 계기로 그렇게 슬프신가요?,
배란다 화분을 들여놓아야 하는데 계속 미루고 있네.,화분을 들여놓아야 하는데 계속 미루고 계시는군요.,
엎친 데 덮친 격이야.,더 자세한 이야기를 들을 수 있을까요?,
시대는 급변하네. 요즘은 초등학교에서 코딩도 가르친대.,그렇죠. 정말 세월의 변화 속도가 빠르죠.,
나 슬퍼서 견딜 수가 없네.,무슨 일로 그렇게 슬퍼하고 계시는지요?,
옆집 아주머니 병문안을 다녀왔어.　,아주머니는 어떠신가요?　,
노년기에 이혼하려 해. 눈앞이 캄캄하고 지금 현실이 슬퍼.,이혼하시려는 이유를 말씀해 주실 수 있으신가요?,
우리는 왜 이렇게 노후준비가 안 되어 있는지 모르겠어.,아직 준비가 많이 안 되어 있으신가요?,
나이 들어 이혼 하게 되면 슬픈 마음이 들까?,이혼에 대해서 생각하고 계신건가요?,
나이들어 일을할수없어 슬퍼.,건강이 안좋으신가요?,
황혼의 이혼은 슬픈거 같네.,나이들어서 이혼하면 더안타까울거같아요.,
요즘 매일 매일 슬퍼.,요즘 슬프시군요. 무슨 일인지 자세히 말씀해주실 수 있으신가요?,
벌이도 없고 자식들로부터도 외면당하는 것 같고 몸도 불편하여 친구들도 만나지 못해서 많이 외로워.,부인하고는 잘 지내시는지요?,
요즘 내 신세 생각하면 눈물밖에 안 나와.,무슨 안 좋은 일을 많이 당하셨는지 말씀해 주실 수 있으세요?,
같이 살 때는 무조건 밉기만 하더니.,배우자 말씀인가요? 따로 사시나 봐요.,
갈 사람은 가고 있는 사람은 있는 줄 알았더니 그것도 아니네. 이사나 이민 간 사람들은 빼더라도 사이가 껄끄럽거나 이런저런 이유로 다들 떠나니 혼자 남겨진 기분이야.,정말 쓸쓸하시겠어요.,
미래라는 단어를 들으면 사람들은 장밋빛이나 푸른색을 떠올린다지만 난 우중충한 잿빛이나 검은색이 떠오르니 왜일까? 나이 탓일까 아니면 노후준비가 안 돼 있는 탓일까?,노후준비가 걱정되시나 봐요?,
요즘 너무 힘들어.,요즘 힘드신 일이 있으셨나요? 자세히 말해주세요.,
부인과 이혼하고 나서부터 슬픈 생각밖에 안 들어.,부인과 이혼을 하셔서 슬프시군요.,
요즘은 사람들을 만나는 것이 싫어져서 걱정이야.,그렇게 되신 거에 어떤 계기가 있었나요?,
어릴 때부터 열심히 살면 그에 따른 보답이 있을 거란 생각을 했지.,열심히 살면 그만큼 보답을 받을거라고 생각하셨군요.,
막상 나가서 일하려니 할 일도 없고 벌긴 벌어야 하고 앞이 캄캄하네.,요즘은 젊은 사람들도 일자리 구하기가 힘드니까요. 그래도 힘껏 시고 구해 보고 있으시죠?,
사람이 나이가 들수록 마누라가 소중하고 가족이 소중하다고 생각하며 산다고들 하지.,그런다고들 하지요.,
남편과 이혼하고 보니 후회되는 점이 많아.,어떤 점이 후회되시는지요?,
살아가면서 마음의 폭이 좁아지고 대인관계도 축소가 되니 슬픈 마음이 드네.,그런 생각에 슬픈 생각이 드시나 봐요.,
친구들이 한둘씩 떠나고 나니 인생이 너무 허무해.,친구분들이 돌아가시고 나서 허전함을 많이 느끼시는군요.,
성격차이로 남편과 이혼했어.,부군과의 결혼 생활이 만족스럽지 않으셨군요. 무슨 문제인지 자세히 말씀해 주시겠어요?,
다른 사람들은 다 즐거워 보이는데 나만 그렇지 못해.,지금 생활이 즐겁지 않으세요? 그렇게 느끼시는 이유를 말씀해주실 수 있으신가요?,
나는 만날 사람이 없어서 슬퍼,만날 사람이 없으세요?  젊었을 때 친구분들과 연락을 하지 않으세요?,
참고 산 세월이 너무 억울해서 남편 퇴직과 동시에 이혼헸는데 괜히 했나 봐.,이혼 결정이 섣불렀다고 느끼시나 봅니다. ,
자식을 앞세우고 나니 나도 안 좋은 생각만 들어. ,사랑하는 자식을 잃고 정말 슬픔이 깊으시겠습니다. ,
슬픈 하루가 시작됐네.,왜 그렇게 생각하시나요?,
노년의 이혼은 슬픈일이야.,이혼은 슬픈 일일 수 있죠.,
손발이 자주 저려.,손발이 자주 저릴 때 어떻게 대처하나요?,
내가 기술로 먹고살았는데 이제는 힘들게 됐어.,어떤 이유 때문인지 들어볼 수 있을까요?,
담담하게 받아들이고 있는 줄 알았는데 아닌가 봐. 가끔 감정이 확 하고 터질 때가 있어.,어떤 점 때문에 그런 감정 변화를 겪으시는 건지 이야기해 주시겠어요?,
이렇게 쉽게 이혼 절차가 끝나니 참 허탈하네. 그동안 참아온 세월을 비웃기라도 하듯 말이야.,이혼 결정이 쉽지 않았을 텐데 참 슬프시겠어요.,
열심히 살아도 부모님과 처자식을 남부럽지 않게 부양할 수 없는 현실이 너무 슬퍼.,가족을 남부럽지 않게 부양 못 하는 현실이 슬프시군요.,
내가 가족들을 책임져야 하는데 몸이 아파 그러기가 쉽지 않아. 너무 슬퍼.,몸이 아파 가족을 책임지기가 쉽지 않아 슬프시군요.,
난 재혼가정에서 자라서 불안장애 진단을 받았어. 너무 슬퍼.,불안장애 진단을 받아 많이 슬프시군요.,
매번 시험에 떨어지니 우울증이 걸렸어. 이제 인생 목표를 잃어버려서 너무 슬퍼.,시험에 떨어져서 많이 슬프시군요.,
부모님과 자식들을 부양하는데 너무 힘들고 지쳐.,가족을 부양하느라 힘드시군요.,
아버지가 일찍 돌아가셔서 어머니하고 진로를 고민하는데 서럽고 슬퍼.,어머니하고만 진로에 대해 고민을 하는 것이 서럽고 슬프시군요.,
나는 미대를 준비 하고 싶어. 하지만 아빠 혼자서 나를 키우시느라 형편이 좋지 않아.,하고 싶은 일을 선뜻 할 수 없어 많이 힘드시겠군요.,
학교에서 장난치다가 친구의 다리를 부러뜨렸어. 그 친구한테 너무 미안해.,친구한테 미안한 감정을 느끼시는군요.,
내가 가족의 생계를 책임지고 있었는데 다친 이후로 일을 못 나가게 됐어.,가족의 생계가 걱정되고 슬프시군요.,
부모님과 자녀를 모두 돌보기에 경제적 형편이 따라주지 않아서 슬퍼.,경제적 형편 때문에 부모님과 자녀를 모두 돌보기가 어려워 슬프시군요.,
나는 왜 다른 친구들처럼 진로를 같이 고민해 줄 아빠와 놀지 못하는 걸까 너무 슬퍼.,다른 친구들과 달리 아버님과의 시간을 보내지 못하셔서 슬프시군요?,
엄마 아빠의 과잉보호 때문에 너무 힘들어서 울었어. 우울증도 걸린 것 같아.,부모님의 과잉보호 때문에 많이 힘드시겠어요.,
모든 반 아이들이 내가 말을 걸면 나를 없는 사람 취급해. 아이들이 나를 무시해서 슬퍼.,반 친구들에게 무시를 받는 상황이군요. 많이 서럽고 슬프겠어요.,
골다공증 때문에 걸을 수가 없어서 하던 일을 못 하게 되어 직장에서 잘렸어. 너무 슬퍼.,골다공증으로 인해 일할 수 없게 되어서 많이 슬프고 속상하시겠어요.,
남편이랑 말다툼하다가 화를 못 참고 소리를 질렀더니 싸움이 더 심해졌어.,말다툼하다가 소리를 질러서 싸움이 더 심해지셨군요.,
엄마가 재혼을 해서 새아빠랑 함께 살게 되었는데 친아빠가 계속 생각나. 예전이 너무 그리워.,예전 생각이 나서 많이 힘드시겠어요.,
가족이 싸우게 됐는데 내가 그만 부정적으로 대처하는 바람에 마음에 걸려서 슬퍼.,가족갈등에 부정적으로 대처해서 슬픈 감정이 드시는군요.,
친구들과 카페에서 공부하는데 계속 부모님께 연락이 와. 이럴 때마다 지쳐.,부모님의 잦은 연락으로 많이 힘드시겠어요.,
내가 정신질환이 있어서 부모님이 과잉보호해. 나 때문에 부모님 인생이 없는 것 같아 슬퍼.,사용자님 때문에 부모님 인생이 없는 것 같아 슬프시군요.,
다리가 불편해서 휠체어를 타고 생활을 해야 해서 일정한 수입이 없어서 너무 슬퍼.,다리가 불편해서 일정한 수입이 없어 슬프시군요.,
아무런 노후 준비도 못 했는데 벌써 나이를 이렇게 먹어서 슬프기만 하네.,아주 슬프시겠어요.,
부모님이 재혼한 뒤로 난 항상 슬픈 것 같아.,부모님의 재혼으로 슬프시군요.,
이제 나이도 많이 들었는데 이 시기에 이혼을 하게 돼서 너무 슬퍼.,이혼하신 것 때문에 많이 슬프시겠어요.,
친구들이 내가 피시방같이 안 간다고 며칠 전부터 계속 안 놀아줘.,친구들과 같이 놀지 못해서 많이 속상하시군요.,
내가 시각장애라는 이유로 일자리가 없고 가족을 먹여 살려야 하는데 죄책감과 슬픔이 와.,시각장애인이라는 이유로 일자리를 구하시지 못해 슬프시군요.,
갑자기 아내가 나더러 이혼하자고 했어. 근데 우리가 싸운 적도 없고 안 좋은 사이도 아닌데 왜지?,갑자기 이혼하자고 말씀하시니 당황스러우시겠군요.,
아내와의 이혼 후 빈자리가 크게 느껴져. 몸도 안 좋아져서 무기력하고 슬픈 감정이 드는군.,이혼 후 아내의 빈자리가 크시군요.,
우울증 병력으로 원하는 곳의 취업이 실패했어. 이런 상황이 비참하고 슬퍼.,우울증으로 취업이 실패해 비참하고 슬프시군요.,
졸업해서 취업 준비를 하는데 내가 조현병이래. 너무 어이없고 슬퍼.,취업 준비를 하면서 많이 힘드셨나 봐요. 아주 슬프시겠어요.,
혼자인 엄마를 생각하면 취직해서 돈을 벌어야 하고 나를 생각하면 대학에 진학하고 싶어.,진로에 대해서 고민이 되시는군요.,
여자친구와 결혼하고 싶은데 전혀 준비가 되어있지 않아서 슬퍼.,여차친구와 결혼하고 싶은데 전혀 준비가 되어있지 않아 슬프시군요.,
부모님이 이혼하셔서 서로 재혼가정이 되었어. 충격이 너무 커서 우울증이 왔어.,부모님의 이혼과 재혼으로 마음고생이 심했겠어요.,
나이를 먹어 허리가 아프다 보니 일을 못 해 경제적으로 어렵구나. 참 슬프도다.,아픈 허리 때문에 노동할 수 없어 슬프시군요.,
내가 무릎이 아파서 다리를 못 쓰네. 내 아내는 그게 보기 싫었나 봐.,몸도 아프시고 허탈감도 크시겠어요.,
삶이 바빠 배우지를 못해 영감한테 이혼당해서 서글퍼. 앞으로 어떻게 살꼬.,남편분과의 이혼으로 허탈하시겠어요.,
친구 문제로 성적이 점점 떨어지고 있어 너무 슬퍼.,친구 문제로 인해 시험성적이 점점 떨어져서 정말 슬프시겠어요.,
아무리 열심히 벌어도 하루 살기 빠듯해 가장이라는 부담감이 이렇게 클 줄은 몰랐어.,생계에 대한 부담감 때문에 심적으로 불안하시군요.,
여자 친구와 결혼 문제로 싸워서 나 자신이 초라하고 슬퍼.,여자 친구와 결혼 문제로 싸워서 마음이 괴로우시군요.,
어려서부터 아빠 없이 엄마랑만 지내왔는데 애들이 뒤에서 수군거리는 것 같아서 슬퍼.,친구들이 뒤에서 자신의 얘기를 하여서 슬프셨군요.,
건강검진을 했는데 위에 종양이 발견돼서 검사를 해봤더니 암일 가능성이 크대. 너무 슬퍼.,건강상의 문제로 인해 슬프시군요.,
가족을 잘 보살피고 풍족하게 살 수 있도록 돈을 벌어야 하는데 신체장애 때문에 불가능해서 슬퍼.,가족을 보살피기 위해 돈을 벌어야 하는데 장애 때문에 불가능해서 슬프셨겠군요.,
오늘도 면접 본 회사에서 최종 불합격 통보를 받았어. 정말 울고 싶다.,불합격 통보 때문에 슬프시군요.,
아이들도 내 말을 듣지 않고 어머니도 건강이 안 좋으셔서 슬퍼.,자녀 문제와 어머니 건강 때문에 슬프시군요.,
대학을 졸업하고 칠 년째 취직이 되질 않아. 취업 스트레스 때문에 아주 슬퍼.,취업이 되질 않아 아주 속상하시겠어요.,
나를 혼자서 키운 엄마가 걱정돼서 원하는 진로를 못 선택하겠어.,어머님이 걱정돼서 진로 선택에 고민이 많으시겠어요.,
뇌졸중에 걸려서 왼쪽 팔다리를 못 쓰게 되었어. 눈물이 나는구나.,몸이 불편해지셔서 많이 슬프시겠어요.,
항상 전교 일 등을 해서 친구들의 질투로 왕따를 당해왔어. 너무 슬퍼.,친구들의 질투로 왕따를 당해 괴롭고 슬프시군요.,
아내가 나를 휠체어에서 떨어뜨려서 화를 내고 말았어. 이러기 싫은데 너무 슬퍼.,몸 문제로 아내에게 화를 내 슬프시군요.,
나의 부모님과 자식들을 모두 돌봐야 하는 게 금전적으로 힘들어.,가족들을 돌보시는 게 금전적으로 힘드시군요.,
항상 챙겨주던 아내가 있었는데 이혼하니 아무도 없군.,혼자 계시니 쓸쓸하시겠어요.,
나는 졸업하면 무얼 해야 할지 생각 중인데 너무 막막하고 답답해.,진로에 대한 걱정으로 고민이 많으시겠어요.,
우리 가족들을 먹여 살려야 하는데 한쪽 팔이 불편해서 일을 할 수가 없어. 너무 괴로워.,돈을 버는데 어려움이 생겨 슬프시군요.,
다들 목적지를 향해 즐겁게 가는 거 같은데 나는 어디로 가야 할지 몰라서 슬프다.,인생의 목표가 확실하지 않아서 슬픔을 느끼시는 것 같아요.,
정신장애가 있어 이혼하고 재혼을 했는데도 남편과 갈등이 심해서 너무 슬퍼.,남편과 갈등이 많아 슬프시겠어요.,
아내가 병이 점점 심해져. 사별이 머지않은 것 같아 너무 슬프구먼.,사별이 가까워져 슬픔을 느끼시는군요.,
학교 친구들이 부모님 얘기를 할 때마다 우리 집은 한부모가정인 게 생각나서 너무 슬퍼.,한부모가정인 것 때문에 종종 슬프군요.,
부모님이 결혼을 반대하셔. 너무 슬퍼.,부모님이 결혼을 반대하셔서 정말 슬프시겠어요.,
학점도 낮고 학교도 좋지 않은데 나 같은 사람 뽑아줄 회사가 있을까? 정말 우울해.,본인의 성적과 스펙 때문에 취업이 되지 않을까 봐 걱정인가 보네요.,
이렇게 나이를 먹고 남편과 이혼을 했어. 지난날들에 대한 허망함과 허탈함이 밀려오네.,함께했던 오랜 시간 만큼 허탈하고 슬프시겠어요.,
부모님이 나를 사랑하는 건 알지만 가끔은 지나치게 조종하려고 하셔서 슬퍼.,부모님의 과도한 간섭 때문에 슬프시군요.,
바쁘게 살다 보니 모임도 없고 옛날 친구들은 연락한 지 오래야. 점점 멀어져서 슬퍼.,사람들과 만남이나 연락이 줄어들고 멀어져서 슬프시군요.,
병원 주방에 취업했는데 무릎 관절이 안 좋아서 일주일 만에 해고당했어. 정말 슬퍼.,몸이 아프다고 해고를 당해서 많이 슬프시겠어요.,
장애가 있다고 일을 받아주는 곳이 없어. 너무 슬프다.,일을 구하기 어려워 슬프시겠어요.,
난 다리가 좀 불편해. 학교 남자애들이 이걸로 자꾸 놀려서 속상하고 슬퍼.,남자 친구들의 놀림으로 아주 속상하고 슬프시군요.,
부모님과 자녀를 돌보기에 월급이 적어 힘이 들고 슬퍼.,부모님과 자녀를 돌보기에 힘이 들어 슬프셨군요.,
나이가 들면서 예후가 좋지 않은 심각한 병에 걸려서 마음이 무거워.,나이가 들면서 심각한 병에 걸려 마음이 무거우시군요.,
나 요즘 친구들에게 따돌림을 받고 있어. 심적으로 너무 힘들고 눈물이 날 정도로 슬퍼.,친구들에게 따돌림을 받아서 많이 힘들고 슬프시군요.,
남자친구 부모님이 우리 부모님이 한 분만 계신다는 걸 알고 나보고 헤어지라고 했어.,마음이 많이 안 좋았겠어요.,
나이가 되면 될수록 주변에 점점 사람이 없어져. 허탈하고 슬프다.,주변 사람들이 점점 없어진다는 생각에 아주 속상하셨겠어요.,
오늘도 학교 친구들이 내 돈을 빼앗아갔어. 너무 힘들어.,학교 친구들에게 돈을 빼앗기셔서 힘드시군요.,
학교에서 친구들에게 괴롭힘을 당하고 있어.,친구들에게 괴롭힘을 당하고 계시는군요.,
내가 차 사고로 잘 움직일 수 없어서 내 딸아이를 잘 돌봐주지 못해서 너무 슬퍼.,사고 때문에 다리가 불편하시군요. 불편한 신체 때문에 따님께 신경을 못 써서 슬프시겠어요.,
우리 아이가 학원에서 과도한 경쟁 때문에 많은 스트레스를 받는 것 같아서 안타까워.,아이가 학업 때문에 스트레스를 받는 것 같아서 슬프시군요.,
결혼까지 했는데 당장 내일을 불안해하며 살아 아내에게 떳떳한 남편이 되지 못해 너무 슬퍼.,아내에게 떳떳한 남편이 되지 못해 슬프시겠어요.,
아이가 너무 과도한 경쟁의 상황에 있는 것 같아서 슬퍼.,과도한 경쟁 상황에서 힘들어할 아이 때문에 슬프시군요.,
둘째가 아파서 챙겨줘야 하는데 편찮으신 어머니가 머리에서 떠나지를 않아.,자녀분도 신경 쓰이고 편찮으신 어머니도 걱정되시는군요.,
내 탓만 하는 남편이 실망스러워.,부부간의 문제로 많이 속상하시겠어요.,
나이가 먹어갈수록 내 얘기를 털어놓을 친구가 없는 것 같아.,줄어드는 대인관계에 속상하시겠어요.,
부모님이 날 너무 과잉보호하셔서 친구들이랑 밖에서 못 놀게 해. 너무 슬퍼,부모님이 친구들과 못 놀게 해서 슬프시군요.,
아내랑 이혼하고 되는 일이 없는 것 같아. 너무 슬퍼.,아내와 이혼하고 되는 일이 없는 것 같아서 슬프시군요.,
어릴 땐 조건 없이 모두 친구였는데 나이가 드니 친구도 나뉘나 봐. 쓸쓸하네.,친구 관계로 많이 쓸쓸하신가 봐요.,
남자친구랑 싸웠어. 이러다가 헤어지게 되면 어쩌지?,남자친구분이랑 싸운 것 때문에 걱정되시는군요.,
가족 중에 나를 이해해 주는 사람이 한 명도 없네. 너무 슬프다.,가족들로부터 이해받지 못하고 느끼셔서 많이 슬프시군요.,
내 가정도 챙겨야 하고 부모님도 챙겨야 하는데 내가 그만큼 못 벌어서 걱정이야.,가족 부양과 경제적 어려움 때문에 걱정이 많으시겠어요.,
내 아이가 유치원에 적응을 못 해. 그럴 때 어떡하면 좋아?,아이가 유치원에 적응을 잘 못 하는 것 때문에 슬프신가 보네요.,
내가 지금 하는 일로 얼마나 더 일할 수 있을까. 아내가 더 이상 내가 믿음직스럽지 않대.,지금의 직업이 전망이 있을까 걱정스러우시군요.,
어렸을 때부터 친했던 이성친구가 요즘 들어 나를 피하는 것 같아.,친구가 피해서 많이 슬프시겠어요.,
내가 신체장애가 있는데 삼십 년 동안같이 살았던 아내가 이혼하자고 했어.,신체장애가 있는데 이혼 문제로 더 힘드시겠어요.,
부모님이 재혼하셨는데 날 싫어하면 어떡하지 너무 불안해.,부모님이 사용자님을 싫어할까 봐 많이 불안하셨군요.,
내가 결혼하고 싶은 여자가 있는데 부모님이 반대가 심해.,결혼 문제라서 더욱 속상하시겠어요.,
회사에서 진급하기 위해 동료들과 경쟁을 하는데 동료들과 경쟁을 해야 한다는 사실이 슬퍼.,동료들과 경쟁을 해야 한다는 사실에 대해 슬퍼하고 계시는군요.,
몸이 아프니까 일할 수 있는 곳도 없네.,일자리와 관련해서 걱정이 있으시군요.,
나이가 드니 돈 벌 곳도 없고 지인들도 다 나를 무시해서 슬퍼.,지인들이 무시하나요? 아주 슬프시겠군요.,
엄마가 이혼한 뒤로 친구들이 아빠 얘기를 할 때마다 기분이 안 좋아져.,부모님의 이혼 후에 겪는 고통 때문에 힘드시겠어요.,
의사 선생님께서 다시는 걷지 못할 수도 있다고 말씀하셨어. 일을 너무 무리해서 한 게 독이 됐대.,안 좋은 소식을 듣게 되어 많이 절망적이시겠어요.,
우울증 때문에 부모님이 너무 걱정하셔서 슬퍼.,부모님께서 우울증을 너무 걱정하셔서 슬프시군요.,
몸도 불편한데 노후 준비를 위한 돈이 부족해서 너무 슬퍼.,경제적으로 힘드셔서 노후 준비가 어려워지셔서 마음이 안 좋으시겠어요.,
