human,system,
내가 나이가 있어서 나를 뽑아주는 곳이 많지 않아. 정말 서글프다.,그런 기분이 들어 속상하시겠어요. 지금 해볼 수 있는 일이 뭐가 있을까요?,
컴퓨터를 다루는 능력에서 차이가 나니까 업무에도 보이는 것 같아. 나이가 들어 슬프네.,정말 속상하시겠어요. 그런 기분에서 벗어나려면 어떻게 해야 할까요?,
사내에서는 이미 내 퇴사가 기정 사실처럼 되어 있어서 더 위축 돼.,지금 상황을 변화시키기 위해서 어떤 걸 시도해볼 수 있을까요?,
앞으로 나는 이 일자리에서 계속 일 할 수 있을까 고민이야.,지금의 상황을 더 좋게 할 수 있는 방법에는 무엇이 있을까요?,
시대의 흐름이 바뀌어서 우리 부품을 쓸 일이 줄어드네.,이 상황을 해결할 수 있는 방안에는 무엇이 있을까요?,
직장에서도 스마트기기 위주로 일을 하니 나의 노하우는 옛날 취급을 받아.,어떻게 하면 이 상황을 해결할 수 있으까요?,
많은 종류를 매번 챙겨 먹는 것도 힘들어.,영양제를 제때 챙겨 먹기 위해서는 어떻게 해야 할까요?,
그동안 잘해드리지 못한 것만 생각이 나고 후회스러워.,후회스러운 생각만 드신다면 어떻게 해야 할까요?,
몸이 아프니까 더 생각이 나는 거 같아.,부모님 생각이 계속 난다면 어떻게 하는 게 좋을까요?,
규칙적으로 생활하면서 건강관리를 해야 좋을까?,건강관리를 어떻게 하는 게 좋을까요?,
잠을 제대로 자고 싶은데 아파서 자다 깨니까 너무 슬퍼.,어깨관절 통증이 어떻게 하면 나아질까요?,
건강 때문에 회사를 퇴직해야 한다니 너무 슬퍼.,지금 기분에서 벗어나기 위해 할 수 있는 일이 뭐가 있을까요?,
그동안 해드린 게 없는 것 같아 더 슬퍼.,남은 시간 동안 무엇을 해드리면 좋을까요?,
내 삶을 제대로 즐긴 게 없는 것 같아 너무 슬퍼.,그럼 이제 어떻게 하면 좋을까요?,
오늘 사고가 났는데 많이 다쳤나 봐. 정도가 심하지 않아야 할 텐데.,지금 무엇을 해볼 수 있을까요?,
진짜로 나보다 어린 사람이 맡게 되면 어떡하지?,다른 사람이 맡게 될까 봐 걱정되는군요. 어떻게 하면 지금의 상황을 바꿀까요?,
나는 맡아서 잘할 수 있는데 위에서는 아닌가 봐.,열심히 할 수 있는데 기회가 주어지지 않는군요. 이럴 땐 어떻게 기회를 잡나요?,
이십 살 이상은 차이 나서 대화하기 꺼려지나 봐.,대화를 회피한다고 생각하는군요. 같이 대화하는 방법이 뭐가 있을까요?,
예전엔 처음 하는 일도 하루 이틀이면 습득했는데 요즘은 일주일도 힘들어.,그래도 회사에 다니는 한 새로운 업무는 계속 익혀야 할 텐데 이럴 때마다 어떻게 해야 할까요?,
아이들이 커 가면서 소비가 점점 느는 일만 남았는데 걱정이 이만저만이 아니야.,그래도 주어진 월급으로 최대한 생활해야 할 텐데 어떻게 해야 할까요?,
언제쯤에 정규직으로 전환을 해주는 걸까?,어떻게 하면 상황을 바꿀 수 있을까요?,
이제 나도 퇴사를 준비해야 하는 시기가 온 걸까?,퇴사를 하면 지금보다 상황이 나아질까요?,
요즘 신입사원들은 나보다 더 많은 걸 알고 할 줄 아는 것도 많은 것 같아서 속상해.,이러한 기분을 어떻게 하면 풀 수 있을까요?,
특별히 잘못한 게 없는 것 같은데 나한테만 왜 그렇게 깐깐한지 모르겠어.,부장님이 유독 깐깐하게 대해서 속상하시군요. 어떻게 하면 부장님과 잘 지낼 수 있을까요?,
아들이랑 어릴 때부터 가서 추억이 많은데 슬퍼.,추억이 담긴 장소였군요. 그래서 맘이 더욱 안 좋을 것 같아요.,
가족들이 매일 울어서 그 모습을 보는 게 힘들어.,가족들에게 힘을 주려면 어떤 방법이 있을까요?,
어릴 적부터 많은 추억이 있는 친구인데. 너무 슬퍼.,친구 생각에 많이 슬프시겠어요. 슬픔을 이겨내기 위한 방법이 있을까요?,
나 홀로 앞으로 살아갈 날들 생각에 너무 슬프고 괴로워.,많이 슬프고 괴로우시겠어요. 이 감정을 극복할 방법이 어떤 게 있을까요?,
정말 믿었던 친구인데. 돈을 떼먹고 도망가니 너무 슬퍼.,많이 슬프시겠어요. 슬픔을 극복하기 위해 어떻게 해야 할까요?,
손자에게 그런 모습을 보인 것도 비참하고 마음이 안 좋아.,비참하고 안 좋은 마음을 해결하려면 어떻게 해야 할까요?,
사람들에게 피해가 갈까 봐 그게 가장 걱정이야.,어떻게 하면 상황이 좀 나아질까요?,
응. 몸이 불편한 것도 힘들지만 대화 상대가 없는 것도 허전하네.,이 상황을 해소하기 위해 어떻게 해야 할까요?,
나도 이렇게 믿기 힘든데 아내는 지금 얼마나 힘들까?,지금 이 상황을 어떻게 해결하실 건가요?,
자식들도 말이 없고 나만 눈치를 보게 돼.,상황을 변화시키기 위해서 어떤 걸 시도해볼 수 있을까요?,
그러니까 말이야. 마주할 때마다 내가 죄인인 기분이야.,이를 해결하려면 어떻게 해야 할까요?,
자리를 양보받았는데 기쁘진 않고 오히려 슬픈 기분만 들어.,몸은 편하지만 나이든 사람으로 보여지니 슬프셨군요.,
돈이 많았을 때는 사람들이 귀찮을 정도로 들러붙었는데 이제 그러질 않으니 너무 슬퍼.,지금 기분에서 벗어나기 위해 뭔가 할 수 있는 게 있을까요?,
그들은 다 잘났는데 나는 자랑할 게 하나도 없어서 서러워.,많이 속상하시겠어요. 지금의 기분에서 벗어나기 위해 무언가 할 수 있는 것이 있을까요?,
나도 나름대로 열심히 하고 있는데 정말 서러워.,마음이 무척 괴로우시겠어요. 현재의 감정에서 벗어나기 위해 무엇을 하면 좋을까요?,
앞으로 계속 이렇게 일만 하면서 살아야 하나 생각하다 보니 눈물이 났어.,마음이 아프셨군요. 어떻게 하면 기분이 나아질까요?,
지금 내 재정 상황도 그렇고 점점 아픈 곳도 많아져서 자식들에게 부담을 줄 것 같아.,재정 상황도 안 좋고 몸도 점점 안 좋아지고 있어 힘드시군요. 어떻게 하면 좋을까요?,
나름대로 열심히 살아왔는데 노후 계획은 생각도 못하고 빚만 지고 있네.,열심히 살았지만 아직도 빚이 있는 현실에 슬퍼하고 계시는군요. 많이 힘드시겠어요.,
평생을 일했는데 제대로 모아둔 돈 하나 없는 게 허무해.,경제적 상황이 좋지 않아 슬프시군요. 어떻게 해야 지금 이 기분이 나아질까요?,
노후 준비를 끝내고 은퇴를 해야 했는데 마음 먹은 대로 할 수 없는 부분이라 아쉽네.,지금 상황에서 어떻게 하는 것이 좋을까요?,
이제 마음 편히 살았으면 좋겠는데 말이야.,친구를 위해서 어떻게 하면 좋을까요?,
나는 이제 뭐하고 살아야 할지도 잘 모르겠는걸.,이제 어떻게 살아야 할까요?,
응. 가끔은 언제까지 이렇게 살아야 하나 싶어.,상황을 개선하기 위해 어떻게 해야 할까요?,
나중에 부모 원망할까 두렵기도 하고. 더 잘해줄 걸 그랬어.,어떻게 하면 상황이 나아질까요?,
자식이 많아서 호강하겠다는 말을 들었었는데 늙어보니 자식들이 나를 외면해서 슬퍼.,이 감정에서 벗어나기 위해서 어떻게 하면 좋을까요?,
이젠 내 병원비조차 보내주질 않으니 눈물이 나.,이 상황에서 벗어나기 위해 어떻게 하면 좋을까요?,
보청기를 살 돈이 없어서 소리를 잘 들을 방법이 없어. 나도 답답하고 슬퍼서 눈물이 났어.,이 감정에서 벗어나기 위해 할 수 있는 일이 있을까요?,
병과 나이 탓에 일자리를 구할 수가 없어 생활고에 시달리느라 더 무기력하고 슬퍼.,어떤 것이 슬픔을 덜 느끼는 데 도움이 될까요?,
혹시 건강이 더 많이 악화되면 어떡하지.,상황을 극복할 방법으로 뭐뭐가 있을까요?,
혹시라도 건강이 계속 나빠져 남편과의 행복했던 삶이 깨지면 어떡하지.,지금 기분이 나아지기 위해 할수 있는 일이 있을까요?,
딸도 세상을 떠난다면 나는 정말 삶의 의지를 상실하고 말거야.,정말 상실감이 크실 것 같아요. 이 상황을 잘 극복하기 위해 뭘 할 수 있을까요?,
이런 날이 올 거라는 생각을 해본 적이 없었는데 앞으로 어찌할까 너무 고민돼.,미래에 대한 고민으로 마음이 많이 불안하실 것 같아요. 상황이 나아지기 위해 할 수 있는 일이 있을까요?,
몸이 아파 손주도 마음대로 못 안아보는 내 처지가 너무 마음이 아파.,마음이 아프셨군요. 지금의 기분에서 벗어나기 위해 무언가 할 수 있는 것은 있을까요?,
평소에 내가 부르면 듣지도 않다가 용돈 이야기가 나와야 나를 바라보며 이야기를 들어.,어떻게 하면 용돈얘기에만 반응하는 손주들과의 상황을 변화시킬 수 있을까요?,
내가 젊었을 때 연락이 끊긴 친구였는데 세상을 떠났다니 믿기지가 않아. 마음이 너무 아파.,마음이 아프셨군요. 이 상황에서 할 수 있는 게 어떤 것이 있을까요?,
나이를 먹고 몸이 아파 돌봐줄 사람이 필요해서 요양시설에 가고 싶은데 금액이 너무 비싸.,요양시설에 가고싶지만 너무 비싸서 고민되는 상황에서 할 수 있는 게 어떤 것이 있을까요?,
젊을 때는 그 사람들이 다 나를 부러워했는데 이제는 반대가 되었네.,예전에는 사람들이 사용자님을 부러워 했는데 반대가 되었군요.,
사람들이 내가 재정적으로 힘들다는 걸 안다는 게 슬프고 비참해.,슬프고 비참한 기분이 드시는군요. 어떻게 하면 기분이 더 나아질 수 있을까요?,
경제적으로 너무 힘든데 내색하긴 싫어.,지금 감정에서 벗어나기 위해서 무엇을 할 수 있을까요?,
걱정해주는 건 고맙지만 동정을 받을 때마다 자존감이 떨어져.,무엇이 지금 상황을 더 낫게 할 수 있을까요?,
나만 취직이 안 되는 것 같아서 짜증 나고 나 자신이 미워.,어떻게 하면 지금 감정이 더 나아질 수 있을까요?,
내가 생각한 것보다 침수피해가 크더라고. 생활 터전을 잃은 지역 분들의 슬픈 표정을 보니 나도 마음이 무겁더라고.,지역분들의 슬픈 표정을 보니 마음이 아프셨군요.,
다 내 잘못이야. 진심으로 사과하면 나아질까?,친구분께 사과한다면 어떤 말을 하실 것 같으세요?,
자꾸 대화를 피하는 것 같아 마음 한 켠이 너무 아파.,따님과의 관계로 마음이 편치 않으시군요. 평소 관계를 개선하기 위해 하시는 행동이 있으신가요?,
친구를 모르고 넘어뜨렸는데 따돌림을 당하게 돼서 너무 슬퍼.,따돌림을 당하게 돼서 슬프시군요. 좋은 방법이 있을까요?,
가장 친한 친구가 폐암 말기래.,친한 친구의 암 소식에 기분이 좋지 않으시군요.,
특히 올해는 마지막 이십 대 생일이라 더 아쉽고 슬퍼.,올해는 더 슬프시군요. 좋은 방법이 있을까요?,
친구가 계속 나를 힘들게 하고 거짓말하잖아. 너무 실망해서 앞으로 연락하지 말라고 했어.,친구가 너무 힘들게 해서 절교를 하셨군요. 슬픈 마음을 진정시킬 좋은 방법이 있을까요?,
그 일이 있고 난 뒤에 배드민턴을 안친 지 오래됐네. 내일은 배드민턴이라도 치러 나가봐야겠어.,내일 배드민턴을 치려고 하시는군요.,
난 그 친구를 그 누구보다 아끼거든. 행복했으면 좋겠다고 생각했는데.,아끼는 친구가 아파서 슬프시군요. 어떻게 하면 슬픈 기분을 없앨 수 있을까요?,
응. 믿었던 친구인데 너무 실망이야.,믿었던 친구에게 배신을 당해 슬프시군요.,
친구가 울지 않을 때까지 옆에서 위로해 주려고.,친구를 위로해줄 생각이시군요.,
사소한 말로 싸우기 시작했는데 일이 너무 커져 버렸어. 나는 그렇게까지 하고 싶지 않았는데.,싸움이 커져 버려 속상하시군요.,
애인이 멀리 이사를 하게 되어 만나기 어렵게 되었어. 너무 슬퍼.,애인과 만나기 어려워져서 헤어지셨군요.,
멀리 출장을 가게 되어 혼자 아이를 낳게 될 것 같아. 우려하던 일이 생겨서 너무 슬퍼.,혼자 아이를 낳게 되어서 슬프시군요.,
응. 이번에 나는 상대가 마음에 들어서 꼭 잘 됐으면 했는데 그쪽에서는 아니었나 봐.,소개팅 결과가 좋지 않아 아주 속상하시겠어요.,
코로나 때문에 못 만나고 있어. 코로나가 빨리 끝났으면 좋겠어.,코로나가 빨리 끝났으면 좋겠다고 생각하시는군요.,
입덧이 너무 심해서 음식을 먹을 수가 없어. 속도 계속 안 좋고.,입덧이 심해서 힘드시군요.,
베이비박스에 관한 기사였는데 아기들이 버려진다니 너무 슬프더라고.,베이비박스에 관한 기사를 보고 슬프셨군요. 어떻게 하면 슬픈 감정을 없앨 수 있을까요?,
일이 계속 잘 안 풀리니까 힘도 빠지고 우울하고 그래.,일이 잘 풀리지 않아 속상하고 우울하시군요. 어떻게 하면 현재의 슬럼프를 극복할 수 있을까요?,
이민을 가게 되면 앞으로는 만나지 못할 텐데 친구가 보고 싶고 외로울 거 같아.,친구가 이민을 가면 외로워질 것 같으시군요.,
그 소식을 듣고 많이 놀랐어. 그 친구와 친한 동료들은 더욱 실의에 잠겨 있어.,직장동료분이 돌아가신 사실이 주위를 많이 슬프게 하는 것 같아요.,
몇 안되는 가까운 친구였는데 너무 속상한 기분이야.,가까운 친구였어서 더 속상하시군요.,
딸들한테 속이고 막내 아들한테 내 재산을 다 줬어. 전화하고 싶은데 용기가 나질 않네.,전화하고 싶은 용기를 어떻게 해야 낼 수 있을까요?,
다시 과거로 돌아갔으면 좋겠어 쓸쓸해.,지금 이 기분에서 벗어나려면 어떻게 하는 게 좋을까요?,
누구도 나를 관심있게 보지 않아서 너무 슬프고 고독해. 이런 상황을 벗어나고 싶어.,슬프고 고독한 상황을 벗어나기 위해 지금 내가 어떤 일을 할 수 있을까요?,
자식들 어릴 때는 애지중지 키웠었는데 그만큼 대접을 못 받으니 더 속상한 거 같아.,어떻게 하면 속상한 마음이 조금이라도 누그러질까요?,
매일매일이 너무 외롭고 슬퍼.,외롭고 슬픈 감정에서 벗어나기 위해 지금 어떤 것을 해볼 수 있을까요?,
연고도 없고 다 달라서 적응하기 힘든데 되려 짜증을 내니 슬프고 화가 나.,어떻게 한다면 지금 기분보다 더 나아질 수가 있을까요?,
자식들이 나를 믿지 못하는 것 같아서 속상해.,어떻게 하면 속상한 마음을 조금이라도 달랠 수 있을까요?,
나한테 가장 소중한 친구였는데.,지금 OO님이 할 수 있는 일은 무엇인가요?,
옆집 김 씨네 딸도 우리 애랑 동갑인데 벌써 취업했다는데 걱정이야.,다른 집 아이에 비해 취업이 늦는 아들이 걱정스러우시겠어요.,
평생 착하게 지낸 딸에게 혼수도 못해 주는 부모라니 정말 미안해.,착한 딸에게 혼수를 해 주지 못해 미안하시군요. 어떻게 하면 이 상황을 해결할 수 있을까요?,
이제 슬슬 퇴직도 생각해야 할 나인데 어찌해야 할지 모르겠어.,어떻게 해야 당신의 상황이 좀 더 나아질까요?,
살갑게 다가와서 내심 반가웠는데 이런 꿍꿍이가 있었다니! 세상에 믿을 사람이 없어.,이런 상황이 반복되지 않도록 하려면 어떻게 할 수 있을까요?,
지금 바로 해서 내야 돼.,어떻게 하면 빠른 시간 안에 효율적으로 일을 해낼 수 있을까요?,
저 인간 저 버릇 어떻게 고쳐줄지 고민 중이야.,어떻게 하면 팀장이 자신의 일을 사용자님에게 안 떠넘길까요?,
그래서 종종 사람들과의 관계에서 트러블이 생겨.,어떻게 하면 그런 부분을 고칠 수 있을까요?,
너무 미안해서 연락을 계속하는데 친구가 연락을 받지 않아서 슬퍼.,친구에게 많이 미안하신가 봐요. 친구 분과 연락이 닿을 수 있는 방법이 있으신가요?,
그러게 나는 정말 열심히 준비한 건데.,앞으로 어떻게 하실 계획이세요?,
취업이 왜 이렇게 힘들까 모르겠어.,어떻게 해야 상황을 해결할 수 있을까요?,
나도 취업을 얼른 해야 하는데 문제야.,어떻게 해야 상황을 해결할 수 있을까요?,
우리한테 내색도 안하고 혼자 힘드셨을 거야.,어떻게 하면 마음이 나아질까요?,
물가는 오르고 큰일이야.,어떻게 해야 지금의 상황이 나아질까요?,
이직하려 노력 중인데 연락 오는 곳이 없어.,이직을 위해 어떤 준비가 필요한가요?,
코로나로 인해 경기가 안 좋아서 회사도 어려운가 봐.,회사가 어렵군요! 좋은 방법이 없을까요?,
노인연금이 늘어나면 좋겠어.,노인연금이 늘어나려면 지금 상황에서 어떻게 하는 게 좋을까요?,
자식들 도움 없이는 월세도 못 내겠어.,마음이 힘드시겠어요. 어떻게 하면 월세를 스스로 낼 수 있을까요?,
나보고 돈이 없대.,돈이 없다 해도 무시할 이유는 안 돼요. 기분 나쁜 일을 어떻게 하면 좋을까요?,
열심히 일해서 번 돈은 다 어디로 갔을까? 정말 슬프고 우울하다.,기분이 울적할 때에 어떤 것을 하는 게 좋을까요?,
버는 돈보다 앞으로 나가는 돈이 더 많을 것을 생각하니 골치가 아프네.,어떻게 하면 지혜롭게 자금을 관리할 수 있을까요?,
마음만은 모든 것을 다 해주고 싶었는데 돈은 마음처럼 쉽게 벌어지지 않더라고.,아들에게 미안한 마음을 표현하신 적이 있으신가요?,
이제는 조금만 움직여도 쉽게 지쳐버려.,체력 증진을 위한 계획을 세워보셨나요?,
벌써 내일모레 팔십 세야. 하고 싶었던 것도 많았는데 슬프네.,하시고 싶으셨던 게 무엇이셨나요? ,
대학 졸업후 삼성 다니다가 목사님 사모님 한다고 사표내고 스트레스 받아서 수술도했어.,참 어머니로써 마음이 아프시겠네요.,
아등바등 살았는데 나이 들어 이게 다 소용없다는 생각이 들어.,네 다 소용없다는 생각이 들 수 있을 것 같아요. 주변 사람들에게 이런 마음을 이야기해보셨어요?,
이제 그만 정리를 좀 하고 마음이 편하게 사는 게 좋겠어. ,너무 많은 일을 하시면 힘드실 것 같아요. 조금씩 정리를 해나가고 여유를 찾는 게 좋겠네요.,
활동적이지 못 한 성격이여서 인지 대인관계가 많이 좁아지고 있는 것 같아 걱정이야.,대인관계의 너비가 양에 차지 않아 불만족스러운가 봐요.,
보고서를 작성하면 읽어보지도 않고 다시 해오라고 하셔. 그냥 마음에 안 드신대.,답답하셔서 더 힘드실 거 같아요. 과장님이 보지도 않으시고 반대를 하셔서 슬프시겠어요.,
아이를 낳고 친정엄마가 나를 힘들게 키우셨겠다는 생각이 나서 눈물이 흘렀어.,친정엄마가 생각이 나서 슬프셨군요.,
분명 다들 약속이 있다고 했는데 저를 빼고 밥을 먹는걸 봤어요. 저를 보고 놀라더라고요.,친구들이 일부러 거짓말을 해서 속상하군요. ,
내가 원하는 진로랑 맞지 않는 것 같아.,많이 힘드실 것 같아요. 이 상황을 어떻게 극복해야 할까요?,
정말 귀하게 키웠거든. 미국 가면 혼자인데 가서 아플까봐 걱정이야. ,귀하게 키운 따님이 타지에서 아플까봐 걱정되시는 군요.,
친구를 만나서 술한잔 해야겠어.,친구랑 술 한자 하면서 슬픈 마음을 달래여 하시는 군요.,
나도 언제 죽을지 모르니 마음의 준비를 하고 있으려고해. 그러면 죽음이 덜 무섭게 느껴지지 않을까?,마음의 준비를 단단히 하는 것으로 죽음의 공포를 이겨내려 하시는 군요.,
친구를 만나 수다나 잔뜩 떨어야겠어.,기분전환을 위해 친구분을 대화를 할 계획이시군요.,
아들 장가를 보내야하니 또다른 일을 찾아봐야 할 것 같아.,자녀분 결혼자금을 위해 은퇴후에도 계속 일을 하실 계획이시군요.,
다음 승진시험을 위해 다시 열심히 일하며 준비해야지.,열심히 일하며 공부하는 것으로 다음 승진시험을 준비하려고 하시는 군요.,
아들이 좋아하는 음식을 차려주면서 먼저 다가가보려고.,아드님님과의 관계회복을 위해 아드님이 좋아하는 음식을 차려주면서 먼저 다가가실 계획이시군요.,
부모님께 나를 생각해서 다시한번 생각해보라고 말씀드려 볼꺼야.,부모님께 말씀드리는 것으로 이혼을 막아보려 하시는 군요.,
맞아.나도 지병이 있어서 언제 갈지 몰라 슬퍼.,지병으로 언제 생을 마감하실 지 몰라 슬픈 마음이 드시는 군요.,
일단 저녁에 소주나 한잔 해야겠어.,소주 한자 마시는 것으로 안좋은 마음을 달래려 하시는 군요.,
지금 남은 사람에게라도 잘 해야겠어.,현재 주변에 계신 분들께 잘 해야겠다고 생각하시는군요.,
좀 더 잘 해서 보내야 하는데 왜 이리 해 놓은 게 없는지 몰라.,잘 해서 시집보내고 싶은데 도움을 주기 어렵다고 느껴져서 정말 힘드시겠어요.,
은퇴한 내친구가 귀농해서 잘살고 있는줄 알았는데 먼저 저세상으로 가서 울적해.,은퇴한 내친구가 먼저 세상을 떠나서 슬프시군요.,
세월이 많이 흐른것도 슬픈데 친구들도 가버리고 사는게 너무 슬퍼.,친구분들이 떠나서 많이 슬프시군요.,
지금까지 회사 다니면서 못했던 걸 전부 해봐야지. 취미도 만들꺼야.,회사 다니면서 못해왔던 것들을 하며 은퇴후의 생활을 보내려고 하시는군요.,
가족끼리 함께 여행을 자주 가도록 할거야.,가족에게 잘해주지 못해서 슬픈 마음을 가족여행을통해 극복하려고 하시는군요.,
그래서 영양제라도 선물해줄 거야.,친구의 건강이 걱정되서 영양제를 선물하려고 하시는군요.,
삼십년을 넘게 산 곳이야. 애들을 여기서 낳고 다 키웠는데 이사가려니 왠지 슬프네.,삼십년을 넘게 살았던 집을 떠나려고 하니 슬프시군요.,
엄마랑 아빠 이혼 못하게 말려야겠어.,엄마 아빠가 이혼을 못하도록 막으려고 하시는군요.,
언니 성격이 밝은데 어두워졌어. 너무 슬퍼.,밝았던 언니가 따돌림을 당해서 성격이 바뀌었군요.,
집가서 자고 생각할래.,네. 때로 한 숨 자는 게 도움이 될 때도 있지요.,
같은 학교가 아니었거든. 힘들다고 할 때 진작 신고했어야 했는데.,같은 학교가 아니어서 친구를 도와주지 못한 것이 안타까우시겠네요.,
수능이 다가오니 내 공부 방식이 맘에 들지 않으신가봐. 그래서 너무 슬퍼.,수능 시험이 다가오는데 공부 방식에 대해 어머니와 의견 충돌이 있어 고민이시군요.,
가족과 대화하려고 해.,가족과의 대화로 슬픔을 극복할 생각이시군요.,
내 친구가 폭력을 당하는 데도 보고만 있어야 하는 내가 너무 싫더라.,폭력을 볼 수 밖에 없는 상황 때문에 슬프시군요.,
병원갔더니 폐결핵이래. 내가 대신 아프면 좋겠어.,따님의 건강으로 마음이 아프시군요.,
응. 그런데 육십 구 점을 맞아버렸어.,아쉽게 피자를 먹지 못해 속상하시겠네요.,
응. 학교에 가고싶지도 않아. 어떻게 해야할지 모르겠어.,친구 문제로 학교 생활이 어려워 많이 속상하시겠어요.,
그래도 포기하지 않고 열심히 해봐야지.,성적이 잘 나오지 않았지만 끝까지 노력하실 생각이군요.,
내가 먼저 가서 말 좀 해줘야 할 것 같아.,따돌림 당하는 친구에게 다가가 대화하실 생각이군요.,
부모님 모두 어릴 때 돌아가셨거든.,어린 나이에 부모님을 잃으셔서 가정을 생각하시면 슬프시군요.,
다들 한 가지씩 재능이 있는데 난 아직 못 찾았어.,아직 재능을 찾지 못해 고민이시군요.,
왕래하는 사람이 없으니까. 혼자서 외롭게 떠나면 얼마나 슬플까 생각 중이야.,혼자 외롭게 떠날까봐 걱정하시는 거군요.,
회사 다니면서 마음 맞는 사람 찾기 힘든데 앞으로 회사 다니기 힘들 것 같아.,친한 동료의 퇴사로 앞으로 회사 다니기 힘들 것 같다 생각하시는 군요.,
아들이 나를 싫어해.,아드님이 싫어하셔서 슬프시군요.,
노후준비라도 충분히 되어 있으면 덜 걱정될 것 같은데.,노후준비가 되어있으면 은퇴준비에 덜 걱정될거라 생각하시는군요.,
부모님이 이혼하실 것 같아.,부모님이 이혼하실 것 같아 슬프시군요.,
내가 먼저 손 내밀어 연락을 해볼까해.,먼저 연락하는 방법을 선택하셨군요.,
