human,system
맞아. 노년엔 여행 가고 여기 건물은 세주고 시골에 넓은 정원 지어 살 거라고 말하던 동창 꼴 보기 싫어.,동창들의 여유로운 모습과 자랑에 기분이 좋지 않으시군요.
그런데 그게 쉽지 않단 말이지. 역시 내가 부족한 부분이 있나 봐.,자질이 부족하다고 느껴 슬퍼하고 계시는군요. 이 부분에 대해 도움을 요청할 수 있는 사람이 있을까요?
남편에게 얘기하면 조금 줄여볼 수는 있을 것 같은데 처음부터 한 수 접고 들어가는 것 같아서 자존심도 상해.,대화를 통해 서로의 생각과 상황을 맞추어 가면서 합의점을 찾으시길 바랄게요.
그러고 보니 이 부분에 대해 진지한 이야기를 한 적은 없는 것 같아. 먼저 많은 대화를 나눠봐야겠어.,남자친구와 진지한 이야기를 통해 기분이 조금 풀리길 바랄게요.
이렇게 우울할 땐 여행을 가면 기분이 좀 풀려. 혼자 기차여행이라도 다녀오려고.,우울한 기분을 풀기 위해 여행을 가려고 생각하시는군요. 여행을 통해 나의 기분이 나아졌으면 좋겠네요.
그런 생각은 못 했던 것 같아. 나는 계속 비교만 해서 열등감을 느꼈거든.,저와의 대화가 사용자님의 직장 생활에도 도움이 되었으면 좋겠어요.
딱히. 모임에 나가보면 노후자금 정도에 따라서 어깨에 힘이 다르게 보이니 열등감이 생겨.,주변 사람들은 잘 준비하고 계시는가 보군요.
아직 건강하니까 일자리를 찾아서 취업해서 최선을 다해서 노력하기로 마음먹었어. ,좋은 생각을 하셨으니 충분히 극복하실 수 있을 것입니다.
정말 그럴까? 다시 기운 내서 도전해봐야겠어.,기운 내서?도전하는 그 의지 제가 응원할게요.
그런데도?내게 정말 잘해줘서 나도 최선을?다하려고 해.,서로 잘해주고 사랑해 주는 모습 멋져요. 응원해요.
나보다 뛰어난 애들을 보고 있으면 더?분발해야겠다고?생각이 들어.,그런 의욕이 있으시니 잘 되실 거예요. 응원할게요.
나한테 문제가 뭔지 더 고민해봐야겠어.,문제가 무엇인지 고민해 보려고 하시는군요.
응. 자꾸 내가 부족해 보여서 남자친구가 다른 여자를 만날까 봐 무서워.,남자친구가 다른 사람에게 갈까 봐 걱정이군요.
다음 시험은 내가 더 노력해서 걔를 이겨버릴 거야.,노력을 통해 경쟁에서 이기실 계획이시군요.
취업이 안 되는 이상 방법은 없어.,함께 있어 줄 사람이 있었으면 좋겠네요.
글쎄 생각해 본 적 없는데.,자신만의 강점을 찾길 바라요.
난 도대체 언제 되는 거냐.,기약 없이 준비하는 것 같아 더 힘드시겠어요.
그러면 자신감이 생길 것 같아.,다 자기에게 맞는 인연이 있대요.
이제 남들이랑 비교 안 할래. 나한테만 집중하는 거야.,좋은 생각이에요. 항상 응원하고 있을게요.
취업 카페에 가입해서 당장 시작할래.,취업 카페에서 도움을 받아 원하시는 결과를 얻으시길 바라요.
나도 적어도 세 명은 낳고 싶어.,이 문제를 두고 같이 상의할 수 있는 사람이 곁에 있으면 좋겠네요.
그런 것 같아. 난 좀 그런 면이 있는 것 같아서 비교당하는 것 같아.,지금 함께 있어 줄 누군가가 있었으면 좋겠네요.
내가 잘 할 수 있는 것을 찾을 거야.,잘 할 수 있는 것을 찾아 열등감을 극복할 생각이시군요.
나도 열심히 해서 얼른 승진해야지.,승진을 위해 열심히 하실 생각이시군요.
나도 열심히 해서 능력자가 될 거야.,열심히 노력하실 예정이시군요.
나도 좀 더 열심히 하는 모습을 보이도록 하려고.,좀 더 열심히 하려고 결심하셨군요.
응 너무 속상해. 그래도 계속 노력은 해 봐야지.,노력해 보기로 선택하셨군요. 응원할게요.
솔직히 이런 내 모습이 싫긴 하지만 속상한 건 어쩔 수가 없는걸.,그런 상황이라면 속상한 건 어쩔 수 없을 거예요.
응. 그래도 다시 힘내야지.,네. 다시 힘을 내시길 바라요.
그 친구도 열심히 한 거니까 나도 더 열심히 해야겠어.,친구를 보고 더 열심히 하기로 마음먹으셨군요.
마음가짐을 바꿔야겠지. 나를 사랑하는 쪽으로.,마음가짐을 바꿔야 한다고 생각하시는군요.
영화 보는 사교 모임에 들어갈까 해.,영화 모임에 가입하려고 하시는군요.
재수 학원에 가서 진지하게 재수할지 상담을 받아봐야겠어.,재수 학원에 가서 상담을 받아보는 것을 선택하셨군요.
너무 속상하고 화가 나.,어떤 중요한 일이었어요?
세상은 너무 불공평한 거 같아.,친구가 화가 많이 났나요?
맞아. 내가 많이 부족해서 그런 건가 싶어.,친구들은 기뻐할 거예요.
식단 조절을 같이 해야겠어.,힘내세요. 성공하시길 바랄게요.
그런 거 같아. 괜히 나 때문에 공부를 못 하나 하는 생각도 들고.,아이의 성적 부진에 대한 죄책감을 느끼고 계시는군요.
말할 때도 자꾸 움츠러들고.,치아에 대한 콤플렉스 때문에 스트레스가 많으시겠어요.
그런데 그런 사람들을 보면서 열등감이 드는 내 감정은 무엇인지 모르겠어.,인정하고 싶지 않은 사람이 인정받고 본인 자리를 박탈한다고 느끼고 계시네요.
그렇지. 거기는 관리자가 좋아하는 사람들만 앉혀 놨는데 일도 못 하는데 좋은 자리 근무하니 상대적으로 박탈감도 들고 열등감도 들어.,부당한 일로 많이 억울하시겠어요. 
혼자서 잘할 수 있는 걸 찾을 수 있을까?,혼자서 잘할 수 있는 것을 찾으려고 하시는군요.
아니. 남자 친구가 자존심 상해할 것 같아서 말을 못 했어.,남자 친구의 자존심이 상할 것 같아 얘기해 보지는 못하시는 거군요.
운동도 해서 기분 전환도 해야겠네.,네 운동을 통한 기분 전환도 좋으시겠네요.
응. 이런 마음을 가지는 내가 싫어.,본인도 그런 마음을 가지고 있는 게 힘들게 느껴지시는 거군요.
말 잘하는 방법에 대한 내용이 있는 책을 읽는 중이야.,화법 능력 향상에 도움이 되는 책을 읽는 중이시군요.
모르겠네. 내 업무에 집중할 수 있어 좋기는 한데 열등감이 느껴져.,업무에 집중할 수 있다는 점에서는 긍정적이시군요.
나도 열심히 일했다고 생각하는데. 아무래도 상사에게 승진의 기준을 다시 한번 물어봐야겠어.,열심히 일하셨던 만큼 상사분과의 이야기에서 좋은 성과가 나오기를 바라요.
이번엔 식단 조절과 같이해 볼 생각이야.,식단 조절과 헬스를 병행하실 생각이시군요.
응. 이럴 때는 도대체 어떻게 해야 하는 건지.,이렇게 어떻게 해야 할지 모르겠을 때 누군가가 함께 있어 주면 좋겠네요.
친구 남자친구는 통이 커서 밥값을 턱턱 내더라고. 내 남자친구는 아끼기만 바쁘고.,남자친구의 행동에 기분이 상하셨겠어요.
응. 너무 비교되고 내가 한심해 보여.,스스로가 초라해 보이다니 많이 당황스러우시겠어요. 
뭘 해도 나아지지 않을 거야. 걔를 생각하면 항상 내가 하찮게 느껴져.,많이 괴로우시겠어요.
내가 원하는 직장에 넣고 있는데 자꾸 떨어져서 열등감이 크게 드네.,면접도 잘 안 되는데 다른 사람들과 비교도 되어서 기분이 속상하시겠어요.
응. 스스로 자신감이 없어.,나와는 다르게 모두 취업이 되었다면 그런 기분이 들 수 있을 것 같아요.
난 글렀어. 어떤 남자도 날 좋아하지 않을 거야.,자신감을 많이 잃으신 모양이네요.
다 대기업에 갔는데 나만 중소기업이거든.,다른 사람보다 좋은 기업에 가지 못했다는 생각에 열등감을 느끼시는 거군요.
팀 동료들과 술 마시면서 이야기 해야겠다.,동료들과의 회식으로 기분이 나아졌으면 좋겠네요.
내 자신을 더 멋진 사람이 될 수 있도록 자기 계발에 매진해야겠어.,지금의 다짐으로 자기계발에 집중하시길 바라요.
맛있는 음식을 사와서 좋은 영화를 보며 스트레스를 날려버려야겠어.,여가생활로 기분이 풀렸으면 좋겠어요.
친구들과 수다를 통해 기분 전환을 해야겠어.,친구들과 수다 떨면서 기분전환하시길 바라요.
너무 속상해서 속으로 계속 삭혔어.,주위에 지금의 기분을 나눌 수 있는 사람이 있었으면 좋겠어요.
친구들을 만나서 그 기업 욕을 엄청 해야겠어.,친구들과의 수다로 기분이 나아졌으면 좋겠어요.
그래도 힘을 내서 털어버리고 다음 단계를 준비해야지.,지금 다짐으로 상황이 나아지길 바라요.
모르겠어. 혼자서 술이라도 마셔야겠다.,지금의 속상함을 나눌 수 있는 누군가가 있었으면 좋겠네요.
연봉을 많이 받을 수 있도록 열심히 해야겠지.,노력을 통해 연봉을 올려서 자신감이 생기길 바라요.
같이 응원했던 사람들과 다독여주면서 밥이나 먹어야겠어.,사람들과 맛있는 식사하시면서 기분이 나아졌으면 좋겠네요.
마음을 다잡고 진심으로 축하해줘야겠어.,진심 어린 축하를 함으로 기분이 좀 나아지셨으면 좋겠어요.
맞아. 너무 기분이 나빠서 울음이 나올 것 같아.,어떻게 하면 기분이 나아질 수 있을지 아는 사람이 주변에 있었으면 좋겠네요.
이제와서 결혼을 숨기는 건 의미가 없다고 생각해.그냥 현실에 부딪쳐야지,용기를 내셔서 좋은 결과 있으시길 바라요.
내 자신 스스로 부끄럽지 않다고 생각해야지. 그게 잘 안되겠지만 말이야,자신 스스로 부끄럽지 않다고 생각하는 마음으로 이 상황을 잘 극복해 나갔으면 좋겠어요.
언제 이런 편견이 없어질지 모르지만 나서부터 당당해 져야 하는데 그게 쉽지 않지만 노력해야겠지.,자신 스스로 당당해지려고 노력하는 만큼 앞으로 좋은 결과 있으셨으면 좋겠어요.
앞으로 운동도 하고 무슨 일이든 최선을 다해서 자신감 있는 나로 변하려고 해,응원할게요. 좋은 결과 있으시길 바라요.
자신감을 가져야겠지. 내가 부족하다는 생각을 버리고 용기를 낼 거야.,자신감과 용기를 내서 좋은 일 있었으면 좋겠네요.
성 정체성을 인정해야겠지. 그리고 주변사람들의 시선도 이겨내야겠지.,힘드시겠지만 지금의 마음으로 잘 극복해 나가셨으면 좋겠네요.
혹시나 거절당할까 봐 너무 두렵지만 그래도 용기를 내야겠지.,용기를 내서 고백한 만큼 좋은 결과 있으시길 바라요.
일단 계획 세우는 게 중요할 것 같아.,계획 세우기를 통해 진로에 더 가까워지길 바라요.
친구니까 응원해주는 게 맞아.,같은 진로를 향하는 친구와 도움을 주고받길 바라요.
동생을 그대로 인정하고 내 태도를 바꿔야겠어.,더 나은 모습으로 변하기를 바라요.
아내가 건강하다는 사실을 기쁘게 생각해야겠어. 열등감이 안 들도록 말이야.,아내가 건강하다는 사실을 기쁘게 받아 들리려고 하시는군요.
앞으로 외모에 신경 좀 써야겠어. 그리고 딸에게 서운하다고 솔직히 말해야겠어.,따님께 서운한 마음을 전하려고 하시는군요.
나 자신을 사랑하고 남을 의식하지 말아야겠어.,스스로를 더 사랑하려고 하시는군요.
관절염이 낫도록 노력해야겠어.,빠른 시일 내에 관절염이 나으시면 좋겠어요.
남을 의식하지 말고 딸아이에게 괜찮다고 하며 더 챙겨줘야겠어.,따님을 더 사랑하려고 하시는군요.
남편에게 내가 느끼는 감정을 솔직하게 말해 볼래.,남편분께 속상한 마음을 솔직하게 전하려고 하시는군요.
남편과 진지하게 대화를 나눠 볼래.,남편분과 대화를 시도해 보려고 하시는군요.
남편보다 잘하는 걸 찾아서 각자 잘하는 분야가 있는 거라 생각할래.,남편보다 잘하는 걸 찾으려고 하시는군요.
나라도 괜찮다고 학벌이 다가 아니라고 토닥여줄래.,아드님을 위로하려고 하시는군요.
당장 딸애 본인도 속상하겠지? 괜찮다고 기다릴 수 있다고 해줄래.,따님을 위로하려고 하시는군요.
남편이랑 다 터놓고 얘기해 보는 게 좋을 것 같아.,꼭 남편 분과 대화로 잘 푸시길 바라요.
연희 엄마랑 친해져서 그런 정보들은 어디서 구했는지 물어볼래.,다른 학부모에게 직접 물어 보려고 하시는군요.
내가 살면서 대학을 못 나와 힘들었다고 너라도 꼭 들어가라고 말할래.,따님에게 진심으로 말해 보려고 하시는군요.
남편에게 속상하다고 말해야겠어.,남편분께 속상한 마음을 전하려고 하시는군요.
열심히 해서 다른 과목의 성적을 올려볼래.,공부를 열심히 하려고 하시는군요.
일단 선생님과 얘기를 해봐야 할 거 같아.,선생님께 지금의 마음을 말하려고 하시는군요.
가족들과 먼저 한번 얘기해보려고 해.,가족과 잘 얘기해서 지금 상황이 잘 해결됐으면 좋겠어요.
무섭지만 일단 선생님에게 말해볼래.,선생님과 상의를 해 보려고 하시는군요.
가만히 있지 않고 괴롭히는 친구에게 저항이라도 해봐야 할 거 같아.,괴롭히는 친구들에게 맞서 보려고 하시는군요.
건강을 더 잘 챙겨서 나도 혼자 여가 활동을 즐길 수 있으면 좋겠어.,혼자서도 여가 활동을 즐기실 수 있을 만큼 건강이 회복되면 좋겠어요.
앞으로라도 허리 치료를 잘 받아서 혼자 운동을 할 수 있도록 노력할 거야.,빨리 건강이 회복되어 다른 분들처럼 활기 넘치게 다니시면 좋겠어요.
지금부터라도 조금씩 움직여서 건강이 회복되면 언젠가는 다른 사람들과 활발하게 어울리고 싶어.,빨리 건강이 회복되어 다른 분들처럼 활발히 다니시면 좋겠어요.
손주들에게 맛있는 거라도 해주면 마음이 좀 나아질 것 같아.,건강도 회복되고 손주들과 좋은 시간도 보내셔서 마음의 어려움이 사라지면 좋겠어요.
언니를 만나서 여행에 대한 얘기도 듣고 건강을 조금씩 회복하면 좋겠어.,건강이 속히 회복되셔서 언니와 더 좋은 시간 보내시면 좋겠어요.
나이가 들면 늙는 것이 자연스러운 것이니까 받아들여야겠어.,마음의 어려움이 사라지고 건강하게 사셨으면 좋겠어요.
앞으로 저축을 잘 해서 나도 김 할머니처럼 재산을 늘려야겠어.,저축을 잘 하셔서 원하시는 만큼 넉넉한 재정 형편이 되시면 좋겠어요.
건강을 빨리 회복해서 나도 멋진 모습으로 다른 노인들과 잘 어울리면 좋겠어.,속히 건강을 회복하셔서 마음속의 어려움이 해결되면 좋겠어요.
치료를 잘 받고 약도 잘 먹어서 빨리 낫는 방법밖에는 없겠지.,건강을 빨리 회복하셔서 퇴원하시면 좋겠어요.
혼자서라도 운동을 열심히 하고 치료를 받아서 언젠간 친구를 이기고 말거야.,친구 분보다 더 먼저 정상에 오르시는 날이 빨리 오면 좋겠어요.
내가 더 무능력해 보이는 것 같아서 말하기 싫지만 아내에게 솔직하게 말하는 게 최선일 것 같아.,사용자님의 마음이 아내 분에게 잘 전해지기를 바랄게요.
아무래도 그렇지.,혹시 주변에 이 문제로 함께 의논할 만한 분이 계실까요?
부럽지. 앞으로 걱정이야.,혹시 주변에 이 문제에 대해 상의할 만한 분이 계실까요?
빨리 건강을 회복해서 경제 활동을 해야겠어.,빨리 건강을 회복하셨으면 좋겠어요.
생색을 내서 당황스럽지만 사실 친구가 오면 의지가 되고 좋은 부분이 큰 것 같아.,친구분이 오시면 의지가 되는 좋은 부분도 있으시군요.
글쎄. 내 병이 쉽게 고쳐지는 병도 아니고. 마음이 안 좋아.,사용자님의 마음이 조금이라도 좋아지셨으면 좋겠어요.
문화센터에 가서 노인들이 배워서 활용할 수 있는걸 찾아봐야겠어.,문화센터 방문이 도움이 되었으면 좋겠어요.
응. 아내에게 자극 받아 나도 내 일을 더 열심히 해야겠어.,이번 일이 내 일을 더 열심히 하게 되는 원동력이 되기를 바라요.
그때 나 혼자 천천히 생각을 정리하고 아내와 대화하며 잘 풀었지.,이번에도 대화로 잘 풀렸으면 좋겠어요.
아직은 체력이 남아있으니 운동이라도 새로 시작해야지 싶어.,운동의 시작이 좋은 전환점이 되었으면 좋겠어요.
보약이라도 주문하던지 해야겠어. 체력 때문에 운동하는 건데 별 도리가 없네.,보약을 드시고 체력증진에 도움이 되셨으면 좋겠네요.
쉬면서 자식들이랑 시간을 좀 보내면 힘이 날 것 같네.,자제 분들과 좋은 재충전 시간이 되었으면 좋겠네요.
응. 난 대학생때가 정말 좋았거든.,좋았던 기억에 부러운 마음이 더욱 드시나 봐요.
지금 이대로도 만족하는 법을 찾아내야겠지. 쉽진 않겠지만.,꼭 현재에 만족하는 법을 찾아내시길 바랄게요.
다른 친구 불러서 실컷 욕했었지. 지금 친구 좀 불러야겠다.,친구와의 대화로 지금의 감정을 전환시킬 수 있었으면 좋겠어요.
모르겠어. 그냥 혼자 욕이나 하고 있어야지.,그걸로 마음이 한결 편안해지길 바라요.
나도 그 친구를 깎아내리면 통쾌해. 다른 친구를 좀 만나야겠어.,다른 친구 분과의 대화로 마음이 나아지시길 바라요.
일을 그만두고 싶지만 현실적으로 불가능해. 지금 잠깐 쉬어야겠다.,잠시 동안의 휴식이지만 쉬시면서 마음에 여유가 가지시면 좋겠군요.
오랜만에 좋아하는 노래를 제일 큰 소리로 틀어봐야겠어.,노래 감상으로 마음이 편안해지신다면 좋을 것 같군요.
친구한테 전화해서 딸의 남자 친구 욕 좀 하려고.,친구와의 대화로 기분이 잘 풀어지시길 바라요.
내가 자랑할 일이 생기면 걔한테 전화했었지. 마침 자랑할 일이 있으니 전화 좀 해볼까?,선택하신 방법으로 기분이 나아지셨으면 좋겠네요.
맛있는 것 좀 먹으러 가야겠어. 아는 형님 부르려고.,형님과의 대화로 기분이 한결 나아지시길 바라요.
누님께 전화해서 조언을 구해볼래. 우리 누님이 씨이오거든.,누님과의 대화로 고민이 잘 해결되었으면 좋겠어요.
친구들한테 농담 반 진담 반으로 얘기해보는 게 좋겠어.,원활한 의사소통으로 기분이 나아지길 바라요.
오랜만에 산책을 좀 해야겠어. 바깥 공기를 마시며 걸으면 기분이 나아질 것 같아.,산책을 통해 지금의 감정에서 벗어나는 데 도움이 됐으면 좋겠어요.
그냥 잘래. 이럴 땐 자면 좀 나아지는 것 같아.,편안한 수면이 생각의 정리를 도울 수 있다면 좋겠어요.
아줌마들이랑 이야기를 하다가 돈 이야기가 나오면 대화 주제를 돌려야겠어.,친구 분들과의 일이 잘 해결되실 수 있길 바랄게요.
옛날 친구들한테 가서 아줌마들 흉이라도 실컷 봐야겠어.,기분이 풀리실 수 있길 바랄게요.
오늘은 밖에 나가서 혼자 바람이라도 쐬고 와야겠어.,기분전환으로 우울했던 것이 풀릴 수 있길 바랄게요.
황 노인에게 신경 쓰지 않으려고. 내가 돈이 적다고 해서 부끄러운 건 아니니까.,생각의 전환으로 조금이나마 기분이 풀릴 수 있길 바랄게요.
조금 부족하지만 어느 정도 좋은 옷을 몇 벌 사다가 입어야겠어.,일이 잘 풀릴 수 있도록 응원할게요.
돈이 부족하더라도 최대한 꾸준히 성실하게 살고 노인들이랑 친해져야지.,많은 분들과 긴 시간 친해지실 수 있도록 응원할게요.
자식들한테 자주 연락해주고 더 챙겨줘야겠지.,자녀분들과 대화가 잘 되시길 바랄게요.
화를 동네 아줌마들이랑 풀어야겠어. 그 아줌마들은 내 이야기를 잘 들어주니까.,그 화가 최대한 풀릴 수 있기를 바랄게요.
늙은이들도 할 수 있는 전단지 부업이 있다고 해서 알아보려고. 이 참에 옷 한 벌이라도 사야지.,열심히 하셔서 어느 정도 문제가 해결될 수 있길 바랄게요.
며칠간 쉬어야겠어. 많이 힘들었으니까.,한동안 편하게 쉬시길 바랄게요.
조금 당당해질 필요가 있다고 생각해. 돈이 전부는 아니니까.,그 생각이 오랫동안 지속되길 응원할게요.
아직 늦지 않았겠지? 지금부터라도 꾸준히 다이어트를 시작해야겠어.,꾸준한 다이어트를 통해 자신감을 얻을 수 있으면 좋겠어요.
지금이라도 내가 하고 싶었던 것들을 하면서 더 힘내야겠어.,하고 싶었던 일을 하며 기분이 좋아지셨으면 좋겠어요.
모르겠어. 나는 너무 초라한 사람인 것 같아.,마음이 괴로우실 것 같아요.
지금부터라도 건강관리를 해야겠어.,건강관리로 건강이 좋아지셨으면 좋겠어요.
인터넷에서 연예인들이 몸매 관리하는 비법 좀 알아봐야겠어.,인터넷에서 좋은 몸매 관리 비법들을 알아내셨으면 좋겠어요.
모르겠어. 생각할수록 괴롭고 내가 싫어져.,싫은 마음때문에 힘드실 것 같아요.
그래도 솔직하게 비법을 한번 물어봐야겠어.,최 씨에게 물어보셔서 건장한 몸을 같이 유지하셨으면 좋겠어요.
주말에 가족들과 자주 식사하는 자리를 마련해 볼까 해.,가족들과의 식사로 화목하게 지낼 수 있었으면 좋겠어요.
건강한 식단을 챙겨 먹고 꾸준히 운동을 해야겠어.,꾸준한 운동으로 체력을 유지하길 바라요.
최대한 불필요한 소비를 줄이고 저축을 좀 더 늘려볼 생각이야.,저축을 늘려서 돈을 모을 수 있었으면 좋겠네요.
적게 먹더라도 몸에 좋은 것 위주로 먹고 운동을 해볼 생각이야.,운동으로 건강을 유지하길 바라요.
눈 건강을 위해 먹는 음식이나 운동법이 있는지 물어볼 생각이야.,이장에게 물어서 눈 건강을 잘 유지해나가면 좋겠어요.
흰 머리를 적게 유지할 수 있는 모발 관리법이나 식이요법에 대해 물어볼 생각이야.,동생분께 물어보셔서 흰 머리를 적게 유지하실 수 있으면 좋겠어요.
건강과 좋은 기억력 유지를 위해 하는 식이요법이나 생활습관이 뭔지 물어보려고 해.,고 씨에게 물어보셔서 건강과 좋은 기억력을 유지하시면 좋겠어요.
이번 주부터 식단조절을 하고 운동을 열심히 해볼 생각이야.,식단조절과 운동을 꾸준히 해서 젊어 보였으면 좋겠네요.
아내와 대화하고 함께 있는 시간을 더 늘려야겠어.,아내와의 대화로 금슬이 더 좋아지면 좋겠어요.
내가 요즘 스트레스를 받았나봐. 가볍게 운동이라도 하며 떨쳐 내봐야지.,운동을 통해 스트레스를 없애실 생각이시군요.
신세 한탄 하며 술 한잔하고 싶어.,친구와 술을 나누며 스트레스를 풀 생각이시군요.
친구한테 밥이라도 사면서 털어놔야지. 이 나이에 숨겨서 뭐가 좋겠어.,친구분과 문제를 함께 해결하실 생각이시군요.
같이 일하는 친구랑 소주라도 하면서 사장 욕이나 하고 싶어.,친구분과의 대화로 스트레스를 해소하실 생각이시군요.
싸우더라도 한마디 해야겠어. 솔직하게 말해야 알 것 같아.,싸우더라도 솔직하게 내 생각을 표현하실 생각이시군요.
계속 참기에도 한계가 있겠지. 다음번에는 정확히 말해야겠어.,친구에게 솔직한 마음을 전하실 생각이시군요.
아무래도 은퇴 우울증이 온 것 같아. 상담을 받아보고 싶어.,우울증 때문에 상담이 필요하시군요.
한탄으로 달라질 게 없겠지? 앞으로 또 열심히 일할게.,더 나은 상황을 위해 노력하실 생각이시군요.
돌아보면 너무 나는 없이 지낸 것 같아. 나대로 사는 연습을 하고 싶어.,나만의 삶을 살기 위해 노력하실 생각이시군요.
친구가 괘씸하지만 내 문제도 있을 것 같아. 긍정적으로 보는 시선을 가질래.,긍정적인 시선으로 문제를 해결하려고 하시는군요.
가만 보면 부럽다기 보단 괜한 걱정이 앞섰는지도 몰라. 조금 여유를 가져야겠어.,여유를 가지고 노후자금 걱정을 덜길 바랄게요.
그래도 티 많이 안내면서 돈을 잘 썼어. 지금도 좋은 친구야.,친구분을 많이 좋아하시는군요.
아직은. 언제 한번 술 한잔하면서 이야기해보려고.,아직은 용기가 나지 않지만 언젠가는 푸실 생각이 있으시군요.
안 그래도 그 부분 때문에 친구와 얘기를 해보려고.,친구분과 허심탄회하게 이야기를 나누어보고 좋은 결과 있으면 좋겠어요.
얘기해보니깐 같이해 보자고 하더라고.,친구분과 같이 사업을 하길 원하시는군요.
