human,system
내가 성적도 더 좋은데 그 녀석이 좋은 회사에 들어갈 동안 나는 왜 못 들어갔을까?,이 상황을 변화시킬 방법이 있으신가요?
그 친구 수준에 거기를 다닐 수 있을 리가 없어.  너무 질투가 나.,지금 감정에서 벗어나기 위해서는 무엇을 할 수 있을까요?
동기가 내 도움으로 할 수 있었다고 말해줬으면 좋았을 걸. 동기를 보는 게 불편해졌어.,회사에서 신경이 많이 쓰이시겠어요. 어떻게 하면 상황이 좀 나아질까요?
회사 동기인데 일도 대충 하면서 사고만 치는데 사탕발림을 잘해서 매번 별일 없이 넘어가.,자주 사고를 쳐도 비위를 잘 맞추어서 무마하는 회사 동기가 있군요.
동기가 나나 별반 차이도 없는데 동기가 해결하는 것을 보니 자존심이 상하는 거야.,마무리를 못한 사용자님 자신에게 화가 나셨군요. 어떻게 해야 지금 이 기분이 풀리실까요?
친구보다 공부를 많이 해도 친구보다 성적이 낮아 서러워.,친구처럼 점수를 높일 수 있는 방법이 있을까요?
남자 친구랑 티브이를 보는데 나랑 비교하면서 무시해서 당황스러웠어.,당황스러우셨군요. 이 상황에서 할 수 있는 게 어떤 것이 있을까요?
나도 할 수 있는데 남자 직원들한테 기회를 더 많이 줘. 어떻게 해야 할까?,어떻게 하는 것이 가장 좋은 방법이라고 생각하시나요?
대학교 친구들끼리 음식점이나 카페를 찾아다니는데 내가 돈이 없어서 그런지 나를 안 불러.,이 상황에서 할 수 있는 것은 무엇이 있을까요?
나도 열심히 하는데 왜 하필 내가 싫어하는 동기만 나보다 좋은 학점을 받는 거야 .,어떻게 해야 현재의 상황을 변화시킬 수 있을까요?
동생은 고등학생이고 나는 성인이니까 다른 건데 왜 나랑 비교하는지 모르겠네.,상황을 바꾸기 위한 방법이 있을까요?
원래는 나보다 안 예뻤는데 성형을 하니까 나보다 더 예뻐져서 괜히 질투 났어.,어떻게 해야 현재의 상황을 바꿔나갈 수 있을까요?
나를 좋아하지 않는다는 건 알고 있었는데 남들 앞에서 나를 무시하는 것 같아서 창피하고 열 받아.,지금 느끼는 이 감정을 어떻게 하면 진정시킬 수 있을까요?
나는 이제 동생보다 나은 게 하나도 없는 것 같아서 당황스러워.,이런 기분에서 벗어나기 위해 어떤 마음가짐을 가질 수 있을까요?
나는 동기들보다 실적도 안 좋고 부족한 점들이 많아서 이걸 극복하고 싶어.,어떻게 하면 부족한 점들을 극복할 수 있을까요?
내가 능력은 있는데 회사에서 다른 사람들에 비해 별로 빛을 못 보는 것 같아.,회사에서 두각을 나타내지 못해서 기분이 좋지 않군요.
저번 프로젝트에서도 그랬었지만 이번에도 참여 인원을 보니 내가 뒤처질 것 같아. 너무 불안해.,많이 불안해하고 계시는군요. 어떻게 하는 것이 이 상황에 도움이 될 수 있을까요?
입사한 지 얼마 되지 않았는데 다른 동료들이 업무 능력이 뛰어나서 열등감을 느껴.,지금을 벗어나기 위해 무언가 할 수 있는 것이 있을까요?
다른 사람들도 나를 안쓰럽게 생각하는 것 같아서 당황스러워.,정말 당황스러우시겠어요. 현재의 상황에서 벗어나기 위해서 어떻게 하면 좋을까요?
동기가 실력이 월등하게 앞서 나가서 그 능력을 따라가기가 힘들어서 열등감 느껴.,어떻게 하면 이 열등감이 좀 사라질까요?
일을 잘하고 싶은 마음은 큰데 눈치를 보게 되어서 열등감을 느껴.,지금의 기분에서 벗어나기 위해 할 수 있는 게 뭐가 있는지 알 수 있을까요?
업무에 집중도 안 되고 자꾸 신경 쓰이기만 해.,신경이 쓰이시는군요. 업무에 집중을 하기 위해서 어떻게 하는 것이 좋을까요?
나도 열심히 하는데 동기보다 내가 모자란 게 뭔지 모르겠어.,열심히 하시는데 당황스러우시겠어요. 이 상황을 어떻게 받아들여야 할까요?
나보다 더 좋은 직장을 다니는 걸 보니까 열등감이 느껴지더라고.,지금 기분에서 벗어나기 위해 할 수 있는 게 뭐가 있을까요?
내 능력을 상사들이 언젠가 알아줄 날이 올까?,상사들에게 좋은 평가를 받기 위해 어떻게 하면 좋을 까요?
그 친구는 좋은 학교 출신에 집안도 부유해서 열등감이 생기게 돼서 마음이 괴로워.,동기인데 너무 잘 나가는 친구와 비교당하는 게 힘드신 거군요. 어떻게 이 상황을 이겨내고 싶으세요?
일을 나보다 빨리 처리하는 직원들 때문에 나 자신이 더욱 열등해 보이니 어디 가서 하소연하지도 못해.,다른 직원들과 비교당하는 것 같아 괴로우시겠어요. 어떻게 하면 이 상황을 벗어날 수 있을까요?
요즘 친구들은 우리 때와는 다르게 자기표현에 더욱 솔직하고 당당한 게 한편으론 엄청 부럽고 질투도 나.,젊은 세대들과의 직장생활을 어떻게 무리 없이 해나갈 수 있을까요?
내가 정말 열심히 가르치고 잘 되게 도와줬거든. 물론 축하해줄 일이지만 당황스럽긴 해.,마음을 안정시킬 있는 방법이 있을까요?
그 직원이 아무 불평도 안 하고 바로 일을 해서 더 미안해졌어.,불편한 마음을 달랠 방법이 있을까요?
일을 잘하면 인정하지만 그렇지 않으니까 이해가 안 돼. 다들 고정관념이 심해.,공평한 대우를 받지 못하는 것 같아 속상하시군요.
프로그램들을 잘 다루고 자격증도 많더라고 내가 너무 부족하게 느껴져 신경 쓰여.,많이 신경 쓰이시겠어요. 현재의 상황을 바꿀 수 있는 방법은 뭐가 있을까요?
평소 잘하던 업무에서 실수하니 열등감이 느껴져.,잘하던 업무를 실수해 열등감을 느끼셨군요. 어떻게 하면 이 감정을 극복할 수 있을까요?
이 나이에 마케팅이라는 새로운 분야에 도전한다는 일이 너무 힘들어 보여.,그런 기분을 풀기 위해서는 어떤 방법이 있을까요?
다 넘어졌는데 왜 나만 다쳤지? 나만 뼈가 부러졌어.,그런 일이 있으셨군요. 어떻게 대처하실 계획이신가요?
그것도 그렇지만 내가 죽으면 화환이 많이 오지 않을 거 같아 비교될까 봐 씁쓸해.,그러면 어떻게 하세요?
간염인데도 잘 다니네. 너무 열등감을 느껴서 힘들어.,너무 힘드실 것 같아요. 어떻게 하면 이 열등감을 극복할 수 있을까요?
내 몸뚱이는 문제가 있나? 내 스스로가 너무 한심해.,너무 속상하실 것 같아요. 어떻게 하면 이 속상한 기분에서 벗어날 수 있을까요?
누군가 나에게 벌을 내린 걸까? 나도 나이가 되면 건강하고 돈이 많은 삶을 살 줄 알았어서 더 당황스러워.,어떻게 하면 당황스러운 이 상황을 변화시킬 수 있을까요?
다른 사람들은 돈이 많으니까 나보다 건강하고 행복해보여. 자꾸 열등감을 가지게 돼.,이 상황을 어떻게 해야 긍정적으로 바꾸어나갈 수 있을까요?
나빼고 다 돈이 많은 것 같아서 열등감이 느껴져.,어떻게 하면 그 기분을 바꿀 수 있을까요?
나보다 아프고 가난한 사람이 없는 것 같이 느껴져. 잘못 살아온 것만 같아.,많이 힘드셨군요. 어떻게 하면 이 상황을 긍정적으로 변화시킬 수 있을까요?
나만 힘들게 사는 것 같다는 생각이 들어서 우울해.,그런 생각이 들어 힘드시겠어요. 그러한 기분을 전환하기 위해서 어떻게 하면 좋을까요?
나만 힘든 것 같아서 매번 비교하게 되는 것 같아.,어떻게 하면 비교를 안 할 수 있을까요?
나는 병원비 한번 받은 적 없는데 비교하게 돼,어떻게 하면 비교를 하지 않을 수 있을까요?
남편이 집을 나가서 내가 마음의 병이 생겼어.,병이 낫기 위해 어떻게 하면 좋을까요?
응. 나이 먹은 것도 서러운데 아파서 더 속상해.,지금 기분에서 벗어나기 위해 어떤 것을 할 수 있을까요?
응. 단지 돈이 없다는 이유로 사람을 아래로 봐서 속상해.,지금 이 기분에서 벗어나고자 한다면 무엇을 해 볼 수 있을까요?
응. 나를 사랑한 줄 알았는데 남편이 사랑한 건 결국 돈이었어.,마음이 힘들겠어요. 현재의 기분에서 벗어나기 위해 어떤 걸 할 수 있을까요?
응. 안 그래도 몸이 아픈데 간호사들이 나를 그렇게 대해서 황당해.,이 상황에 어떻게 대처해야 할까요?
난 팀원들과 잘 어울리지 못하거든.,그런 어려움을 겪으셨군요. 사람들과 더 잘 어울리기 위해 어떤 노력을 할 수 있을까요?
다른 친구들은 벌써 취직했는데 나만 그대로야. 나만 뒤처져 있는거 같아 힘들어.,친구들보다 뒤처져있다는 생각에 많이 힘드시군요.
젊어서 잘 나갔던 애들은 나이 들어서도 잘나가더라고.,특별히 그렇게 느끼신 이유가 있으세요?
나이가 들수록 비싸고 좋은 걸 사야 한다는 소리를 들으니 싼 것 만 사는 내가 문득 창피해졌어.,싼 것만 사는 사용자님이 창피해지셨군요.
스스로 열등감이 느껴지는 것 같아.,스스로 열등감이 느껴지는군요.
나 혼자 뒤떨어지니 친구들 만나기도 점점 싫어져. 열등감을 느끼는 것 같아.,친구들에게 열등감을 느껴 만나기가 싫어지는군요. 좋은 방법이 있을까요?
나도 그 동기만큼 더 노력을 해야겠어.,동기만큼 노력을 할 생각이시군요.
이래도 되는 건가 싶고. 답답하네.,어떻게 해야할지 몰라 당황스러우시겠군요.
다른 사람들은 연애를 잘하는 것 같아. 그런데 나만 못하는 것 같아 우울해.,다른 사람들은 연애를 잘하는 것 같아 우울하군요. 어떤 점 때문에 그렇게 생각하셨나요?
나 같은 사람을 누가 좋아하겠어.,본인을 좋아해 줄 사람이 없다는 생각에 결혼에 자신이 없으시군요. 
결혼 준비하면서 많이 서운하네. 무엇이든 다 부족하다고 생각하셔서 나 자신이 초라하게 느껴져.,결혼 준비로 많이 힘드실 텐데 스트레스도 심하겠네요.
내가 연락을 자주 하는 편인데 여자친구가 연락이 잘 안 되는게 큰 것 같아.,연락이 잘 안 되어 속상하셨겠어요. 어떻게 하면 사이가 다시 좋아질 수 있을까요?
최대한 생각을 안 하려고는 노력하고 있어. 하지만 결국은 내 가치를 높여서 연봉을 더 많이 받는 것이 낫겠지.,노력을 통해 직장에서의 대우를 더 좋게 만들려고 하시는군요.
친구들과 비교하지 말아야겠지? 나 자신을 존중하고 노력도 열심히 해야겠다.,노력하시려는 생각이 멋지네요.
아무래도 타인과 비교하지 말아야겠지? 나 자신을 존중하고 노력도 열심히 해야겠다.,나를 타인과 비교하지 않기 위해 노력하시는군요.
응. 내가 좋아하던 사람이긴 한데 막상 고백받고 나니 나와 어울리지 않는 것 같기도 하고 열등감 들어.,나와 어울리지 않는다라는 생각이 드는군요. 지금이 열등감에서 벗어나기 위해 지금 나는 어떤 것을 하면 좋을까요?
걘 뭘 하길래 나보다 성적이 좋은 건지 모르겠어.,성적을 올리기 위한 방법에는 무엇이 있을까요?
근데 이건 좋은 생각이 아니니까. 고치고 싶어.,고치기 위한 방법에는 무엇이 있을까요?
응. 친구들이 나도 잘 한다는 걸 알아줬으면 해.,친구들에게 인정을 받고 싶으시군요. 이 상황에서 할 수 있는 일에는 무엇이 있을까요?
쟨 분명히 놀기만 한 것 같았는데 왜 저렇게 잘하는 걸까.,이 상황을 극복할 만한 방법에는 무엇이 있을까요?
내가 왜 그랬는지 모르겠어. 당황스러워.,전에도 비슷한 상황이 있었나요? 있었다면 어떻게 행동하셨나요?
응. 그 애가 전학을 갔으면 좋겠다는 생각까지 들어서 당황스러워.,친구의 전학까지 바라는 이 상황을 해결할 수 있는 방법에는 무엇이 있을까요?
나도 과외 하면 점수를 더 올릴 수 있어. 괜히 화가 나.,나도 과외를 하면 공부를 잘 할 수 있는데 그렇지 못해서 화가 나는 군요.
형은 멀쩡한데 나만 암에 걸려서 속상해. 물론 형도 아프면 안 되지만.,정말 속상하시겠어요. 이런 상황에서 어떻게 하는 것이 좋을까요?
맞아. 왜 이렇게 무관심한지 좀 서운하기도 해.,그러면 어떻게 하는 것이 좋은 방법일까요?
왜 그럴까 너무 속상하고 자꾸 친구가 부러워져.,친구가 부러운 상황이군요. 어떻게 하는 것이 좋은 방법일까요?
주변 사람들은 다 퇴원하는 것 같은데 나는 아직도 입원 중이라서 속상해.,퇴원을 빨리 하기 위해서는 어떻게 해야 될까요?
형과 아내의 잘못이 아니라는 것을 알지만 자꾸만 형이랑 아내를 미워하게 되는 것 같아.,이런 상황을 어떻게 극복해야 될까요?
너무 속상하지 나도 손주가 보고 싶어.,손주가 보고 싶으시군요. 
얘기를 들을 때마다 나도 죽음이라는 것과 가까워진다는 게 자꾸 머릿속에서 떠오르네.,그런 생각이 들 때마다 어떻게 하며 기분을 달래셨나요?
쇠약해지니 걱정도 많아지고 불안하고 그래.,전과 다른 몸 상태라 그런 기분이 드시는군요. 어떻게 해야 이 상황을 변화시킬 수 있을까요?
어차피 아무도 신경 안 쓸 텐데 말이야. 난 희망을 버리고 단념했어.,희망을 버리고 단념하셨군요. 어떻게 하면 지금의 상황을 변화시킬 수 있을까요?
외로움을 달래줄 사람도 없고 산책이라도 다녀오는 게 좋을까?,지금의 기분을 벗어날 수 있는 방법이 있을까요?
아마도 손주들은 안아 주지도 못하는 나를 좋아하지 않을 거야.,안아주지 않아서 사용자 님을 좋아하지 않을 거라고 생각하시나요?
이렇게 형편이 안 좋을 바에는 차라리 아프고 마는 게 더 나을 것 같아.,어떻게 하면 지금 상황이 나아질 수 있을까요?
힘들 때마다 결혼이나 출산에 대한 후회도 되고 후회하는 나 자신이 너무 싫어져.,결혼과 출산이 후회되는 것이 힘드셨군요. 어떻게 하면 마음이 괜찮아질 수 있을까요?
내가 뭐가 부족해서 집안일만 하고 있는 걸까 생각할 때마다 너무 괴로워.,집안일만 하는 것 때문에 많이 괴로우셨군요. 어떻게 하면 괴로운 마음이 풀릴 수 있을까요?
왜 나는 이렇게 우울한 걸까? 나는 잘못한 것도 없는데 말이야.,어떻게 해야 지금 감정이 좋아질 수 있을까요?
그냥 내가 식욕이 없는 편인 줄 알았는데 그게 아닌 걸 알고 나니 더 우울한 것 같아.,우울증인 걸 알고 나니 더 마음이 괴로우셨군요. 지금 기분이 풀리려면 어떤 방법이 좋을까요?
왜 나만 이렇게 운이 없는지 속상해.,어떻게 하면 속상한 기분을 나아지게 할 수 있을까요?
왜냐면 남편이 빌려줬었던 돈이 우리 노후자금이었어서 너무 화가 나.,많이 화가 나는 것 같은데 어떻게 상황을 바꿔나갈 수 있을까요?
자격지심이겠지. 나보다 부자고 자식들도 잘나가니 나쁜 마음이 들었어.,어떻게 해야 자격지심과 나쁜 마음을 없앨 수 있을까요?
맞아 하는 것도 다르고 다들 뭘 모르고 성적만 비교해서 속상해.,자신의 장점을 더욱 발전시켜서 어른들께 자랑해보는 것은 어때요?
그런데 인사과에 고발을 막상 하니까 내가 나쁜 사람인 것 같아서 기분이 별로야.,지금 기분에서 벗어나기 위해 무엇을 할 수 있을까요?
난 무슨 행동을 해도 그 녀석을 뛰어넘을 수 없는 것 같아. 어떻게 하지?,이 상황을 변화시킬 수 있는 방법이 있나요?
그전까지 기대받는 유망주는 나였어. 앞으로도 그래야만 한다고.,어떻게 하면 이 상황을 변화시킬 수 있을까요?
주로 내가 하던 일이었는데 요즘 동기가 팀장님의 눈에 잘 들었나 봐. 기분이 좀 별로야.,동기가 상사에게 잘 보였나 보네요. 앞으로 어떻게 하는 게 좋을까요?
젊은 직원에게 나도 아직 살아있다는 자존심을 보여주려고 못 먹는 술을 과하게 먹은 것이 화근이었어.,경쟁심 때문에 웃음거리가 되셨나 봐요. 어떻게 하면 좋을까요?
이 제안을 내가 해낼 수 있을지 너무 걱정돼.,제안을 해낼 수 있을지 걱정이 되는군요. 어떻게 하면 그 감정이 나아질까요?
그동안 다른 사람들보다 건강을 못 챙긴 거에 많이 후회스러워.,후회스러운 그 감정을 어떻게 하면 극복할 수 있을까요?
사실 나는 운전이 무서워서 면허가 없어.,운전이 무서워서 면허가 없으시군요.
응. 내가 대학교도 수석 입학했고 여태까지 과 일등이었어.,여태까지 일등을 하셨었군요.
우리나라는 그 사람의 실력보다 배경을 너무 중요하게 따지는 것 같아.,취업하시고 싶으신 곳이 지금 사시는 지역이 아니신가요?
걘 뭘 하길래 나보다 성적이 좋은 건지 모르겠어. 열등감 생겨.,정말 속상하시겠어요. 어떻게 하면 이 열등감이 사그라들 수 있을까요?
나보다 공부를 못하는 것 같은데 자꾸 그 친구가 신경 쓰여. 열등감이 생겨.,지금의 감정에서 벗어나려면 어떻게 해야 좋을까요?
근데 이건 좋은 생각이 아니니까. 고치고 싶어.,고치기 위한 방법에는 무엇이 있을까요?
응. 친구들이 나도 잘 한다는 걸 알아줬으면 해.,이 상황에서 내가 할 수 있는 일에는 무엇이 있을까요?
쟨 분명히 놀기만 한 것 같았는데 왜 저렇게 잘하는 걸까.,이 상황을 극복할 만한 방법에는 무엇이 있을까요?
내가 왜 그랬는지 모르겠어. 당황스러워.,이 당황스러운 감정을 어떻게 하면 줄일 수 있을까요?
응. 그 애가 전학을 갔으면 좋겠다는 생각까지 들어서 당황스러워.,이 상황을 해결할 수 있는 방법에는 무엇이 있을까요?
나도 과외 하면 점수를 더 올릴 수 있다는 생각 때문에 괜히 화가 나.,이 상황을 해결할 수 있는 방법에는 무엇이 있을까요?
언니가 상장을 엄청 받아왔어. 그런데 나는 하나도 못 받아왔어.,언니는 상장을 엄청 받아왔지만 하나도 받지 못했군요.
공부를 열심히 해서 이번 중간고사에는 성적을 많이 올려야겠어.,중간고사 성적을 올리는 방법으로 열등감을 극복하려 하시는 군요.
지금 가지고 있는 돈을 주식에 투자해 볼까봐. 그러면 수익이 많이 생길 것 같아.,주식에 투자하는 것으로 돈을 모으려고 하시는 군요.
나보다 더 어려운 사람들을 생각하며 감사하는 마음을 가져야 겠어.,경제적으로 더 어려운 사람들을 생각하면서 감사하다 생각하려 하시는 군요.
그 부부도 망해서 나처럼 일을 하고 살아갔으면 좋겠어. 정말 부러워 미칠 지경이야.,여유로운 생활을 하는 옆집 부부를 보고 질투심이 생겼군요.
부럽기도 하고 열등감마저 느끼고 있어.,몸이 아파서 건강한 사람들에게 부러움과 열등감을 느끼고 계시군요.
내일 친구에게 솔직하게 말하려고 해.,솔직한 대화를 통해 친구와의 관계를 회복하려 하시는군요.
한참 어린 사람을 상사로 두니 내가 초라해 보여. 잠시 머리 식힐 겸 휴가라도 낼까 봐.,초라하다고 느끼는 걸 휴가를 통해 달래고 싶으시군요.
운동을 하면 몸이 나아지려나. 친구들은 골프 친다는데 그런 거는 꿈도 못 꾸니 운동이나 해볼 까 싶네.,운동을 통해 건강을 회복하려고 하시는군요.
응. 차라리 다른 팀이면 좋았을텐데. 기분이 별로야.,같이 입사한 동기가 먼저 승진을 하니 기분이 별로시군요.
언니는 공부도 잘하고 예뻐. 거기에 비하면 나는 공부도 못하고 예쁘지도 않아.,언니와 비교가 돼서 열등감이 드시는군요.
운동을 해서 근육을 키워볼까? 만만해 보이지 않게.,학교 따돌림 문제를 운동으로 해결하실 생각이군요.
남들은 일 점이라도 더 얻는데 난 그대로니깐.,남들과 학업 성적이 비교되어 속상하시군요.
언니는 어떤 옷을 입어도 예쁜데 나는 그렇지 않으니깐 말이야.,언니와 비교가 돼서 열등감이 드시는군요.
일등 유지하려고 친구들하고도 어울리지도 않잖아!,일등을 유지하려고 놀지도 않는 친구를 보고 짜증이 나셨군요.
아무래도 과외를 받아보는 게 좋을 거 같아.,성적을 위해 과외를 받으실 생각이군요.
내가 못생기고 힘도 없어서 그런가봐.,학교 폭력을 당하고 자신감이 떨어지셨군요.
주변은 돈도 많이 모아둬서 여행 다니던데 나는 은퇴하고 또 일하게 생겼어.,주변과 비교되어 열등감이 느껴지시는군요.
아내가 잘난 척하길래 꼴보기 싫어서 나도 모르게 욕을 햇어.,아내분의 잘난척에 자신도 모르게 욕을 해서 당황스러우셨겠어요. 어떻게 하는 게 좋을까요?
형이 키가 크거든. 그게 너무 부러워서 나도 키 크려고 우유를 먹고 있어.,싫은 것을 안하면서 키가 클 방법은 없을까요?
응 나도 같은 손자인데 형한테만 더 주니 기분이 안좋아.,할머니가 형과 똑같이 용돈을 주시게 하려면 어떻게 해야 할까요?
맞아. 왜 이렇게 무관심한지 자식들에게 좀 서운하기도 해.,자식들에게 서운하시군요. 이 문제에 관해 자식들과 어떻게 대화해야 좋을까요?
왜 그럴까 너무 속상하고 자꾸 친구가 부러워져.,친구가 부러워서 속상하시군요. 어떻게 해야 열등감이 조금이라도 줄어들까요?
내가 나이가 들어서 빨리 낫지 않나 봐. 혼자 남으니까 속상하네.,나이가 들어 몸이 빨리 낫지 않은 탓에 혼자 남아서 속상하시군요. 속상함이 조금이라도 없어지려면 어떻게 해야 좋을까요?
형과 아내의 잘못이 아니라는 것을 알지만 자꾸만 형이랑 아내를 미워하게 되는 것 같아.,형과 아내에게 미운 마음이 드시는군요. 어떻게 해야 열등감이 조금이라도 사라질까요?
내가 이 병이 걸리고 싶어서 걸린 것도 아니고 진짜 너무 속상해.,병에 걸려서 속상하시군요. 어떻게 해야 열등감이 조금이라도 사라질까요?
너무 속상하지. 나도 손주가 보고 싶어.,손주를 많이 보고 싶으시군요. 어떻게 해야 열등감이 조금이라도 없어질까요?
아마도 손주들은 안아 주지도 못하는 나를 좋아하지 않을 거야.,왜 그렇게 생각하세요?
내가 무언가 가르쳐주려고 할 때마다 비웃는 것 같기도 하고 다 아는 거라고 듣질 않아.,자녀들이 커가니까 그런 문제가 생기는군요. 너무 상심하지 않길 바래요.
내일 친구랑 얘기해보려고.,친구랑 얘기해보는 방법을 선택하셨군요.
그래 나랑 동갑인데 무릎이 안아픈걸까? 비법이 뭔지 물어봐야겠어.,무릎이 안 아픈 비법이 뭔지 물어보는 방법을 선택하셨군요.
일단 건강에 좋다고 하는 건 다 시도할래.,일단 건강하다 알려진 것들을 다 하는 방법을 선택하셨군요.
다음 진급 때 좋은 결과가 나올 수 있도록 열심히 일하고 자기계발도 해볼 생각이야.,다음 진급을 위해 자기계발을 하려고 하시는군요.
나도 피부도 좀 가꾸고 화장도 좀 해야겠어.,외모를 가꿀 생각이시군요.
내가 남들보다 얼마나 더 할 수 있을지 모르겠어.,남들과 비교되는 자신의 모습에 열등감을 느끼셨군요.
응. 나도 저기 아파트 사 놨어야 했는데 아쉽다.,아파트를 미리 사놓지 않은 것이 많이 아쉬우시군요.
공부 잘하는 친구들하고 공부해 보면서 비결을 알아낼 거야.,공부 잘하는 친구들의 비법을 알아낼 생각이시군요.
나 혼자만 괴롭힘을 당하니 열등감이 느껴지지.,반에서 혼자만 괴롭힘을 당해 속상하시겠어요.
응. 이게 열등감인가? 자꾸 그 사람과 나를 비교하게 되네.,옆집 사람과 자신을 비교하면서 열등감이 들었군요.
그래. 나도 학원에 다니면 그 친구만큼 공부를 잘 할 수 있을 텐데.,공부를 잘하는 방법에는 어떤 것이 있을까요?
내가 걔보다 못난 것 같고 기분이 나빴어.,어떻게 하면 지금보다 나은 기분이 될까요?
옆 반 친구는 부모님이 노트북도 사주셨다는데 우리 부모님은 핸드폰도 바꿔주지 않아.,어떻게 하면 마음이 나아질까요?
언니에게만 좋은 거 주고 학원도 보내줘. 나도 학원 가고 싶어.,언니만 챙기는 상황이 정말 속상하셨군요. 앞으로는 어떻게 할 건가요?
